titre,url
Noreva Exfoliac Acnoméga 200 Soin Correcteur Intensif Points Noirs – 30ml,https://citymall-para.ma/produit/noreva-exfoliac-acnomega-200-soin-correcteur-intensif-points-noirs-30ml/
NOVOBAC Lingette 120,https://citymall-para.ma/produit/novobac-lingette-120/
Nûby Biberon Polycarbonate Col Large Imprimé Avec Tétine Softflex™ Anti-Coliques – Débit Lent – 180ml,https://citymall-para.ma/produit/nuby-biberon-polycarbonate-col-large-imprime-avec-tetine-softflex-anti-coliques-debit-lent-180ml/
NUK sucette bébé Sensitive 0-6 mois silicone,https://citymall-para.ma/produit/nuk-sucette-bebe-sensitive-0-6-mois-silicone/
NUK Sucette Happy Days T2 En Silicone 6-18 mois,https://citymall-para.ma/produit/nuk-sucette-happy-days-t2-en-silicone-6-18-mois/
O-Plastine Crème De Change 30G,https://citymall-para.ma/produit/o-plastine-creme-de-change-30g/
OLEOSKIN Talc a l’allantoine 100gr,https://citymall-para.ma/produit/oleoskin-talc-a-lallantoine-100gr/
Omégas Huile de Soin Booster aux 5 Omégas Bio 30 ml,https://citymall-para.ma/produit/omegas-huile-de-soin-booster-aux-5-omegas-bio-30-ml/
Omron Nébuliseur à compresseur léger NE-C801,https://citymall-para.ma/produit/omron-nebuliseur-a-compresseur-leger-ne-c801/
PACK Biberon Anticolic 160ml + Sucette Night 0-6m + Mini Vanity,https://citymall-para.ma/produit/pack-biberon-anticolic-160ml-sucette-night-0-6m-mini-vanity/
Pansoral Premières Dents – 15 Ml,https://citymall-para.ma/produit/pansoral-premieres-dents-15-ml/
Panthenol Baby-Crème Universelle 70 ml,https://citymall-para.ma/produit/panthenol-baby-creme-universelle-70-ml/
PHY BÉBÉ Sérum Physiologique 30*5ml,https://citymall-para.ma/produit/phy-bebe-serum-physiologique-455ml-2/
PHY BÉBÉ sérum physiologique 45*5ml,https://citymall-para.ma/produit/phy-bebe-serum-physiologique-455ml/
PLACENTOR Crème Gommante 50ml,https://citymall-para.ma/produit/placentor-creme-gommante-50ml/
Pti Doux Biberon Classique Col Etroit Pm 125 Ml,https://citymall-para.ma/produit/pti-doux-biberon-classique-col-etroit-pm-125-ml/
Pti Doux Sucette Auto Fermeture,https://citymall-para.ma/produit/pti-doux-sucette-auto-fermeture-2/
Pti Doux Sucette Simple Pouce,https://citymall-para.ma/produit/pti-doux-sucette-simple-pouce-2/
Pti Doux Tétine Large 3 Vitesses Transparent,https://citymall-para.ma/produit/pti-doux-tetine-large-3-vitesses-transparent/
Pti-Doux Biberon Avec Poignee Gm 300ML,https://citymall-para.ma/produit/pti-doux-biberon-avec-poignee-gm-300ml/
Pti-Doux Biberon Simple 150ML,https://citymall-para.ma/produit/pti-doux-biberon-simple-150ml/
PUR attache sucettes /2 4501,https://citymall-para.ma/produit/pur-attache-sucettes-2-4501/
PUR Manicure Set Bébé,https://citymall-para.ma/produit/pur-manicure-set-bebe/
PUR Peigne Bébé,https://citymall-para.ma/produit/pur-peigne-bebe-2/
PUR Plat walrus avec couvert 5501,https://citymall-para.ma/produit/pur-plat-walrus-avec-couvert-5501/
PUR Sucette Ortho 6M+ 89001,https://citymall-para.ma/produit/pur-sucette-ortho-6m-89001/
PUR Sucette ORTHO M3+,https://citymall-para.ma/produit/pur-sucette-ortho-m3/
PUR SUCETTE ORTHO S 0+,https://citymall-para.ma/produit/pur-sucette-ortho-s-0/
Racine Vita Beauté De rose 40ml,https://citymall-para.ma/produit/racine-vita-beaute-de-rose-40ml/
SANTE BIO Crème de change 30G,https://citymall-para.ma/produit/sante-bio-creme-de-change-30g/
Skin Chemists Tranexamique Sérum 30ml,https://citymall-para.ma/produit/skin-chemists-tranexamique-serum-30ml/
SkinChemists Serum Pure Au Collagène 5% 30ml,https://citymall-para.ma/produit/skinchemists-serum-pure-au-collagene-5-30ml/
SkinChemists Soin Hydratant Anti-Âge De Jour Au Quartz Rose 50ml,https://citymall-para.ma/produit/skinchemists-soin-hydratant-anti-age-de-jour-au-quartz-rose-50ml/
Skining Skinconfort+ 65g,https://citymall-para.ma/produit/skining-skinconfort-65g/
SLEEPY  Jeans Pants Couches t/3 4-9kg /34 (culotte),https://citymall-para.ma/produit/sleepy-jeans-pants-couches-t-3-4-9kg-34-culotte/
Sleepy Jeans Couche Culotte Taille 5 junior (11-18 KG),https://citymall-para.ma/produit/sleepy-jeans-couche-culotte-taille-5-junior-11-18-kg/
Sleepy Jeans Couche-Culotte Taille 6 XLarge (15-25 KG),https://citymall-para.ma/produit/sleepy-jeans-couche-culotte-taille-6-xlarge-15-25-kg/
Sleepy Jeans Couches Culottes Maxi Taille 4 – (7-14kg),https://citymall-para.ma/produit/sleepy-jeans-couches-culottes-maxi-taille-4-7-14kg/
Sleepy Jeans Couches Culottes XL Taille 6 – (15-25kg) 20,https://citymall-para.ma/produit/sleepy-jeans-couches-culottes-xl-taille-6-15-25kg-20/
"Sleepy Natural 5, Pants Nuit Junior 11-20kg/24pcs",https://citymall-para.ma/produit/sleepy-natural-5-pants-nuit-junior-11-20kg-24pcs/
"Sleepy Natural 6, Pants Nuit Taille X-Large 15-27kg/20pcs",https://citymall-para.ma/produit/sleepy-natural-6-pants-nuit-taille-x-large-15-27kg-20pcs/
Sleepy Natural Bambou Couches Bébés Double Mini Taille 2,https://citymall-para.ma/produit/sleepy-natural-bambou-couches-bebes-double-mini-taille-2/
Sleepy Natural Bambou Couches Bébés Junior Taille 5,https://citymall-para.ma/produit/sleepy-natural-bambou-couches-bebes-junior-taille-5/
Sleepy Natural Bambou Couches Bébés Maxi Taille 4,https://citymall-para.ma/produit/sleepy-natural-bambou-couches-bebes-maxi-taille-4/
Sleepy Natural Bambou Couches Bébés Midi Taille 3+,https://citymall-para.ma/produit/sleepy-natural-bambou-couches-bebes-midi-taille-3/
Sleepy Natural Bambou Couches Bébés XL Taille 6,https://citymall-para.ma/produit/sleepy-natural-bambou-couches-bebes-xl-taille-6/
Sleepy Natural Bambou Couches Nouveaux-nés Taille 1,https://citymall-para.ma/produit/sleepy-natural-bambou-couches-nouveaux-nes-taille-1/
Sleepy Natural Bambou couches XX-Large Taille 7,https://citymall-para.ma/produit/sleepy-natural-bambou-couches-xx-large-taille-7/
Sleepy Natural Lingettes 40pcs,https://citymall-para.ma/produit/sleepy-natural-lingettes-40pcs/
SODERMIX crème cicatrisante,https://citymall-para.ma/produit/sodermix-creme-cicatrisante/
Stelatopia Gel Lavant 200ml,https://citymall-para.ma/produit/stelatopia-gel-lavant-200ml/
Sterimar Hygiène du nez bébé,https://citymall-para.ma/produit/sterimar-hygiene-du-nez-bebe-2/
Sterimar nez fragilise (soufre) 50ml,https://citymall-para.ma/produit/sterimar-nez-fragilise-soufre-50ml/
Sterimar Spray Nasal 100 ml,https://citymall-para.ma/produit/sterimar-spray-nasal-100-ml/
Subliderm lait corps hydratant relipidant 250ml,https://citymall-para.ma/produit/subliderm-lait-corps-hydratant-relipidant-250ml/
Sucette Physiologique Nuit Silicone 18m+ – Coloris Aléatoire,https://citymall-para.ma/produit/sucette-physiologique-nuit-silicone-18m-coloris-aleatoire/
Sun Delight Bout De Sein,https://citymall-para.ma/produit/sun-delight-bout-de-sein/
Sun Delight Ciseau pour Bébé,https://citymall-para.ma/produit/sun-delight-ciseau-pour-bebe/
Sun Delight tetine reglable,https://citymall-para.ma/produit/sun-delight-tetine-reglable/
Sveltesse  Corsaire  Microfibre  Minceur Chair Taille  L/XL,https://citymall-para.ma/produit/sveltesse-corsaire-microfibre-minceur-chair-taille-l-xl/
SVR PALPEBRAL BY TOPIALYSE CRÈME 15ML,https://citymall-para.ma/produit/svr-palpebral-by-topialyse-creme-15ml/
SVR SPIRIAL Déo Douche 400 ML,https://citymall-para.ma/produit/svr-spirial-deo-douche-400-ml/
SVR Sun Secure Brume 50+ 200ML,https://citymall-para.ma/produit/svr-sun-secure-brume-50-inv-200ml-s/
SVR Sun Secure Eau Solaire SPF50+ 200ML,https://citymall-para.ma/produit/svr-sun-secure-50-eau-solaire-biodegradable-200ml/
Svr Topialyse Baume Protect+ 200ml,https://citymall-para.ma/produit/svr-topialyse-baume-protect-200ml/
Test de Grossesse HCG Healgen Boite 25 Test,https://citymall-para.ma/produit/test-de-grossesse-hcg-healgen-boite-25-test/
Tétine Ortho en Silicone 2,https://citymall-para.ma/produit/tetine-ortho-en-silicone-2/
Thermomètre de bain Nuk,https://citymall-para.ma/produit/thermometre-de-bain-nuk/
Tymodril Bain de Bouche 250ml,https://citymall-para.ma/produit/tymodril-bain-de-bouche-250ml/
Uriage Age Protect Crème Peeling Nuit Multi-Actions  50ml,https://citymall-para.ma/produit/uriage-age-protect-creme-peeling-nuit-multi-actions-50ml/
URIAGE BARIEDERM Cica Crème Réparatrice CU-ZN 40ML,https://citymall-para.ma/produit/uriage-bariederm-cica-repar-cu-zn-40ml/
URIAGE BARIEDERM-CICA CRÈME SPF50 AU CUIVRE-ZINC 40ML,https://citymall-para.ma/produit/uriage-bariederm-cica-spf50-creme-40ml/
URIAGE BARIEDERM-CICA HUILE DERMATOLOGIQUE VERGETURES 100ML,https://citymall-para.ma/produit/uriage-bariederm-cica-huile-100ml/
URIAGE BARIÉDERM-CICA Onguent Fissures Crevasses 40G,https://citymall-para.ma/produit/uriage-bariederm-cica-fissures-crevasses-pot-40g/
URIAGE BARIÉSUN Fluide Anti-Taches SPF50+ 40ml,https://citymall-para.ma/produit/uriage-bariesun-spf50-fluide-anti-taches-40ml/
URIAGE BARIESUN SPRAY SPF50+ 200ML,https://citymall-para.ma/produit/uriage-bariesun-50-spray-ad-200ml/
URIAGE BÉBÉ 1ER Cold Cream 75ML,https://citymall-para.ma/produit/uriage-bebe-1er-cold-cream-75ml/
URIAGE BÉBÉ 1ER Crème Change 100ML,https://citymall-para.ma/produit/uriage-bebe-1er-creme-change-100ml/
Uriage Bébé 1er Lait Hydratant  500ml,https://citymall-para.ma/produit/uriage-bebe-1er-lait-hydratant-500ml/
URIAGE BÉBÉ 1ÈRE CRÈME HYDRA-PROTECTRICE  40ML,https://citymall-para.ma/produit/uriage-bebe-1ere-creme-hydra-protectrice-40ml/
Uriage Bébé 1ère Eau Nettoyante Douce  500ml,https://citymall-para.ma/produit/uriage-bebe-1ere-eau-nettoyante-douce-500ml/
URIAGE BÉBÉ 1ÈRE HUILE LAVANTE APAISANTE  500ML,https://citymall-para.ma/produit/uriage-bebe-1ere-huile-lavante-apaisante-500ml/
URIAGE BEBE 1ÈRE SENTEUR 50ML,https://citymall-para.ma/produit/uriage-bebe-1ere-senteur-50ml/
Uriage Bébé 1ère Senteur Eau de Soin Parfumée 50ml,https://citymall-para.ma/produit/uriage-bebe-1ere-senteur-eau-de-soin-parfumee-50ml/
Uriage Bébé 1ère Trousse Voyage,https://citymall-para.ma/produit/uriage-trousse-1ere-soins-bebe-cr-lav-50mleau-nett-100mleau-therm-50mllait-hydrat-50ml/
URIAGE BÉBÉ 1ÈRES LINGETTES NETTOYANTES EXTRA-DOUCES 70 UNITÉS,https://citymall-para.ma/produit/uriage-bebe-1eres-lingettes-nettoyantes-extra-douces-70-unites/
Uriage Xemose huile nettoyante 400ml,https://citymall-para.ma/produit/uriage-xemose-huile-nettoyante-400ml/
Vitallaitement Vitamines + Minéraux 60 Gélules,https://citymall-para.ma/produit/vitallaitement-vitamines-mineraux-60-gelules/
Vitamine E 10ml Nature Soin,https://citymall-para.ma/produit/vitamine-e-10ml-nature-soin/
WaterWipes Lingette BÉBÉS à l’Eau 28 Lingettes,https://citymall-para.ma/produit/waterwipes-lingette-bebes-a-leau-28-lingettes/
WaterWipes Pack Lingettes bébé 4×60 unités,https://citymall-para.ma/produit/waterwipes-pack-lingettes-bebe-4x60-unites/
Xibei Coupe ongles bb xb-306,https://citymall-para.ma/produit/xibei-coupe-ongles-bb-xb-306/
Yuwell Thermomètre Frontal infrarouge Sans Contact pour Enfants Bébé et Adultes,https://citymall-para.ma/produit/yuwell-thermometre-frontal-infrarouge-sans-contact-pour-enfants-bebe-et-adultes/
3Chenes Push-Up Gel Sculpteur Fessier 200ml,https://citymall-para.ma/produit/3chenes-push-up-gel-sculpteur-fessier-200ml/
A-Derma dermalibour barrier creme 50ml,https://citymall-para.ma/produit/a-derma-dermalibour-barrier-creme-50ml/
A-DERMA EPITHELIALE A.H CREAM 40ML,https://citymall-para.ma/produit/a-derma-epitheliale-a-h-cream-40ml/
A-DERMA EXOMEGA CONTROL CREME EMOLLIENTE 200ML,https://citymall-para.ma/produit/a-derma-exomega-control-creme-emolliente-200ml/
A-derma exomega control gel moussant emollient 200ml,https://citymall-para.ma/produit/a-derma-exomega-control-gel-moussant-emollient-200ml/
A-derma Exomega Control Gel Moussant Emollient 500ml,https://citymall-para.ma/produit/a-derma-exomega-control-gel-moussant-emollient-500ml/
A-derma Exomega control huile lavante emolliente 200ml,https://citymall-para.ma/produit/a-derma-exomega-control-huile-lavante-emolliente-200ml/
A-DERMA PAIN DERMATOLOGIQUE SANS SAVON AU LAIT D’AVOINE 100G,https://citymall-para.ma/produit/a-derma-pain-dermatologique-sans-savon-au-lait-davoine-100g/
A-Derma phys-AC global creme 40ml,https://citymall-para.ma/produit/a-derma-phys-ac-global-creme-40ml/
A-Derma phys-ac Perfect fluide anti-imperfection 40ml,https://citymall-para.ma/produit/a-derma-phys-ac-perfect-fluide-anti-imperfection-40ml/
Abcderm change intensif 75 g,https://citymall-para.ma/produit/abcderm-change-intensif-75-g/
Bioderma Abcderm Cold-Cream Crème Lavante 1L,https://citymall-para.ma/produit/abcderm-cold-cream-1l/
Bioderma Abcderm Cold Cream Corps 200 ml,https://citymall-para.ma/produit/abcderm-cold-cream-corps-200-ml/
Bioderma Abcderm Cold Cream Pour Visage Nourrissante 45 ml,https://citymall-para.ma/produit/abcderm-cold-creme-45ml/
Bioderma Abcderm Gel Moussant 1L,https://citymall-para.ma/produit/bioderma-abcderm-gel-moussant-1l/
Bioderma Abcderm gel moussant 200 ml,https://citymall-para.ma/produit/abcderm-gel-moussant-200-ml/
ABCDERM H2O SOLUTION MICELLAIRE POMPE INVERSÉE  1L,https://citymall-para.ma/produit/abcderm-h2o-solution-micellaire-pompe-inversee-1l/
Bioderma Abcderm Lait De Toilette Sans Rincage 500 ml,https://citymall-para.ma/produit/bioderma-abcderm-lait-de-toilette-sans-rincage-500-ml/
Bioderma ABCderm Pack Shampooing 200ml+Gel Moussant 200+Change Intensif 75g Avec Sac Gratuit+Gel Moussant,https://citymall-para.ma/produit/bioderma-abcderm-pack-shampooing-200mlgel-moussant-200change-intensif-75g-avec-sac-gratuitgel-moussant/
Abena Serviettes Maternite 14pcs,https://citymall-para.ma/produit/abena-serviettes-maternite-14pcs/
Acm Boreade Global Soin Complet 40ml,https://citymall-para.ma/produit/acm-boreade-global-soin-complet-40ml/
Acm Boreade Sl Soin Lissant 40 ml,https://citymall-para.ma/produit/acm-boreade-sl-soin-lissant-pmg-40ml/
Acm Melatrio soin depigmentant intensif 30ml,https://citymall-para.ma/produit/acm-melatrio-soin-depigmentant-intensif-30ml/
Acnewin creme A.I 40ml,https://citymall-para.ma/produit/acnewin-creme-a-i-40ml/
Acnewin gel nettoyant purifiant 200ml,https://citymall-para.ma/produit/acnewin-gel-nettoyant-purifiant-200ml/
Acnewin Hydra creme 72H 50ml,https://citymall-para.ma/produit/acnewin-hydra-creme-72h-50ml/
Actigel Surgras Doux Peaux Seches Acti Ceutic 200ml,https://citymall-para.ma/produit/actigel-surgras-doux-ps-acti-ceutic-200ml/
Noreva Actipur BB Crème Anti-Imperfections Teintée Dorée – 30ml,https://citymall-para.ma/produit/noreva-actipur-bb-creme-anti-imperfections-teintee-doree-30ml/
NOREVA Actipur Crème Tube 30Ml,https://citymall-para.ma/produit/actipur-cream-tube-30ml/
Actipur Gel Nettoyant Tbe 150M,https://citymall-para.ma/produit/actipur-gel-nettoyant-tbe-150m/
ADA comfort couches adulte L paquets 25pcs,https://citymall-para.ma/produit/ada-comfort-couches-adulte-l-paquets-25pcs/
Addax Hydrafeet Crème Revitalisante Pied,https://citymall-para.ma/produit/addax-hydrafeet-creme-revitalisante-pied/
Ainsifont Lingette Bebe 64pcs,https://citymall-para.ma/produit/ainsifont-lingette-bebe-64pcs/
Akileine Jambes Lourdes/Legere,https://citymall-para.ma/produit/akileine-jambres-lourdes-legere/
ALBADERME HQ Crème Dépigmentante 50ML,https://citymall-para.ma/produit/albaderme-hq-creme-depigmentante-50ml/
Andromede Coton Tige Baby 60pcs,https://citymall-para.ma/produit/andromede-coton-tige-baby-60pcs/
Andromede Coton Tige Buds 200pcs,https://citymall-para.ma/produit/andromede-coton-tige-buds-200pcs/
Apivita Apres Shampooing Kids Rose Et Miel 150ml,https://citymall-para.ma/produit/apivita-apres-shampooing-kids-rose-et-miel-150ml/
Apivita Gel Lavant Doux Kids Mandarin & Miel 250ml,https://citymall-para.ma/produit/apivita-gel-lavant-doux-kids-mandarin-miel-250ml/
Apivita Shampoing et Apres shampoing Kids Grenade et Miel 250ml,https://citymall-para.ma/produit/apivita-shampoing-et-apres-shampoing-kids-grenade-et-miel-250ml/
Ardennaise Calmante Pour Bebe,https://citymall-para.ma/produit/ardennaise-calmante-pour-bebe/
AsepsiXen Lingettes 72pcs,https://citymall-para.ma/produit/asepsixen-lingettes-72pcs/
AVÉNE CICALFATE EMULSION REPARATRICE POST-ACTE 40ML,https://citymall-para.ma/produit/avene-cicalfate-emulsion-reparatrice-post-acte-40ml/
AVÈNE PhysioLift Contour Yeux 15ML,https://citymall-para.ma/produit/av-physiolift-contour-yeux-15ml/
AVÈNE PHYSIOLIFT CRÈME NUIT 30ML,https://citymall-para.ma/produit/av-physiolift-cr-nuit-30ml/
AVÈNE XeraCalm A.D Huile Lavante Relipidante 400ML,https://citymall-para.ma/produit/av-xeracalm-huile-400ml/
AVENT BIBERON ANTI-COLIC 0M 125ML SCF810/62 TWIN PACK,https://citymall-para.ma/produit/avent-bib-ant-colic-0m-125ml-scf810-62-twin-pack/
AVENT Biberon Anti-Colic 125ML SCF810/61,https://citymall-para.ma/produit/avent-bib-anti-colic-125ml-scf810-61/
AVENT Biberon Anti-Colic 260ML SCF813/61,https://citymall-para.ma/produit/avent-bib-anti-colic-260ml-scf813-61/
AVENT Bib Natural +1m 260ML Scf070/24 Dragon+bib Natural 60ML Trousse,https://citymall-para.ma/produit/avent-bib-natural-1m-260ml-scf070-24-dragonbib-natural-60ml-trousse/
Avent Biberon Natural 0m 60ml Scf039/17 Single,https://citymall-para.ma/produit/avent-bib-natural-0m-60ml-scf039-17-single/
Avent Biberons Natural 125ml*2 Pack Scf030/27,https://citymall-para.ma/produit/avent-biberons-natural-125-ml2-pack-scf-030-27/
Avent Bib Natural en verre cam +1m 240ml scf053 17,https://citymall-para.ma/produit/avent-bib-natural-en-verre-cam-1m-240ml-scf053-17/
Avent Biberon Naturel +0m 125ml Scf030/17,https://citymall-para.ma/produit/avent-biberon-naturel-0m-125-ml-scf030-17/
Avent Biberon Naturel +1m 260ml Scf033/17-260ml,https://citymall-para.ma/produit/avent-biberon-naturel-1m-260-ml-scf033-17-260ml/
Philips Avent biberon naturel flaming 260ml +1m scf070/21,https://citymall-para.ma/produit/avent-bib-naturel-1m-260ml-scf070-21-flaming/
Avent Bib Naturel +1m 260ml Scf070/25 Unicorn,https://citymall-para.ma/produit/avent-bib-naturel-1m-260ml-scf070-25-unicorn/
Avent Bib Naturel 260ml Scf 070/21+Water Wipes lingettes Tech pack,https://citymall-para.ma/produit/avent-bib-naturel-260ml-scf-070-21water-wipes-lingettes-tech-pack/
Avent Bib Naturel en verre cam +0m 120ml scf051 17,https://citymall-para.ma/produit/avent-bib-naturel-en-verre-cam-0m-120ml-scf051-17/
Avent conservare 0m+ scf 618/10,https://citymall-para.ma/produit/avent-conservare-0m-scf-618-10/
Avent Coussinets par jour 24 pcs scf 254/24,https://citymall-para.ma/produit/avent-coussinets-par-jour-24-pcs-scf-254-24/
Avent NewBorn Anti-colic Gs Met +0m scf 806/60,https://citymall-para.ma/produit/avent-newborn-anti-colic-gs-met-0m-scf-806-60/
Avent Newborn starter set Naturel +0m scd301/01,https://citymall-para.ma/produit/avent-newborn-starter-set-naturel-0m-scd301-01/
Avent Newborn Starter set Pink +0m scd301/03,https://citymall-para.ma/produit/avent-newborn-starter-set-pink-0m-scd301-03/
AVENT STERILISER ET CONSERVER SCF291/00,https://citymall-para.ma/produit/avent-steriliser-et-conserver-scf291-00/
Avent Straw Cup 200ml/7oz Single Mixed scf796/00,https://citymall-para.ma/produit/avent-straw-cup-200ml-7oz-single-mixed-scf796-00/
Avent Straw Cup 300ml/10oz Single Mixed scf798/00,https://citymall-para.ma/produit/avent-straw-cup-300ml-10oz-single-mixed-scf798-00/
Avent Suc Ultra air Night 6-18m Scf376/20 Mix,https://citymall-para.ma/produit/avent-suc-ultra-air-night-6-18m-scf376-20-mix/
Avent Tetine natural 0m+ scf 041/27,https://citymall-para.ma/produit/avent-tetine-natural-0m-scf-041-27/
AZINC GROSSESSE BTE 30 GELLULE,https://citymall-para.ma/produit/azinc-grossesse-bte-30-gellule/
Babycare sweety tir lait en verre,https://citymall-para.ma/produit/babycare-sweety-tir-lait-en-verre/
Babyheart cr change+3en1 gel+lait+Talc+huile 250ml+cr hydratante sac,https://citymall-para.ma/produit/babyheart-cr-change3en1-gellaittalchuile-250mlcr-hydratante-sac/
"Bambo Nature 1, couches XS 2-4kg/22un",https://citymall-para.ma/produit/bambo-nature-1-couches-xs-2-4kg-22un/
"Bambo Nature 2, couches S 3-6 kg/30 un",https://citymall-para.ma/produit/bambo-nature-2-couches-s-3-6-kg-30-un/
"Bambo Nature 3, couches M 4-8 kg/52 un",https://citymall-para.ma/produit/bambo-nature-3-couches-m-4-8-kg-52-un/
"Bambo Nature 4, couches L 7-14kg/48un",https://citymall-para.ma/produit/bambo-nature-4-couches-l-7-14kg-48un/
"Bambo Nature 6, couches XXL +16 kg 40un",https://citymall-para.ma/produit/bambo-nature-6-couches-xxl-16-kg-40un/
Bambo Nature culotte d’apprentissage T4 L 7-14kg/20pcs,https://citymall-para.ma/produit/bambo-nature-culotte-dapprentissage-t4-l-7-14kg-20pcs/
Bambo Nature culotte d’apprentissage T6 xxl +18kg/18pcs,https://citymall-para.ma/produit/bambo-nature-culotte-dapprentissage-t6-xxl-18kg-18pcs/
Bébé Confort 2 Sucettes Reversible 18-36m Animals Bleu,https://citymall-para.ma/produit/bebe-confort-2-sucettes-reversible-18-36m-animals-bleu/
BC PHARMA BIOTINE B8 FORMULE FORTIFIANTE 40 GÉLULES,https://citymall-para.ma/produit/bc-biotine-b8-fortifiante-40gelules/
BC PHARMA BIOTINE B8 FORMULE FORTIFIANTE 80 GÉLULES,https://citymall-para.ma/produit/bc-biotine-b8-fortifiante-80-gelules/
Bc Pharma Propolis Vitamine C 40 Comprimés 500 mg,https://citymall-para.ma/produit/bc-propolis-vitamine-c-500mg-40cps/
Bc Pharma Propolis Vitamine C 80 Comprimés 500 mg,https://citymall-para.ma/produit/bc-propolis-vitamine-c-500mg-80cps/
BéBé Confort  2 Tétine Débit Variable +0m,https://citymall-para.ma/produit/bb-conf-2-tet-comfort-0m-debit-variable/
Bebe Confort  Bol  Sport 18M +,https://citymall-para.ma/produit/bb-conf-bols-sport-18m/
BéBé Confort  Goupillon En Silicon Anti-Rayure,https://citymall-para.ma/produit/bb-conf-goupillon-en-silicon-anti-rayure/
Bébé confort repas isotherme souple,https://citymall-para.ma/produit/bb-conf-sac-repas-isotherme/
Bebe Confort  Sac Porte Biberon Isotherme Souple,https://citymall-para.ma/produit/bb-conf-sac-biberon-isotherm/
Bébé Confort  Thermometre De bain Tortue Waterworld 0m+,https://citymall-para.ma/produit/bb-conf-thermometre-de-bain-tortue-waterworld-0m/
Bébé Confort  Trousse De Soin Thermometre & Bavoir & Ciseau,https://citymall-para.ma/produit/bebe-confort-trousse-de-soin-thermometre-bavoir-ciseau/
Bebe Confort 2 Cuilleres Thermo Sensitive T1 +4m,https://citymall-para.ma/produit/bb-conf-2-cuilleres-thermo-sensitive-t1-4m/
BéBé Confort 2 Sucette Natural Physio 18-36m  Rebel,https://citymall-para.ma/produit/bb-conf-2-suc-natural-physio-18-36m-rebel/
BéBé Confort 2 Sucette Natural Physio 18-36m Cool Kid,https://citymall-para.ma/produit/bebe-confort-2-sucette-natural-physio-18-36m-cool-kid/
BéBé Confort 2 Sucette Natural Physio 18-36m Latex Navy,https://citymall-para.ma/produit/bb-conf-2-suc-natural-physio-16-18m-latex-navy/
BéBé Confort 2 Sucette Natural Physio 6-18m Animals hibou,https://citymall-para.ma/produit/bb-conf-2-suc-natural-physio-6-18m-animals-hibou/
BéBé Confort 2 Sucettes Dental Safe 6-18m Little Valley,https://citymall-para.ma/produit/bb-conf-2-suc-dental-safe-6-18m-little-valleys/
Bebe Confort 2 Sucettes Physio Air Confort Phospho 0-6 m,https://citymall-para.ma/produit/bb-conf-2-suc-physio-air-conf-phospho-6-18m/
Bebe Confort 2 Sucettes Physio Air Confort Phospho 0-6m Octopus,https://citymall-para.ma/produit/bebe-confort-2-sucettes-physio-air-confort-phospho-0-6m-octopus/
Bebe Confort 2 Sucettes Physio Air Confort Phospho 18-36m Octopus,https://citymall-para.ma/produit/bebe-confort-2-sucettes-physio-air-confort-phospho-18-36m-octopus-2/
Bebe Confort 2 Sucettes Physio Air Confort Phospho 6-18m Octopus,https://citymall-para.ma/produit/bb-conf-2-suc-physio-air-conf-phospho-6-18m-octopus/
Bebe Confort 2 Sucettes Reversible 0/6  Animals Rose,https://citymall-para.ma/produit/bb-conf-2-suc-reversible-0-6m-animals-rose/
Bebe Confort 2 Sucettes Reversible Jungle Vert 18-36 mois,https://citymall-para.ma/produit/bb-conf-2suc-reversible-jungle-vert-18-36m/
Bebe Confort 2 Tétine Natural Comfort T1m +0m,https://citymall-para.ma/produit/bb-conf-2-tet-naural-comfort-t1m-0m-ref-30000880/
Bebe Confort 2 Tetine Natural Comfort T2l +4 m,https://citymall-para.ma/produit/bb-conf-2-tet-natural-comfort-t2l-4m-ref-30000881/
Bébé Confort 2 Tétines Classique 3 Vitesses T2 0-12m,https://citymall-para.ma/produit/bebe-confort-2-tetines-classique-3-vitesses-t2-0-12m/
Bebe Confort 2 Tetines Emotion 3 vitesses  6-24 m,https://citymall-para.ma/produit/bb-conf-2-tet-emotion-t-2-3-vitesses-6-24m/
Bébé Confort 2 Tétines Emotion Col Large T3 6-24m,https://citymall-para.ma/produit/bebe-confort-2-tetines-emotion-col-large-t3-6-24m/
Bébé Confort 4 Couverts d’apprentissage Domino +9m,https://citymall-para.ma/produit/bb-conf-4-couverts-dapprentissage-domino-9m/
Bebe Confort 4 Slips Jetables Taille 44/46,https://citymall-para.ma/produit/bebe-confort-4slips-jetables-taille-44-46/
Bebe Confort 4 Slips Jetables Tailles 38/42,https://citymall-para.ma/produit/bb-conf-4slips-jetables-taille-38-42/
Bebe Confort Anneau De Dentition Etape 2 (6m +),https://citymall-para.ma/produit/bb-conf-anneau-de-dentition-etape-2-6m/
Bébé Confort Anneau De dentition Sucette étape 1 Bleu,https://citymall-para.ma/produit/bebe-confort-sucette-anneau-de-dentition-etape-1-bleu/
Bebe Confort Anneau Dentition Etape 2 4-24m,https://citymall-para.ma/produit/bebe-confort-anneau-dentition-etape-2-4-24m/
Bebe Confort Assi apprenti Couvercle Under +9m,https://citymall-para.ma/produit/bb-conf-assi-apprenti-couvercle-under-9m/
Bebe Confort Assiete D’apprentissage Domino 18m+,https://citymall-para.ma/produit/bb-conf-assiette-daprenstissage-domino-18m/
Bebe Confort Assiette Apprenti Couvercle Sport +9m,https://citymall-para.ma/produit/bb-conf-assiette-apprenti-couvercle-sport-9m/
Bébé Confort Assiette Apprentissage Sport +18m,https://citymall-para.ma/produit/bebe-confort-assiette-apprentissage-sport-18m/
Bébé Confort Assiette Apprentissage Under +18m,https://citymall-para.ma/produit/bebe-confort-assiette-apprentissage-under-18m/
