titre,url
NATURESOIN Huile d’Ail 50ML,https://citymall-para.ma/produit/naturesoin-huile-dail-50ml/
NaturEsoin Huile D’amandes Douces 50ML,https://citymall-para.ma/produit/naturesoin-huile-damandes-douces-50ml/
NATURESOIN Huile d’Arachide Vierge 50ML,https://citymall-para.ma/produit/naturesoin-huile-darachide-vierge-50ml/
Naturesoin Huile D’arbre A Thé – 50ML,https://citymall-para.ma/produit/naturesoin-huile-darbre-a-the-50ml/
NaturEsoin Huile d’Avocat 50ML,https://citymall-para.ma/produit/huile-dargan-50-ml-2/
NATURESOIN Huile d’Eucalyptus 50ML,https://citymall-para.ma/produit/naturesoin-huile-deucalyptus-50ml-2/
Naturesoin Huile D’oignon 50ml,https://citymall-para.ma/produit/naturesoin-huile-doignon-50ml/
NaturEsoin Huile D’Olive – 50 Ml,https://citymall-para.ma/produit/naturesoin-huile-dolive-50-ml/
NATURESOIN Huile de Bourrache 50ML,https://citymall-para.ma/produit/naturesoin-huile-de-bourrache-50ml/
NATURESOIN Huile De Cade 50ML,https://citymall-para.ma/produit/naturesoin-huile-de-cade-50ml/
NaturEsoin Huile de Camomille 50ML,https://citymall-para.ma/produit/naturesoin-huile-de-camomille-50-ml/
NATURESOIN Huile de Camphree 50ML,https://citymall-para.ma/produit/naturesoin-huile-de-camphree-50ml/
Naturesoin Huile De Cannelle 50ML,https://citymall-para.ma/produit/naturesoin-huile-de-cannelle-50ml/
NATURESOIN Huile de Carotte 50ML,https://citymall-para.ma/produit/naturesoin-huile-de-carotte-50ml/
NATURESOIN Huile de Cèdre de l’Atlas 50ML,https://citymall-para.ma/produit/naturesoin-huile-de-cedre-de-latlas-50ml/
NATURESOIN Huile de Citron 50ML,https://citymall-para.ma/produit/naturesoin-huile-de-citron-50ml/
NaturEsoin Huile de Coco 50ML,https://citymall-para.ma/produit/naturesoin-huile-de-coco-50ml-casablanca/
NATURESOIN Huile de Coco POT 100ML,https://citymall-para.ma/produit/naturesoin-huile-de-coco-pot-100ml/
NATURESOIN Huile de Coco Vierge 200ML,https://citymall-para.ma/produit/naturesoin-huile-de-coco-vierge-200ml/
NATURESOIN Huile de Cumin 50ML,https://citymall-para.ma/produit/naturesoin-huile-de-cumin-50ml/
Naturesoin Huile De Fenugrec 50ml,https://citymall-para.ma/produit/naturesoin-huile-de-fenugrec-50ml/
NaturEsoin Huile de Figue de Barbarie 50ML,https://citymall-para.ma/produit/naturesoin-huile-de-figue-de-barbarie-50ml/
Naturesoin Huile De Foie De Morue 50ml,https://citymall-para.ma/produit/naturesoin-huile-de-foie-de-morue-50ml/
NATURESOIN Huile de Germe de Blé 50ml,https://citymall-para.ma/produit/naturesoin-huile-de-germe-de-ble-50-ml/
Naturesoin Huile De Gingembre 50ml,https://citymall-para.ma/produit/naturesoin-huile-de-gingembre-50ml/
NaturEsoin Huile De Glycerine,https://citymall-para.ma/produit/naturesoin-huile-de-glycerine/
NaturEsoin Huile De Jojoba – 50 Ml,https://citymall-para.ma/produit/naturesoin-huile-de-jojoba-50-ml/
NaturEsoin Huile de Lavande – 50 ml,https://citymall-para.ma/produit/naturesoin-huile-de-lavande-50-ml/
NaturEsoin Huile de Lin 50ML,https://citymall-para.ma/produit/naturesoin-huile-de-lin-50-ml-2/
NaturEsoin Huile De Macadamia – 50 Ml,https://citymall-para.ma/produit/naturesoin-huile-de-macadamia-50-ml/
Naturesoin Huile De Mais – 50ML,https://citymall-para.ma/produit/naturesoin-huile-de-mais-50ml/
Naturesoin Huile De Noisette 50ML,https://citymall-para.ma/produit/naturesoin-huile-de-noisette-50ml-2/
Naturesoin Huile De Noyaux D’abricot 50ML,https://citymall-para.ma/produit/naturesoin-huile-de-noyaux-dabricot-50ml-2/
Naturesoin Huile De Palme 50ml,https://citymall-para.ma/produit/naturesoin-huile-de-palme-50ml/
NaturEsoin Huile De Pépins De Raisin – 50 Ml,https://citymall-para.ma/produit/naturesoin-huile-de-pepins-de-raisin-50-ml/
Naturesoin Huile De Pepins De Raisin 50ml,https://citymall-para.ma/produit/naturesoin-huile-de-pepins-de-raisin-50ml/
NaturEsoin Huile De Roquette 50ML,https://citymall-para.ma/produit/naturesoin-huile-de-roquette-50-ml/
Naturesoin Huile De Sauge 50ml,https://citymall-para.ma/produit/naturesoin-huile-de-sauge-50ml/
NaturEsoin Huile de Sésame – 50 ml,https://citymall-para.ma/produit/naturesoin-huile-de-sesame-50-ml/
NaturEsoin Huile de Sesame 50ML,https://citymall-para.ma/produit/naturesoin-huile-de-sesame-50ml-2/
Naturesoin Huile De Soja 50ml,https://citymall-para.ma/produit/naturesoin-huile-de-soja-50ml/
NaturEsoin Huile de Thym 50ML,https://citymall-para.ma/produit/huile-de-thym-50ml/
Naturesoin Huile Essentielle Arbre A Thé – 10 ml,https://citymall-para.ma/produit/naturesoin-huile-essentielle-arbre-a-the-10-ml/
NATURESOIN Huile Essentielle d’Eucalyptus 10ML,https://citymall-para.ma/produit/naturesoin-huile-essentielle-deucalyptus-10ml/
NATURESOIN Huile Essentielle d’Orange 10ML,https://citymall-para.ma/produit/naturesoin-huile-essentielle-dorange-10ml/
NATURESOIN Huile Essentielle de Fenouil 10ML,https://citymall-para.ma/produit/naturesoin-huile-essentielle-de-fenouil-10ml/
Naturesoin Huile Essentielle De Romarin – 10ML,https://citymall-para.ma/produit/naturesoin-huile-essentielle-de-romarin-10ml/
Naturo Pathica Huile D’amande Douce 1L,https://citymall-para.ma/produit/naturo-pathica-huile-damande-douce-1l/
Naturtint 4g Châtain Doré 165ml,https://citymall-para.ma/produit/naturtint-4g-chatain-dore-165ml/
Naturtint 4m Châtain Acajou 165ml,https://citymall-para.ma/produit/naturtint-4m-chatain-acajou-165ml/
Naturtint 5g Châtain Doré Clair 165ml,https://citymall-para.ma/produit/naturtint-5g-chatain-dore-clair-165ml/
NEOPTIDE Lotion antichute femmes,https://citymall-para.ma/produit/neoptide-lotion-antichute-femmes/
Neutraderm Shampoing extra-doux dermo-respect 500ml,https://citymall-para.ma/produit/neutraderm-shampoing-extra-doux-dermo-respect-500ml/
Neutraderm Shampooing extra doux dermo-respect 100ml,https://citymall-para.ma/produit/neutraderm-shampooing-extra-doux-dermo-respect-100ml/
NIRVEL biotine +Lotion anti chute 125ml,https://citymall-para.ma/produit/nirvel-biotine-lotion-anti-chute-125ml/
Nirvel Keratinliss Masque 200ml,https://citymall-para.ma/produit/nirvel-keratinliss-masque-200ml/
NIRVEL Keratinliss Shampooing 250 ml Réparateur et Hydratant,https://citymall-para.ma/produit/nirvel-keratinliss-shampooing-250-ml-reparateur-et-hydratant/
Noreva Psoriane Shampooing Intensif – 125ml,https://citymall-para.ma/produit/noreva-psoriane-shampooing-intensif-125ml/
NOREVA Sebodiane Ds Shampoing Antipelliculaire 150ml,https://citymall-para.ma/produit/noreva-sebodiane-ds-shampoing-antipelliculaire-150ml/
NOVACAPIL- lotion antichute 120ml,https://citymall-para.ma/produit/novacapil-lotion-antichute-120ml/
NOVACAPIL- Masque Anti Chute 250ml,https://citymall-para.ma/produit/novacapil-masque-anti-chute-250ml/
NOVACAPIL- Masque Antipelliculaire 250ml,https://citymall-para.ma/produit/novacapil-masque-antipelliculaire-250ml/
NOVACAPIL- Masque Intense Hydratation 250ml,https://citymall-para.ma/produit/novacapil-masque-intense-hydratation-250ml/
NOVACAPIL- Shampoing Anti Pelliculaire 250ml,https://citymall-para.ma/produit/novacapil-shampoing-anti-pelliculaire-250ml/
NOVACAPIL- Shampoing Intense Hydratation 250ml,https://citymall-para.ma/produit/novacapil-shampoing-intense-hydratation-250ml/
"Novaskin Creme Lavante Corps, Visage & Cheveux 200 ml",https://citymall-para.ma/produit/novaskin-creme-lavante-corps-visage-cheveux-200-ml/
Novaskin Gel Lavant Sans Savon Hydratation 400 ml,https://citymall-para.ma/produit/novaskin-gel-lavant-corps-visage-et-cheveux-400ml/
NUXE HUILE PRODIGIEUSE NEROLI BIO 100 ML,https://citymall-para.ma/produit/nuxe-huile-prodigieuse-neroli-bio-100-ml/
Nuxe Sun huile lactée capillaire protectrice 100 ml,https://citymall-para.ma/produit/nuxe-sun-huile-lactee-capillaire-protectrice-100-ml/
OGX ARGAN Oil Conditioner 385ml,https://citymall-para.ma/produit/ogx-argan-oil-conditioner-385ml/
OGX ARGAN Oil Of Morocco Shampooing 385ml,https://citymall-para.ma/produit/ogx-argan-oil-of-morocco-shampooing-385ml/
OGX Biotin & Collagen Conditioner 385ml,https://citymall-para.ma/produit/ogx-biotin-collagen-conditioner-385ml/
OGX Coconut Miracle Oil Conditioner 385ml,https://citymall-para.ma/produit/ogx-coconut-miracle-oil-conditioner-385ml/
OGX Coconut Miracle Oil Shampoo 385ml,https://citymall-para.ma/produit/ogx-coconut-miracle-oil-shampoo-385ml/
OGX Keratin Oil Shampooing 385ml,https://citymall-para.ma/produit/ogx-keratin-oil-shampooing-385ml/
ONAGRINE HUILE NATIVE SÈCHE 150ML,https://citymall-para.ma/produit/onagrine-huile-native-seche-150ml/
Orness Huile Argane Sèche Multi-Usage 100ml,https://citymall-para.ma/produit/orness-huile-argane-seche-multi-usage-100ml/
Orness Lotion Cheveux Anti-Chute 150ml,https://citymall-para.ma/produit/orness-lotion-cheveux-anti-chute-150ml/
Orness Sérum Anti-chute 30Ml,https://citymall-para.ma/produit/orness-serum-anti-chute-30ml/
ORNESS Shampooing Prévention Anti-Chute 150ml,https://citymall-para.ma/produit/orness-shampooing-prevention-anti-chute-150ml/
Oxyskin Anti-Chute Premium – 60 Gélules,https://citymall-para.ma/produit/oxyskin-anti-chute-premium-60-gelules/
Oxyskin Collagène Elastine 60 Gélules,https://citymall-para.ma/produit/oxyskin-collagene-elastine-60-gelules-2/
Parasidose Poux-Lentes Soin Traitant 100 ml,https://citymall-para.ma/produit/parasidose-poux-lentes-soin-traitant-100-ml/
Parasidose Poux-Lentes Soin Traitant 200 ml,https://citymall-para.ma/produit/parasidose-poux-lentes-soin-traitant-200-ml/
PARSA BEAUTY Styling- & Volumenbürste,https://citymall-para.ma/produit/parsa-beauty-styling-volumenburste/
Pentaskin Pso+ Baume 200ml,https://citymall-para.ma/produit/pentaskin-pso-baume-200ml/
Pentaskin Pso+ Lotion 125ml,https://citymall-para.ma/produit/pentaskin-pso-lotion-125ml/
Phanere Boost Cheveux et Ongles 60 Gélules,https://citymall-para.ma/produit/phanere-boost-cheveux-et-ongles-60-gelules/
PHYTO Huile d’Ales Bain de Brillance Haute Hydratation Ampoules 5×10 ml,https://citymall-para.ma/produit/phyto-huile-dales-bain-de-brillance-haute-hydratation-ampoules-5x10-ml/
PHYTO PHYTEOL Shampooing Anti Pelliculaire Moderes 200ml,https://citymall-para.ma/produit/phyto-phyteol-shampooing-anti-pelliculaire-moderes-200ml/
Phyto-PhytoKératine Extrême Crème D’Exception – 100 Ml,https://citymall-para.ma/produit/phyto-phytokeratine-extreme-creme-dexception-100-ml/
Phyto-PhytoSquam Intense Shampoing-Soin Antipelliculaire Intensif – 100 Ml,https://citymall-para.ma/produit/phyto-phytosquam-intense-shampoing-soin-antipelliculaire-intensif-100-ml/
Phyto-Phytovolume Shampooing Volume Intense – 200 ml,https://citymall-para.ma/produit/phyto-phytovolume-shampooing-volume-intense-200-ml/
PHYTOAPAISANT Spray Apaisant 50ML,https://citymall-para.ma/produit/phytoapaisant-spray-ap-50ml-s/
PHYTOBAUME Éclat Couleur Apres-Shampooing 150ML,https://citymall-para.ma/produit/phytobaume-eclat-couleur-150ml-s/
PHYTOBAUME Volume Apres-Shampooing 150ML,https://citymall-para.ma/produit/phytobaume-ap-shp-hydrat-ch-s-n150ml-s/
PHYTOBAUME Volume Après-Shampooing Cheveux Fins 150ML,https://citymall-para.ma/produit/phytobaume-volume-ap-shp-condition-ch-fins-150ml/
PHYTOCAPILL Baume Après-Shampooing 200ML,https://citymall-para.ma/produit/phytocapill-baume-apres-shampooing-200ml/
PHYTOCEDRAT Shampooing Purifiant Regulateur 200ML,https://citymall-para.ma/produit/phytocedrat-shp-purif-regul-200ml-s/
PHYTOCITRUS Masque Eclat Cheveux 100ML,https://citymall-para.ma/produit/phytocitrus-masque-eclat-chev-100ml-s/
Phytocitrus Masque Eclat Cheveux Pot 200ML,https://citymall-para.ma/produit/phytocitrus-masque-eclat-chev-200ml-pot-s/
PHYTODENSIA Masque Fluide Repulpant 175ML,https://citymall-para.ma/produit/phytodensia-masque-fluide-repulpant-175-ml/
PHYTODENSIA Shampoing Repulpant 200ML,https://citymall-para.ma/produit/phytodensia-shamp-repulpant-200ml/
PHYTODENSIUM Masque Anti-Age 200ML,https://citymall-para.ma/produit/phytodensium-masque-200ml/
PHYTODENSIUM Sérum Anti-Age 50ML,https://citymall-para.ma/produit/phytodensium-serum-a-age-50ml-s/
PHYTODENSIUM Shampoing Revitalisant Anti-Age 200ML,https://citymall-para.ma/produit/phytodensium-shamp-200-ml-s/
Phytolumiere Shampoo Reflet Cuivre 200ml,https://citymall-para.ma/produit/phytolumiere-shampoo-reflet-cuivre-200ml/
PHYTOPLAGE VOILE CAPILLAIRE 125ml Haute Protection,https://citymall-para.ma/produit/phytoplage-voile-capillaire-125ml-haute-protection/
PHYTOPOLLEINE Elixir vegetal stimulant du cuir chevelu Flacon verre 25ml,https://citymall-para.ma/produit/phytopolleine-elixir-vegetal-stimulant-du-cuir-chevelu-flacon-verre-25ml/
PhytoSpecific Lait Hydratation Optimale 150 ml,https://citymall-para.ma/produit/phytospecific-lait-hydratation-optimale-150-ml/
PIOX  Shampooing Anti-Poux 125ml,https://citymall-para.ma/produit/piox-shampooing-anti-poux-125ml/
Piox Anti Poux Lotion Spray 125ml,https://citymall-para.ma/produit/piox-anti-poux-lotion-spray-125ml/
Plantil Huile De Chanvre 60ML,https://citymall-para.ma/produit/plantil-huile-de-chanvre-60ml/
Pro Vital Amande Douce 60ml,https://citymall-para.ma/produit/pro-vital-amande-douce-60ml/
PRO VITAL Gel Aloe Vera 97% 300GR,https://citymall-para.ma/produit/pro-vital-gel-aloe-vera-97-300gr/
Pro Vital Huile Avocat 60ml,https://citymall-para.ma/produit/pro-vital-huile-avocat-50ml/
Pro Vital Huile De Figue De Barbarie 60ml,https://citymall-para.ma/produit/pro-vital-huile-de-figue-de-barbarie-60ml/
Pro Vital Huile Noix De Coco Pot 150g,https://citymall-para.ma/produit/pro-vital-huile-noix-de-coco-pot-150g/
Pro Vital Serum De Noix De Coco 50ml,https://citymall-para.ma/produit/pro-vital-serum-de-noix-de-coco-50ml/
PRO VITAL Vitamine C Sérum au Collagène 30ML,https://citymall-para.ma/produit/pro-vital-vitamine-c-serum-au-collagene-30ml/
PRO-VITAL Anti Chute aux Huiles Essentielles 125ML,https://citymall-para.ma/produit/pro-vital-anti-chute-aux-huiles-essentielles-125ml/
Pro-Vital Beurre De Karite 200G,https://citymall-para.ma/produit/pro-vital-beurre-de-karite-200g/
PRO-VITAL Huile d’Oliban 30ML,https://citymall-para.ma/produit/pro-vital-huile-doliban-30ml-2/
Pro-Vital Pack Anti Poux Lotion et Shampoing + Peigne,https://citymall-para.ma/produit/pro-vital-pack-anti-poux-lotion-et-shampoing-peigne/
PRO-VITAL Vitamine E Pure 10ML,https://citymall-para.ma/produit/pro-vital-vitamine-e-pur-10ml/
Pur Naturel Huile Vegetale Nigelle 60ML,https://citymall-para.ma/produit/pur-naturel-huile-vegetale-nigelle-60ml/
Pur Naturel Nutri Baume Cheveux 100ml,https://citymall-para.ma/produit/pur-naturel-nutri-baume-cheveux-100ml/
Puress Huile Essent Giroflier 5ml,https://citymall-para.ma/produit/puress-huile-essent-giroflier-5ml/
Puress Huile Essent Helichryse 5ml,https://citymall-para.ma/produit/puress-huile-essent-helichryse-5ml/
Puressentiel Anti-Chute Huile Revitalisante 100 ml,https://citymall-para.ma/produit/puressentiel-anti-chute-huile-revitalisante-100-ml/
PURESSENTIEL huile essentielle citronnelle de java 10ml bio.,https://citymall-para.ma/produit/puressentiel-huile-essentielle-citronnelle-de-java-10ml-bio/
Puressentiel Huile Essentielle Eucalyptus Radie Bio 10ML,https://citymall-para.ma/produit/puressentiel-huile-essentielle-eucalyptus-radie-bio-10ml-2/
PURESSENTIEL Kit Anti-Chute,https://citymall-para.ma/produit/puressentiel-kit-anti-chute-2/
PURIADERM PURIPHAN Masque Ultra-Réparateur 200 Ml,https://citymall-para.ma/produit/puriaderm-puriphan-masque-ultra-reparateur-200-ml/
Puriaderm Puriphan Sérum Thérapeutique Oligo-Synergique 60ml,https://citymall-para.ma/produit/puriaderm-puriphan-serum-therapeutique-oligo-synergique-60ml/
Puriaderm Puriphan Shampooing Énergisant 200ml,https://citymall-para.ma/produit/puriaderm-puriphan-shampooing-energisant-200ml-2/
Puriaderm Puriphan Shampooing Hydratant Intense Oligo-Synergique 200ml,https://citymall-para.ma/produit/puriaderm-puriphan-shampooing-hydratant-intense-oligo-synergique-200ml/
Racine vita Anti-poux shampoing +Traitement Intensif+ Spray protecteur pack,https://citymall-para.ma/produit/racine-vita-anti-poux-shampoing-traitement-intensif-spray-protecteur-pack/
Racine Vita Beauté De rose 40ml,https://citymall-para.ma/produit/racine-vita-beaute-de-rose-40ml/
Racine Vita Huile D’amande Douce 1L,https://citymall-para.ma/produit/racine-vita-huile-damande-douce-1l/
Racine Vita Huile D’amandes Amères 40ML,https://citymall-para.ma/produit/racine-vita-huile-damandes-ameres-40ml/
Racine vita argan non torrefiee 40 ml,https://citymall-para.ma/produit/racine-vita-huile-dargan-torrefiee-40-ml/
Racine Vita Huile D’argan Torréfiée 40ML,https://citymall-para.ma/produit/racine-vita-huile-dargan-torrefiee-40ml/
Racine Vita Huile D’eucalyptus 40ML,https://citymall-para.ma/produit/racine-vita-huile-deucalyptus-40ml/
Racine Vita Huile D’avocat 40ml,https://citymall-para.ma/produit/racine-vita-huile-davocat-40ml/
Racine Vita Huile D’oignon 40ml,https://citymall-para.ma/produit/racine-vita-huile-doignon-40ml/
Racine Vita Huile De Camomille 40 ml,https://citymall-para.ma/produit/racine-vita-huile-de-camomille-40-ml/
Racine Vita Huile De Carotte 40ML,https://citymall-para.ma/produit/racine-vita-huile-de-carotte-40ml/
Racine Vita Huile De Coco 40ML,https://citymall-para.ma/produit/racine-vita-huile-de-coco-40ml/
Racine Vita Huile De Extrait D’ail 40 ml,https://citymall-para.ma/produit/racine-vita-huile-de-extrait-dail-40-ml/
Racine Vita Huile De Figue De Barbarie 40ML,https://citymall-para.ma/produit/racine-vita-huile-de-figue-de-barbarie-40ml/
Racine Vita Huile De Gingembre 40ML,https://citymall-para.ma/produit/racine-vita-huile-de-gingembre-40ml/
Racine Vita Huile De Girofle 40ML,https://citymall-para.ma/produit/racine-vita-huile-de-girofle-40ml/
Racine Vita Huile De Graines De Nigelle 40ML,https://citymall-para.ma/produit/racine-vita-huile-de-graines-de-nigelle-40ml/
RACINE VITA Huile de jojoba naturelle 40 ml,https://citymall-para.ma/produit/racine-vita-huile-de-jojoba-naturelle-40-ml/
Racine Vita Huile De Mais 40ML,https://citymall-para.ma/produit/racine-vita-huile-de-mais-40ml/
Racine vita Huile de Moutarde 40ml,https://citymall-para.ma/produit/racine-vita-huile-de-moutarde-40ml/
Racine Vita Huile De Noix 40ML,https://citymall-para.ma/produit/racine-vita-huile-de-noix-40ml/
Racine Vita Huile De Noyaux D’abricot 40 ml,https://citymall-para.ma/produit/racine-vita-huile-de-noyaux-dabricot-40-ml/
RACINE VITA Huile de palme 40 ml,https://citymall-para.ma/produit/racine-vita-huile-de-palme-40-ml/
Racine Vita Huile de Paraffine 40ml,https://citymall-para.ma/produit/racine-vita-huile-de-paraffine-40ml/
Racine Vita Huile De Ricin,https://citymall-para.ma/produit/racine-vita-huile-de-ricin/
Racine Vita Huile de Romarin 40ml,https://citymall-para.ma/produit/racine-vita-huile-de-romarin-40ml/
Racine Vita Huile De Rose Musquee,https://citymall-para.ma/produit/racine-vita-huile-de-rose-musquee/
Racine Vita Huile de Safran 40ml,https://citymall-para.ma/produit/racine-vita-huile-de-safran-40ml/
RACINE VITA Huile De Sauge 40 Ml,https://citymall-para.ma/produit/racine-vita-huile-de-sauge-40-ml/
RACINE VITA Huile de Sésame 40ml,https://citymall-para.ma/produit/racine-vita-huile-de-sesame-40ml/
RACINE VITA Huile de Soja 40ml,https://citymall-para.ma/produit/racine-vita-huile-de-soja-40ml/
RACINE VITA Huile de Thym 40ml,https://citymall-para.ma/produit/racine-vita-huile-de-thym-40ml/
RACINE VITA Huile Essentielle d’Eucalyptus 10ML,https://citymall-para.ma/produit/racine-vita-huile-essentielle-deucalyptus-10ml/
Racine Vita Huile Essentielle De Cannelle,https://citymall-para.ma/produit/racine-vita-huile-essentielle-de-canelle-2/
RACINE VITA Huile Essentielle de Girofle 10ML,https://citymall-para.ma/produit/racine-vita-huile-essentielle-de-girofle-10ml/
RACINE VITA Huile Essentielle de Menthe Poivre 10ML,https://citymall-para.ma/produit/racine-vita-huile-essentielle-de-menthe-poivre-10ml/
Racine Vita Huile Germe De ble 40ML,https://citymall-para.ma/produit/racine-vita-huile-germe-de-ble-40ml/
Racine Vita Huile Noix De Coco 300G,https://citymall-para.ma/produit/racine-vita-huile-noix-de-coco-300g/
Racine Vita Ricin 1L,https://citymall-para.ma/produit/racine-vita-ricin-1l-2/
"Racine Vita, Beurre De Karité 150g",https://citymall-para.ma/produit/racine-vita-beurre-de-karite-150g/
Racine-Vita Huile De Concombre 40ML,https://citymall-para.ma/produit/racine-vita-huile-de-concombre-40ml/
Racine-Vita Huile De Glycérine 40ML,https://citymall-para.ma/produit/racine-vita-huile-de-glycerine-40ml/
Racine-Vita Huile De Macadamia 40ML,https://citymall-para.ma/produit/racine-vita-huile-de-macadamia-40ml/
Racine-Vita Huile Extrait D’ail 40ML,https://citymall-para.ma/produit/racine-vita-huile-extrait-dail-40ml/
RACINE-VITA Sérum Capillaire Extra-Lissant À La Kératine Et À L’huile De Coco 40 Ml,https://citymall-para.ma/produit/racine-vita-serum-capillaire-extra-lissant-a-la-keratine-et-a-lhuile-de-coco-40-ml/
RACINEVITA Huile Essentielle de Lavande 40ML,https://citymall-para.ma/produit/racinevita-huile-essentielle-de-lavande/
Sante Bio Gel Douche Coco 400ml,https://citymall-para.ma/produit/sante-bio-gel-douche-coco-400ml/
SECRET LOVE Brume Parfumee Aqua Fresh 200ML,https://citymall-para.ma/produit/secret-love-brume-parfumee-aqua-fresh-200ml/
Shampoing Sec Floral Blush Batiste,https://citymall-para.ma/produit/shampoing-sec-floral-blush-batiste/
Shampooing Cheveux Sec Endommages 200ml Sante Bio,https://citymall-para.ma/produit/shampooing-cheveux-sec-endommages-200ml-sante-bio/
Squanorm Shampooing Traitant Anti-Pelliculaire 200ml,https://citymall-para.ma/produit/squanorm-shampooing-traitant-anti-pelliculaire-200ml/
SVR C Masque Anti-Ox 50 ml,https://citymall-para.ma/produit/svr-c-masque-anti-ox-50-ml/
SVR CICAVIT+ GEL MOUSSANT ASSAINISSANT 200ML,https://citymall-para.ma/produit/svr-cicavit-gel-moussant-assainissant-apaisant/
SVR Densitium Baume Nuit Réparation Globale 50 ml,https://citymall-para.ma/produit/svr-densitium-baume-nuit-reparation-globale-50-ml/
Tricovel Mousse Anti-Pelliculaire 70ml,https://citymall-para.ma/produit/tricovel-mousse-anti-pelliculaire-70ml/
Tricovel PhysioGenina Ampoules Protectrices & Revitalisantes 10×3.5ml,https://citymall-para.ma/produit/tricovel-physiogenina-ampoules-protectrices-revitalisantes-10x3-5ml/
TRICOVEL Shampooing Signal Révolution 200ml,https://citymall-para.ma/produit/tricovel-shampooing-signal-revolution-200ml/
Trikare C Shampooing Anti-Chute 200ml,https://citymall-para.ma/produit/trikare-c-shampooing-anti-chute-200ml/
Trikare K Shampooing Anti-Séborrhéique,https://citymall-para.ma/produit/trikare-k-shampooing-anti-seborrheique/
Uriage D.S Hair Lotion Antipelliculaire Régulatrice 100 Ml,https://citymall-para.ma/produit/uriage-d-s-hair-lotion-antipelliculaire-regulatrice-100-ml/
Uriage DS Hair Shampooing Doux Équilibrant 200ml,https://citymall-para.ma/produit/uriage-ds-hair-shampooing-doux-equilibrant-200ml/
URIAGE DS HAIR SHAMPOOING TRAITANT ANTIPELLICULAIRE 200ML,https://citymall-para.ma/produit/uriage-ds-hair-shampooing-traitant-antipelliculaire-200ml/
URIAGE DS HAIR SHAMPOOING TRAITANT KÉRATORÉDUCTEUR 150ML,https://citymall-para.ma/produit/uriage-ds-hair-shampooing-traitant-keratoreducteur-150ml/
VICHY DERCOS AMINEXIL CLINICAL 5*21 FEMME,https://citymall-para.ma/produit/vichy-dercos-aminexil-clinical-521-femme/
VICHY DERCOS AMINEXIL CLINICAL 5*21 HOMME,https://citymall-para.ma/produit/vichy-dercos-aminexil-clinical-521-homme/
VICHY Dercos Aminexil Clinical Cure Anti-Chute Femmes 21 X 6ML,https://citymall-para.ma/produit/vichy-dercos-aminexil-clinical-cure-anti-chute-femmes-21-x-6ml/
Vichy Dercos Aminexil Men Cure Intensive Première Chute De Cheveux 36ml,https://citymall-para.ma/produit/vichy-dercos-aminexil-men-cure-intensive-premiere-chute-de-cheveux-36ml/
Vichy Dercos Densi Solutions Baume Epaisseur 150ml,https://citymall-para.ma/produit/vichy-dercos-densi-solutions-baume-epaisseur-150ml/
Vichy Dercos Psolution Shampooing Traitant Keratoreducteur 200ml,https://citymall-para.ma/produit/vichy-dercos-psolution-shampooing-traitant-keratoreducteur-200ml/
VICHY DERCOS Shampoing Ultra-Apaisant Cheveux Gras 200ML,https://citymall-para.ma/produit/shampooing-ultra-apaisant-cheveux-gras-vichy/
VICHY DERCOS Shampooing Anti-Pelliculaire Sensitive 200ML,https://citymall-para.ma/produit/vichy-dercos-shampooing-anti-pelliculaire-sensitive-200ml/
Vichy Dercos Shampooing Energisant 200ml,https://citymall-para.ma/produit/vichy-dercos-shampooing-energisant-200ml/
VICHY DERCOS Shampooing Traitant Anti-Pelliculaire 200ML,https://citymall-para.ma/produit/vichy-dercos-shampoing-traitant-anti-pelliculaire-cheveux/
Vichy Dercos Vitamine A.C.E Apres-shamp brillance 200ml,https://citymall-para.ma/produit/vichy-dercos-vitamine-a-c-e-apres-shamp-brillance-200ml-2/
VITA NATURE Huile Ail 50ML,https://citymall-para.ma/produit/vita-nature-huile-ail-50ml/
VITA NATURE Huile Camomille 50ML,https://citymall-para.ma/produit/vita-nature-huile-camomille-50ml/
VITA NATURE Huile de Cedre de l’Atlas 50ML,https://citymall-para.ma/produit/vita-nature-huile-de-cedre-de-latlas-50ml/
Vita Nature Huile De Citron 50ML,https://citymall-para.ma/produit/vita-nature-huile-de-citron-50ml-2/
VITA NATURE Huile de Concombre 50ML,https://citymall-para.ma/produit/vita-nature-huile-de-concombre-50ml/
Vita Nature Huile De Figue De Barbarie 50ML,https://citymall-para.ma/produit/vita-nature-huile-de-figue-de-barbarie-50ml-2/
VITA NATURE Huile de Sauge 50ml,https://citymall-para.ma/produit/vita-nature-huile-de-sauge-50ml/
Vita Nature Huile de Sésame 50ml,https://citymall-para.ma/produit/vita-nature-huile-de-sesame-50ml/
VITA NATURE Huile de soja 50ml,https://citymall-para.ma/produit/vita-nature-huile-de-soja-50ml-2/
VITA NATURE Huile de Thym 50ml,https://citymall-para.ma/produit/vita-nature-huile-de-thym-50ml/
Vita Nature Huile Pepins De Raisin 50ml,https://citymall-para.ma/produit/vita-nature-huile-pepins-de-raisin-50ml/
Vita Nature Huile Riz 50ml,https://citymall-para.ma/produit/vita-nature-huile-riz-50ml/
VOLUME EXTRA Masque Amplificateur 200ML,https://citymall-para.ma/produit/volume-extra-masque-amplificateur-200ml/
