titre,url
ACCU-CHEK INSTANT BANDELETTES RÉACTIVES 50,https://citymall-para.ma/produit/accu-chek-instant-bandelettes-reactives-50/
ACCU-CHEK SOFTCLIX LANCETTE 200 UNITÉS,https://citymall-para.ma/produit/accu-chek-softclix-lancette-200-unites/
AMAN Lancets 50U 28G 1.5MM,https://citymall-para.ma/produit/aman-lancets-50u-28g-1-5mm/
Apex – Oxymètre de doigt,https://citymall-para.ma/produit/apex-oxymetre-de-doigt/
Bandage Alcoolisé au Menthol 10cm*2.6m,https://citymall-para.ma/produit/bandage-alcoolise-au-menthol-10cm2-6m/
Bandelette Urinaire INSIGHT XPERT  5P 100 unités,https://citymall-para.ma/produit/bandelette-urinaire-insight-xpert-5p-100-unites/
Bandelette Urinaire INSIGHT XPERT 11p 100 unités,https://citymall-para.ma/produit/bandelette-urinaire-insight-xpert-11p-100-unites/
Berger Ceinture Abdominal Noir Avec Ateille Standard BG-402,https://citymall-para.ma/produit/berger-ceinture-abdominal-noir-avec-ateille-standard-bg-402/
Berger Collier Cervical Nelsone Taille 2 BG-102-2,https://citymall-para.ma/produit/berger-collier-cervical-nelsone-taille-2-bg-102-2/
Beurer Appareil De Massage Anti-Cellulite Palper Rouler CM50,https://citymall-para.ma/produit/beurer-appareil-de-massage-anti-cellulite-palper-rouler-cm50/
BIONIME 25 BANDELETTES DE TEST DE GLYCÉMIE GS260,https://citymall-para.ma/produit/bionime-25-bandelettes-de-test-de-glycemie-gs260/
BIONIME Rightest Wiz Kit GS570,https://citymall-para.ma/produit/bionime-rightest-wiz-kit-gs570/
ACCU-CHEK INSTANT BANDELETTES RÉACTIVES 50,https://citymall-para.ma/produit/accu-chek-instant-bandelettes-reactives-50/
ACCU-CHEK SOFTCLIX LANCETTE 200 UNITÉS,https://citymall-para.ma/produit/accu-chek-softclix-lancette-200-unites/
AMAN Lancets 50U 28G 1.5MM,https://citymall-para.ma/produit/aman-lancets-50u-28g-1-5mm/
Apex – Oxymètre de doigt,https://citymall-para.ma/produit/apex-oxymetre-de-doigt/
Bandage Alcoolisé au Menthol 10cm*2.6m,https://citymall-para.ma/produit/bandage-alcoolise-au-menthol-10cm2-6m/
Bandelette Urinaire INSIGHT XPERT  5P 100 unités,https://citymall-para.ma/produit/bandelette-urinaire-insight-xpert-5p-100-unites/
Bandelette Urinaire INSIGHT XPERT 11p 100 unités,https://citymall-para.ma/produit/bandelette-urinaire-insight-xpert-11p-100-unites/
Berger Ceinture Abdominal Noir Avec Ateille Standard BG-402,https://citymall-para.ma/produit/berger-ceinture-abdominal-noir-avec-ateille-standard-bg-402/
Berger Collier Cervical Nelsone Taille 2 BG-102-2,https://citymall-para.ma/produit/berger-collier-cervical-nelsone-taille-2-bg-102-2/
Beurer Appareil De Massage Anti-Cellulite Palper Rouler CM50,https://citymall-para.ma/produit/beurer-appareil-de-massage-anti-cellulite-palper-rouler-cm50/
BIONIME 25 BANDELETTES DE TEST DE GLYCÉMIE GS260,https://citymall-para.ma/produit/bionime-25-bandelettes-de-test-de-glycemie-gs260/
BIONIME Rightest Wiz Kit GS570,https://citymall-para.ma/produit/bionime-rightest-wiz-kit-gs570/
Body Fine Elastic Poignet,https://citymall-para.ma/produit/body-fine-elastic-poignet-m-2/
Caresens Dual Lecture De Glycemie,https://citymall-para.ma/produit/caresens-dual-lecture-de-glycemie/
Ciseaux à pansements 14 cm,https://citymall-para.ma/produit/ciseaux-a-pansements-14-cm/
CLEVER-CHEK Blanc 100 Lancette,https://citymall-para.ma/produit/clever-chek-blanc-100-lancette/
Contour Plus Appareil,https://citymall-para.ma/produit/contour-plus-appareil/
Contour Plus Kit,https://citymall-para.ma/produit/contour-plus-kit/
Cosmopor E Hartmann Pansements Adhésifs Stériles,https://citymall-para.ma/produit/cosmopor-e-hartmann-pansements-adhesifs-steriles/
Derma Soin Spray Alcool 70° – 50 ml,https://citymall-para.ma/produit/derma-soin-spray-alcool-70-50-ml/
Devas Gilet Dorso-Lombaire Taille Standard,https://citymall-para.ma/produit/devas-gilet-dorso-lombaire-taille-standard/
DEVAS ORTHOPEDIE CHEVILLÈRE STANDARD,https://citymall-para.ma/produit/devas-orthopedie-chevillere-standard/
Diab Control Bandelettes 50 Unités,https://citymall-para.ma/produit/diab-control-bandelettes-50-unites/
Diabcontrol Bandelettes 25 Unités pour appareil glycémie,https://citymall-para.ma/produit/diabcontrol-bandelettes-25-unites-pour-appareil-glycemie/
Diabcontrol Lecteur De Glycemie 10 Bandelettes+10 Lancettes,https://citymall-para.ma/produit/diabcontrol-lecteur-de-glycemie-10-bandelettes10-lancettes/
Eco Silver Varises Stocking Thight 9230 – Open/Close Toe,https://citymall-para.ma/produit/eco-silver-varises-stocking-thight-9230-open-close-toe/
Gant Chirurg 7 Pristeen,https://citymall-para.ma/produit/gant-chirurg-7-pristeen/
HARTMANN Dermaplast Classic 6*10CM/10PCS,https://citymall-para.ma/produit/hartmann-dermaplast-classic-610cm-10pcs/
Hartmann Veroval compact tensiometre de bras 925422,https://citymall-para.ma/produit/hartmann-veroval-compact-tensiometre-de-bras-925422/
Hartmann veroval tensiomètre de bras 925302,https://citymall-para.ma/produit/hartmann-veroval-tensiometre-de-bras-925302-2/
Hydrogel Alcoholic Menthol Bandage 7.5cm*2m,https://citymall-para.ma/produit/hydrogel-alcoholic-menthol-bandage/
HYDROGEL PATCH Thérapie Bi-Thermale Patch Médical 10cm*20cm,https://citymall-para.ma/produit/hydrogel-patch-therapie-bi-thermale-patch-medical-10cm20cm/
HYDROGEL PATCH Thérapie Bi-Thermale Patch Médical 15cm*25cm bte de 5 unite,https://citymall-para.ma/produit/hydrogel-patch-therapie-bi-thermale-patch-medical-15cm25cm/
Konfort Tensiomètre Automatique Poignet Ref bp-55g,https://citymall-para.ma/produit/konfort-tensiometre-automatique-poignet-ref-bp-55g/
Lanaform Panty Mass&Slim S,https://citymall-para.ma/produit/lanaform-panty-massslim-s/
Lecteur de glycémie Bionime GM260,https://citymall-para.ma/produit/lecteur-de-glycemie-bionime-gm260/
Lili care bonnet de bain,https://citymall-para.ma/produit/lili-care-bonnet-de-bain/
MAMAJOO Réchauffeur LCD numérique 3en1,https://citymall-para.ma/produit/mamajoo-rechauffeur-lcd-numerique-3en1/
MAMAJOO Sterilisateur 5en1 Vapeur Numerique,https://citymall-para.ma/produit/mamajoo-sterilisateur-5en1-vapeur-numerique/
OMRON Tensiomètre Brassard M2 Basic,https://citymall-para.ma/produit/omron-tensiometre-brassard-m2-basic-2/
OMRON TENSIOMETRE BRASSARD M2 BASIC,https://citymall-para.ma/produit/omron-tensiometre-brassard-m2-basic/
On Call Platinum Lecteur de Glycemie,https://citymall-para.ma/produit/on-call-platinum-lecteur-de-glycemie/
On-Call-Plus 25 bandelettes,https://citymall-para.ma/produit/on-call-plus-25-bandelettes/
Oxymètre de Pouls Doigtier PC-60B1,https://citymall-para.ma/produit/oxymetre-de-pouls-doigtier-pc-60b1/
Oxymetre de Pouls Portable Professionnel Nextronic,https://citymall-para.ma/produit/oxymetre-de-pouls-portable-professionnel-nextronic/
Physiodose Serum Unidos 30*5ml,https://citymall-para.ma/produit/physiodose-serum-unidos-305ml-2/
PROMISEMED Lancette 100 Unités Bleu,https://citymall-para.ma/produit/promisemed-lancette-100-unites-bleu/
PROMISEMED Plate Lancette 100 Unités,https://citymall-para.ma/produit/promisemed-plate-lancette-100-unites/
Sencor Pèse Personne au Sol en Verre l7006,https://citymall-para.ma/produit/sencor-pese-personne-au-sol-en-verre-l7006/
STARMED Lancette 100Pcs,https://citymall-para.ma/produit/starmed-lancette-100pcs/
Sveltess Panty Taille Haute chair S,https://citymall-para.ma/produit/sveltess-panty-taille-haute-chair-s/
Sveltesse  Corsaire  Microfibre  Minceur Chair Taille  L/XL,https://citymall-para.ma/produit/sveltesse-corsaire-microfibre-minceur-chair-taille-l-xl/
Sveltesse Corsaire XXL chair S,https://citymall-para.ma/produit/sveltesse-corsaire-xxl-chair-s/
Sveltesse Panty taille haute minceur chair s,https://citymall-para.ma/produit/sveltesse-panty-taille-haute-minceur-chair-s/
Table de lit diffusion pliante marron Locamed,https://citymall-para.ma/produit/table-de-lit-diffusion-pliante-marron-locamed/
Tensiom Bras tensoval duo control M900224,https://citymall-para.ma/produit/tensiom-bras-tensoval-duo-control-m900224/
Tensiomètre au bras Omron M7 Intelli IT,https://citymall-para.ma/produit/tensiometre-au-bras-omron-m7-intelli-it/
Tensiométre Bras konfort ref bp-35x,https://citymall-para.ma/produit/tensiometre-bras-konfort-ref-bp-35x/
Tensiometre Brassard microlife bp a2 basic,https://citymall-para.ma/produit/tensiometre-brassard-microlife-bp-a2-basic/
Tensiomètre de bras automatique bp-1305,https://citymall-para.ma/produit/tensiometre-de-bras-automatique-bp-1305/
Tensiomètre De poignet bp-2116,https://citymall-para.ma/produit/tensiometre-de-poignet-bp-2116/
Tensiomètre Digital automatique konfort bp-35e,https://citymall-para.ma/produit/tensiometre-digital-automatique-konfort-bp-35e/
Tensiomètre Electronique automatique bp-2206,https://citymall-para.ma/produit/tensiometre-electronique-automatique-bp-2206/
Tensiomètre Electronique bras omron spot arm i-q132,https://citymall-para.ma/produit/tensiometre-electronique-bras-omron-spot-arm-i-q132/
Tensiomètre Omron m3 comfort,https://citymall-para.ma/produit/tensiometre-omron-m3-comfort/
Tensiomètre Spengler Vaquez Laubry Hôpital Sangles,https://citymall-para.ma/produit/tensiometre-spengler-vaquez-laubry-hopital-sangles/
Tensoplast 2.5m X 10cm HB,https://citymall-para.ma/produit/tensoplast-2-5m-x-10cm-hb/
Tensoplast 2.5m X 15cm HB,https://citymall-para.ma/produit/tensoplast-2-5m-x-15cm-hb/
Tensoplast 2.5m X 20cm HB,https://citymall-para.ma/produit/tensoplast-2-5m-x-20cm-hb/
Tensoplast 2.5m X 6cm HB,https://citymall-para.ma/produit/tensoplast-2-5m-x-6cm-hb/
Tensoplast 2.5m X 8cm HB,https://citymall-para.ma/produit/tensoplast-2-5m-x-8cm-hb/
Top Care tensiométre brassard,https://citymall-para.ma/produit/top-care-tensiometre-brassard/
Urgo Aqua Protect 10 Pansements,https://citymall-para.ma/produit/urgo-aqua-protect-10-pansements/
URGO DERM SPARADRAP 5M X 10CM,https://citymall-para.ma/produit/urgo-derm-sparadrap-5m-x-5cm/
UrgoTul Ag 10cm*12cm,https://citymall-para.ma/produit/urgotul-ag-10cm12cm/
Urgotul Contact- Interface-Tul  10 x 10 cm 1 Unité,https://citymall-para.ma/produit/urgotul-contact-interface-tul-10-x-10-cm-1-unite/
Velpeau Bande De Crepe 15cm,https://citymall-para.ma/produit/velpeau-bande-de-crepe-15cm/
Vivachek Ino Bandelettes 25,https://citymall-para.ma/produit/vivachek-ino-bandelettes-25/
VIVACHEK Ino Test Strips  50Unités,https://citymall-para.ma/produit/vivachek-ino-test-strips-50unites/
Yuwell Tensiométre inteligent ye660b,https://citymall-para.ma/produit/yuwell-tensiometre-inteligent-ye660b/
Yuwell Thermomètre Frontal infrarouge Sans Contact pour Enfants Bébé et Adultes,https://citymall-para.ma/produit/yuwell-thermometre-frontal-infrarouge-sans-contact-pour-enfants-bebe-et-adultes/
MEDICELS ALCOOL 70% 250ML,https://citymall-para.ma/produit/alcool-70-250ml-medicels/
Bébé Confort  Thermometre De bain Tortue Waterworld 0m+,https://citymall-para.ma/produit/bb-conf-thermometre-de-bain-tortue-waterworld-0m/
Bébé Confort  Trousse De Soin Thermometre & Bavoir & Ciseau,https://citymall-para.ma/produit/bebe-confort-trousse-de-soin-thermometre-bavoir-ciseau/
Bebe Confort 2 Cuilleres Thermo Sensitive T1 +4m,https://citymall-para.ma/produit/bb-conf-2-cuilleres-thermo-sensitive-t1-4m/
Bebe Confort Thermometre De bain Tortue Paper Boat,https://citymall-para.ma/produit/bb-conf-thermometre-de-bain-tortue-paper-boats-0m/
Bebe Confort Thermometre Frontal sans Contact +0m,https://citymall-para.ma/produit/bb-conf-thermometre-frontal-sans-contact-0m/
Beurer Thermometre Digital Blanc,https://citymall-para.ma/produit/thermometre-digital-blanc/
Beurer Thermometre Digital Bleu,https://citymall-para.ma/produit/thermometre-digital-bleu/
Beurer Thermometre Multifonction,https://citymall-para.ma/produit/thermometre-multifonction/
Beurer thermomètre tétine,https://citymall-para.ma/produit/thermometre-tetine/
Contour Plus Bandelettes 25pcs,https://citymall-para.ma/produit/contour-plus-bandelettes-25pcs/
Diabcontrol kit td4279,https://citymall-para.ma/produit/diabcontrol-kit-td4279/
Hartmann Idealflex Elastic Legere 8*3,https://citymall-para.ma/produit/hartmann-idealflex-elastic-legere-83-931911/
Hartmann Tensoval Duo Control Tensiometre M900224,https://citymall-para.ma/produit/hartmann-tensoval-duo-control-tensiometre-m900224/
Hartmann Thermoval Baby Thermometre Elec,https://citymall-para.ma/produit/hartmann-thermoval-baby-thermometre-elec-925092/
Hartmann Thermoval Standard LG1,https://citymall-para.ma/produit/hartmann-thermoval-standard-lg1-925021/
Hartmann Valaroll Drap D’examen 50*38cm,https://citymall-para.ma/produit/hartmann-valaroll-drap-dexamen-5038cm/
Hartmann Veroval Compact BPU 22-42 cm,https://citymall-para.ma/produit/hartmann-veroval-compact-bpu-22-42-cm-925422/
Hartmann Veroval Compact Tensiometre De poignet,https://citymall-para.ma/produit/hartmann-veroval-compact-tensiometre-de-poignet-925442/
Hartmann Veroval Tensiometre De bras,https://citymall-para.ma/produit/hartmann-veroval-tensiometre-de-bras-925302/
Oxymeter Fingertip Pulse A2,https://citymall-para.ma/produit/oxymeter-fingertip-pulse-a2/
Pur Thermometre Digital,https://citymall-para.ma/produit/pur-thermometre-digital/
Pur Thermometre Flexible,https://citymall-para.ma/produit/pur-thermometre-flexible/
Sejoy Infrared Thermometer DET-306,https://citymall-para.ma/produit/sejoy-infrared-thermometer-det-306/
Tips-haler masque pediatrique cloisonne 1-6ans,https://citymall-para.ma/produit/tips-haler-masque-pediatrique-cloisonne-1-6ans/
URGO bande de gaze hydrophile 3m*10 cm,https://citymall-para.ma/produit/urgo-bande-de-gaze-hydrophile-3m10-cm/
URGO bande de gaze hydrophile 3m*5 cm,https://citymall-para.ma/produit/urgo-bande-de-gaze-hydrophile-3m5-cm/
