titre,url
BABE ANTIOX SERUM VITAMIN C 30 ML,https://citymall-para.ma/produit/babe-antiox-serum-vitamin-c-30-ml/
BABE EYE CONTOUR DEPIGMENT+ 15ML,https://citymall-para.ma/produit/babe-eye-contour-depigment-15ml/
BABE HYDRA SERUM 30ML,https://citymall-para.ma/produit/babe-hydra-serum-30ml/
BABE REPAIR SERUM 30ML,https://citymall-para.ma/produit/babe-repair-serum-30ml/
DIETAROMA PROTEGE MOI DES COUPS DE FROID 30 ML,https://citymall-para.ma/produit/dietaroma-protege-moi-des-coups-de-froid-30-ml/
Kin Fluor Bain de bouche enfant Fraise 500ml,https://citymall-para.ma/produit/kin-fluor-bain-de-bouche-enfant-fraise-500ml/
Camomilla Blu Gel Lavante Première Peau 300ml,https://citymall-para.ma/produit/camomilla-blu-gel-lavante-premiere-peau-300ml-2/
D-BIOTIC Gel Surgras Pédiatrique 200 ml,https://citymall-para.ma/produit/d-biotic-gel-surgras-pediatrique-200-ml/
D-WHITE SPRAY SOLAIRE BIPHASIQUE SPF 50+ 200 ML,https://citymall-para.ma/produit/d-white-spray-solaire-biphasique-spf-50-200-ml/
DARCARE Thermomètre flexible Numérique MT506 Pour Bébé & Enfants,https://citymall-para.ma/produit/darcare-thermometre-flexible-numerique-mt506-pour-bebe-enfants/
Farlin Doctor J Coton-Tige Sécurité 60 unité,https://citymall-para.ma/produit/farlin-doctor-j-coton-tige-securite-60-unite/
Mustela Bébé Lait de Toilette 500ml+EAU RAFRAICHISSANTE 200ML+CREME CHANGE 50 ml+Lingettes Nettoyantes+Trousse,https://citymall-para.ma/produit/mustela-bebe-lait-de-toilette-500mleau-rafraichissante-200mlcreme-change-50-mllingettes-nettoyantestrousse/
BABE ANTIOX SERUM VITAMIN C 30 ML,https://citymall-para.ma/produit/babe-antiox-serum-vitamin-c-30-ml/
BABE EYE CONTOUR DEPIGMENT+ 15ML,https://citymall-para.ma/produit/babe-eye-contour-depigment-15ml/
BABE HYDRA SERUM 30ML,https://citymall-para.ma/produit/babe-hydra-serum-30ml/
BABE REPAIR SERUM 30ML,https://citymall-para.ma/produit/babe-repair-serum-30ml/
DIETAROMA PROTEGE MOI DES COUPS DE FROID 30 ML,https://citymall-para.ma/produit/dietaroma-protege-moi-des-coups-de-froid-30-ml/
Kin Fluor Bain de bouche enfant Fraise 500ml,https://citymall-para.ma/produit/kin-fluor-bain-de-bouche-enfant-fraise-500ml/
Camomilla Blu Gel Lavante Première Peau 300ml,https://citymall-para.ma/produit/camomilla-blu-gel-lavante-premiere-peau-300ml-2/
D-BIOTIC Gel Surgras Pédiatrique 200 ml,https://citymall-para.ma/produit/d-biotic-gel-surgras-pediatrique-200-ml/
D-WHITE SPRAY SOLAIRE BIPHASIQUE SPF 50+ 200 ML,https://citymall-para.ma/produit/d-white-spray-solaire-biphasique-spf-50-200-ml/
DARCARE Thermomètre flexible Numérique MT506 Pour Bébé & Enfants,https://citymall-para.ma/produit/darcare-thermometre-flexible-numerique-mt506-pour-bebe-enfants/
Farlin Doctor J Coton-Tige Sécurité 60 unité,https://citymall-para.ma/produit/farlin-doctor-j-coton-tige-securite-60-unite/
Mustela Bébé Lait de Toilette 500ml+EAU RAFRAICHISSANTE 200ML+CREME CHANGE 50 ml+Lingettes Nettoyantes+Trousse,https://citymall-para.ma/produit/mustela-bebe-lait-de-toilette-500mleau-rafraichissante-200mlcreme-change-50-mllingettes-nettoyantestrousse/
MUSTELA COFFRET BOY MUSTI EAU PARFUMEE+DOUDOU CADEAU,https://citymall-para.ma/produit/mustela-coffret-boy-musti-eau-parfumeedoudou-cadeau/
MUSTELA Sac de Naissance les Essentiels,https://citymall-para.ma/produit/mustela-sac-de-naissance-les-essentiels/
ONLY BABY Coffret manucure bébé avec ciseaux coupe-ongles brosse à cheveux et peigne,https://citymall-para.ma/produit/only-baby-coffret-manucure-bebe-avec-ciseaux-coupe-ongles-brosse-a-cheveux-et-peigne/
SENSILIS SKIN RESCUE SÉRUM SOS 30ml,https://citymall-para.ma/produit/sensilis-skin-rescue-serum-sos-30ml/
SLEEPY BIO NATURAL CULOTTES DOUBLE JUMBO MAXI T4 x 48,https://citymall-para.ma/produit/sleepy-bio-natural-culottes-double-jumbo-maxi-t4-x-48/
SMART BABY Biberon a Cuillère en Silicone  Pour Bébé 280 ml,https://citymall-para.ma/produit/smart-baby-biberon-a-cuillere-en-silicone-pour-bebe-280-ml/
Test de grossesse HCG,https://citymall-para.ma/produit/test-de-grossesse-hcg/
XIBEI Pack soin bébé kit coupe-ongles + ciseau + lime à ongles ( Rose ),https://citymall-para.ma/produit/xibei-pack-soin-bebe-kit-coupe-ongles-ciseau-lime-a-ongles-rose/
Ziaja Baume a levres 10ml,https://citymall-para.ma/produit/ziaja-baume-a-levres-10ml/
8882 Crème Couvrante Très Haute Protection SPF 50+ 40ML,https://citymall-para.ma/produit/8882-creme-fluide-tres-haute-protection-spf-50/
8882 Crème Régénératrice Spéciale 40ml,https://citymall-para.ma/produit/8882-creme-regeneratrice-speciale-40ml/
8882 Crème Teinté SPF50 Anti-Bronzage Princesse 40ML,https://citymall-para.ma/produit/8882-creme-fond-de-teint-tres-haute-protection-spf-50/
Avent  Biberon Natural 330 Ml 6 Mois Et + (Débit Rapide),https://citymall-para.ma/produit/avent-scf036-17-biberon-natural-330-ml-6-mois-et-debit-rapide/
AVENT  Couverts Pour Enfant De 18 Mois Et +,https://citymall-para.ma/produit/avent-scf71400-couverts-pour-enfant-de-18-mois-et/
AVENT TÉTINE ANTI-COLIC 6 MOIS ET + (DÉBIT RAPIDE) SCF634/27,https://citymall-para.ma/produit/avent-scf634-27-tetine-anti-colic-6-mois-et-debit-rapide/
AVENT 10 Pot de Recharge Avec Couvercle 180ML,https://citymall-para.ma/produit/avent-10-pot-de-recharge-240ml/
AVENT 2 Becs Souple Magic +6M,https://citymall-para.ma/produit/avent-2-becs-souples-magic-6m/
AVENT 2 Sucette ULTRA Air 6-18 Mois,https://citymall-para.ma/produit/avent-2-sucette-ultra-air-6-18-mois/
AVENT 2 Sucette ULTRA Air Animals Filles 0-6 Mois,https://citymall-para.ma/produit/avent-2-sucette-ultra-air-animals-filles-0-6-mois/
AVENT 2 Sucette ULTRA Air Animals Garçon 0-6 Mois,https://citymall-para.ma/produit/avent-2-sucette-ultra-air-animals-garcon-0-6-mois/
AVENT 2 Sucette ULTRA Air Happy Filles 0-6 Mois,https://citymall-para.ma/produit/avent-2-sucette-ultra-air-happy-filles-0-6-mois/
AVENT 2 Sucettes ULTRA Air 0-6 Mois,https://citymall-para.ma/produit/avent-2-sucettes-ultra-air-0-6-mois/
AVENT 2 Sucettes ULTRA Air Animals Filles 6-18 Mois,https://citymall-para.ma/produit/avent-2-sucettes-ultra-air-animals-filles-6-18-mois/
AVENT 2 Sucettes ULTRA Air Animals Garçon 6-18 Mois,https://citymall-para.ma/produit/avent-2-sucettes-ultra-air-animals-garcon-6-18-mois/
AVENT 2 Sucettes ULTRA Air Happy Filles 6-18 Mois,https://citymall-para.ma/produit/avent-2-sucettes-ultra-air-happy-filles-6-18-mois/
AVENT 2 Sucettes Ultra Air Happy Garçon 0-6 Mois,https://citymall-para.ma/produit/avent-2-sucettes-ultra-air-happy-garcon-0-6-mois/
AVENT 2 Sucettes ULTRA Air Happy Garçon 6-18 Mois,https://citymall-para.ma/produit/avent-2-sucettes-ultra-air-happy-garcon-6-18-mois/
AVENT 2 Sucettes ULTRA Soft 6-18 Mois,https://citymall-para.ma/produit/avent-2-sucettes-ultra-soft-6-18-mois/
AVENT 2 TETINES 0M+ 1T SCF 631/27,https://citymall-para.ma/produit/avent-2-tetines-0m-1t-scf-631-27/
AVENT 2 TETINES 1M+ 1T SCF 632/27,https://citymall-para.ma/produit/avent-2-tetines-1m-1t-scf-632-27/
AVENT 2 TETINES 3M+ 3T SCF633/27,https://citymall-para.ma/produit/avent-2-tetines-3m-3t-scf633-27/
AVENT Assiette Divisee +12 Mois,https://citymall-para.ma/produit/avent-assiette-divisee-12-mois/
Avent Chauffe-Biberon Rapide,https://citymall-para.ma/produit/avent-chauffe-biberon-rapide-scf355-07/
AVENT CHAUFFE-BIBERON RAPIDE SCF355 07,https://citymall-para.ma/produit/avent-chauffe-biberon-rapide-scf355-07-2/
AVENT Coquilles Confort 2 en 1,https://citymall-para.ma/produit/avent-coquilles-confort-2-en-1/
AVENT DOSEUR DE LAIT EN POUDRE,https://citymall-para.ma/produit/avent-doseur-de-lait-en-poudre-scf-135-06/
AVENT Housse pour Biberon Verre,https://citymall-para.ma/produit/avent-housse-pour-biberon-verre-pm-675-01/
Avent Kit Nouveau-Né Biberons Natural,https://citymall-para.ma/produit/avent-kit-nouveau-ne-biberons-natural/
AVENT Kit Nouveau-Né SCD290/00,https://citymall-para.ma/produit/avent-kit-nouveau-ne-scd29000/
Avent Natural Tire-Lait Manuel,https://citymall-para.ma/produit/avent-natural-tire-lait-manuel/
Avent philips Écoute-bébé DECT (Portée de 330 m),https://citymall-para.ma/produit/avent-philips-ecoute-bebe-dect-scd505-00-portee-de-330-m/
AVENT Robot Cuiseur Vapeur/Mixeur,https://citymall-para.ma/produit/avent-robot-cuiseur-vapeur-mixeur-scf-870-21/
AVENT SAC ISOTHERME THERMABAG SCF 150/11,https://citymall-para.ma/produit/avent-sac-isotherme-thermabag-scf-150-11/
AVENT set Cuillere/Fourchette +12m,https://citymall-para.ma/produit/avent-set-cuillere-fourchette-12m-712-00/
AVENT Tasse À Bec 340 Ml 18 Mois Et + SCF755/07,https://citymall-para.ma/produit/avent-scf755-07-tasse-a-bec-340-ml-18-mois-et/
AVENT Tasse Bleu a Paille 200ml 9m+ SCF796/01,https://citymall-para.ma/produit/avent-tasse-bleu-a-paille-200ml-9m-scf796-01/
AVENT Tasse d’apprentissage 9 Mois + 260ml SCF782/20,https://citymall-para.ma/produit/avent-tasse-dapprentissage-9-mois-260ml-scf782-20/
Avent Tasse Mauve +6m 200ml Scf551/03,https://citymall-para.ma/produit/avent-tasse-mauve-6m-200ml-scf551-03/
AVENT Tasse Mauve a Paille 200ml 9m+ SCF796/02,https://citymall-para.ma/produit/avent-tasse-mauve-a-paille-200ml-9m-scf796-02/
AVENT Tasse Pingouin avec anses noir 12m+ 260ml 753/03,https://citymall-para.ma/produit/avent-tasse-pingouin-avec-anses-noir-12m-260ml-753-03/
AVENT Tasse Rose a Paille 300ml 12m+ SCF798/02,https://citymall-para.ma/produit/avent-tasse-rose-a-paille-300ml-12m-scf798-02/
AVENT Tasse sans Anses 260ml 12m+ Scf553/05,https://citymall-para.ma/produit/avent-tasse-sans-anses-260ml-12m-scf553-05/
AVENT Tasse Vert a Paille 300ml 12m+ SCF798/01,https://citymall-para.ma/produit/avent-tasse-vert-a-paille-300ml-12m-scf798-01/
AVENT Tetine Natural 1m+ Scf042/27,https://citymall-para.ma/produit/avent-tetine-natural-1m-scf042-27/
AVENT TETINE NATURAL 3M+ SCF043/27,https://citymall-para.ma/produit/avent-tetine-natural-3m-scf043-27/
AVENT Tetine Natural 3m+ Scf045/27,https://citymall-para.ma/produit/avent-tetine-natural-3m-scf045-27/
AVENT Thermomètre Numérique Rose 550/21,https://citymall-para.ma/produit/avent-thermometre-numerique-rose-550-21/
AVENT Tire Lait Electrique Scf332/62,https://citymall-para.ma/produit/avent-tire-lait-electrique-scf332-62/
BABE CRÈME ANTI-VERGETURES 200 ML,https://citymall-para.ma/produit/babe-creme-anti-vergetures-200-ml/
Babe Crème Émolliente Hydratante Intense 200ml,https://citymall-para.ma/produit/babe-creme-emolliente-hydratante-intense-200ml/
BABE PEDIATRIC BODY MILK 500 ML,https://citymall-para.ma/produit/babe-lait-hydratant-corporel-500ml/
BABE Neceser Set Pédiatrique Pour Bébé 5 Pièces,https://citymall-para.ma/produit/babe-neceser-set-pediatrique-pour-bebe-5-pieces/
BABE Pack Stop AKN Gel Nettoyant Purifiant 200 ml + Gel anti-boutons 8 ml,https://citymall-para.ma/produit/babe-pack-stop-akn-gel-nettoyant-purifiant-200-ml-gel-anti-taches-8-ml/
BABE PÉDIATRIQUE CRÈME SOLAIRE LOTION SPF50+ 100ML,https://citymall-para.ma/produit/babe-pediatrique-creme-solaire-lotion/
BABE BATH GEL 500ML,https://citymall-para.ma/produit/babe-pediatrique-gel-de-bain-500-ml/
BABE PÉDIATRIQUE NAPPY RASH CRÈME DE CHANGE 100ML,https://citymall-para.ma/produit/babe-pediatrique-nappy-rash-creme-de-change-100ml/
BABE PEDIATRIC EXTRA MILD SHAMPO 200 ML,https://citymall-para.ma/produit/babe-pediatrique-shampooing-extra-doux-200-ml/
Baby Cocole Lait Hydratant 100ml,https://citymall-para.ma/produit/baby-cocole-lait-hydratant-100ml/
BABY PARK Biberon 60 ml,https://citymall-para.ma/produit/baby-park-biberon-60-ml/
Babycoccole Bain et Shampooing 2 en 1 100ML,https://citymall-para.ma/produit/babycoccole-bain-et-shampooing-2-en-1-100-ml/
Babycoccole Bain et Shampooing 2 en 1 250ML,https://citymall-para.ma/produit/babycoccole-bain-et-shampooing-2-en-1-250-ml/
Babycoccole Lait Hydratant 250ML,https://citymall-para.ma/produit/babycoccole-lait-hydratant-250ml/
Babycoccole Pommade De Change 30ML,https://citymall-para.ma/produit/babycoccole-pommade-de-change-30ml/
BABYSET Crème de change 40g,https://citymall-para.ma/produit/babyset-creme-de-change-40g/
BABYSET Crème de change 60G,https://citymall-para.ma/produit/babyset-creme-de-change-60g/
BAMBO Nature 5 Couches xl 12-18kg/44un,https://citymall-para.ma/produit/bambo-nature-5-couches-xl-12-18kg-44un/
BAMBO Nature Couche S T2 3-6KG 30U,https://citymall-para.ma/produit/bambo-nature-couche-s-t2-3-6kg-30u/
BAMBO NATURE COUCHE XXL T6 +16KG KG 40U,https://citymall-para.ma/produit/bambo-nature-couche-xxl-t6-16kg-kg-40u/
BAROQUE Collier d’Ambre Naturel,https://citymall-para.ma/produit/baroque-collier-dambre-naturel/
BC 2 Tétines Standard 0-6m 3Vitesses,https://citymall-para.ma/produit/bc-2-tetines-standard-0-6m-3vitesses/
BC 2Sucettes Classique Physiologique Silicon,https://citymall-para.ma/produit/bc-2sucettes-classique-physiologique-silicon/
BC Maternité Tet Silicone x2 0-6 m,https://citymall-para.ma/produit/bc-maternite-tet-silicone-x2-0-6-m/
BC Tétines Emotion – t.2 3 Vitesses (6/24m) – Silicone x2,https://citymall-para.ma/produit/bc-tetines-emotion-t-2-3-vitesses-6-24m-silicone-x2/
Bébé Conf Biberon Émotion Blanc 6-24m 360ml,https://citymall-para.ma/produit/bebe-conf-biberon-emotion-blanc-6-24m-360ml/
Bebe Confort Brosse Et Peigne Avec Miroir,https://citymall-para.ma/produit/bebe-confort-brosse-et-peigne-avec-miroir/
Bébé Confort Goupillon Embout éponge 7958,https://citymall-para.ma/produit/bebe-confort-goupillon-embout-eponge-7958/
Bebe D’or Bib large poignet 150ml 88322,https://citymall-para.ma/produit/bebe-dor-bib-large-poignet-150ml-88322/
Bebe D’or Bib poignet ref 77302 250ml,https://citymall-para.ma/produit/bebe-dor-bib-poignet-ref-77302-250ml/
Bebe d’or sac fruit & legumes ref 585,https://citymall-para.ma/produit/bebe-dor-sac-fruit-legumes-ref-585/
Bebe d’or sac fruit & legumes ref 587,https://citymall-para.ma/produit/bebe-dor-sac-fruitlegumes-ref-587/
Bebe d’or sucette air ortho 18m+ ref 183,https://citymall-para.ma/produit/bebe-dor-sucette-air-ortho-18m-ref-183/
Bebe d’or sucette art ortho 6-18m ref 162,https://citymall-para.ma/produit/bebe-dor-sucette-art-ortho-6-18m-ref-162/
BEBEDOR Coupe Ongle Bebe 552,https://citymall-para.ma/produit/bebedor-coupe-ongle-bebe-552/
Bébédor Pack Sucettes Glace Rose – 584,https://citymall-para.ma/produit/bebedor-pack-sucettes-glace-rose-584/
Bebedor Sucette Art Ortho 18M Ref 163,https://citymall-para.ma/produit/bebedor-sucette-art-ortho-18m-ref-163/
Begobano Eponge Savonneuse Baby Bano 25 unités,https://citymall-para.ma/produit/begobano-eponge-savonneuse-baby-bano-25-unites/
BETER Brosse Double Ongles,https://citymall-para.ma/produit/beter-brosse-double-ongles/
BETER Coupe Ongles de Manucure Avec Lime Chromé,https://citymall-para.ma/produit/beter-coupe-ongles-de-manucure-avec-lime-chrome/
BETER Coupe-Cuticules à Triple Usage Avec Repoussoir Lime,https://citymall-para.ma/produit/beter-coupe-cuticules-a-triple-usage-avec-repoussoir-lime/
BIBERON Nûby en Polycarbonate Col Large 0m+ 180ML,https://citymall-para.ma/produit/biberon-nuby-en-polycarbonate-col-large-0m-180ml/
Bibi Biberon avec Paille 350ml,https://citymall-para.ma/produit/bibi-biberon-avec-paille-350ml/
Bio-Oil Huile anti-vergetures – 125 ml,https://citymall-para.ma/produit/bio-oil-huile-anti-vergetures-125-ml/
Bioderma ABCDerm Gel Nettoyant Moussant Doux 200ml,https://citymall-para.ma/produit/bioderma-abcderm-gel-nettoyant-moussant-doux-200ml/
Bioderma ABCDerm Huile Douceur 200ml,https://citymall-para.ma/produit/bioderma-abcderm-huile-douceur-200ml/
BIODERMA ABCDerm Lait Hydratant 200ML,https://citymall-para.ma/produit/bioderma-abcderm-lait-hydratant-200ml/
Bioderma ABCDerm Shampooing Doux  200ml,https://citymall-para.ma/produit/bioderma-abcderm-shampooing-doux-200ml/
Bioderma atoderm intensive eye 100ml,https://citymall-para.ma/produit/bioderma-atoderm-intensive-eye-100ml/
Bioderma atoderm intensive gel moussant 200ml,https://citymall-para.ma/produit/bioderma-atoderm-intensive-gel-moussant-200ml/
BIODERMA CICABIO CRÈME RÉPARATRICE APAISANTE 40ML,https://citymall-para.ma/produit/bioderma-cicabio-creme-reparatrice-apaisante-40ml/
Bioderma cicabio SPF50+ soin réparateur 30ml,https://citymall-para.ma/produit/bioderma-cicabio-spf50-soin-reparateur-30ml/
Bioderma Sébium Global Cover 30ml,https://citymall-para.ma/produit/bioderma-sebium-global-cover-30ml/
Bioderma Sébium Global Soin Intense Purifiant 30ml,https://citymall-para.ma/produit/bioderma-sebium-global-s-int-30ml/
Biofar Kids Multivitamines Boite 20CP,https://citymall-para.ma/produit/biofar-kids-multivitamines-boite-20cp/
Biostop Spray Anti-Moustiques 100ml,https://citymall-para.ma/produit/biostop-spray-anti-moustiques-100ml/
Bocoton Coussinets allaitement 30 unites,https://citymall-para.ma/produit/bocoton-coussinets-allaitement-30-unites/
Bubu Crème Érythème Fessier 75ml,https://citymall-para.ma/produit/bubu-creme-erytheme-fessier-75ml-2/
BVLGARI Omnia Coral Eau de toilette femme 65 ml,https://citymall-para.ma/produit/bvlgari-omnia-coral-eau-de-toilette-femme-65-ml/
"Camomilla Blu Bio Nettoyant Intime Active ph 3,5 300 ml",https://citymall-para.ma/produit/camomilla-blu-active-nettoyant-intime-ph-3-5-300ml/
CAMOMILLA BLU CRÈME HYDRATANTE 180ML,https://citymall-para.ma/produit/camomilla-blu-creme-hydratante-180ml/
Camomilla Blu Gel Lavante Premiere Peau 300ml,https://citymall-para.ma/produit/camomilla-blu-gel-lavante-premiere-peau-300ml/
CAMOMILLA BLU LOVELY GIRL NETTOYANT INTIME PH 5.5 300ML,https://citymall-para.ma/produit/camomilla-blu-lovely-girl-nettoyant-intime-ph-5-5-300ml/
CAMOMILLA BLU Pâte Ultra Protection 100ML,https://citymall-para.ma/produit/camomilla-blu-pate-ultra-protection-100ml/
Camomilla Gel nettoyant surgras 300ml,https://citymall-para.ma/produit/camomilla-gel-nettoyant-surgras-300ml/
Cantabria Labs Vitilium 50 Ml,https://citymall-para.ma/produit/cantabria-labs-vitilium-50-ml/
CAPIDERMA CRÈME HYDRATANTE,https://citymall-para.ma/produit/capiderma-creme-hydratante/
CASTALIA Sensial Gel Nettoyant Surgras 200ml,https://citymall-para.ma/produit/castalia-sensial-gel-nettoyant-surgras-200ml/
CATTIER BÉBÉ Lait de Toilette Bio 500ML,https://citymall-para.ma/produit/cattier-bebe-lait-de-toilette-bio-500ml/
CATTIER Dentifrice kids 2-6 ans Goût framboise Sans sulfates 50ML,https://citymall-para.ma/produit/cattier-dentifrice-soins-enfant2-6-ans-framboise-50ml/
CATTIER Spray Démêlant Familial Bio 200ML,https://citymall-para.ma/produit/cattier-spray-demelant-familial-bio-200ml/
Caudalie Eau De Raisin 200ml,https://citymall-para.ma/produit/caudalie-eau-de-raisin-200ml/
Caudalie premier cru La Crème Riche 50ml,https://citymall-para.ma/produit/caudalie-premier-cru-la-creme-riche-50ml/
Caudalie Soin corps  Nourrissant Thé Des Vignes 200 ml,https://citymall-para.ma/produit/caudalie-soin-corps-nourrissant-the-des-vignes-200-ml/
Caudalie Thé Des Vignes Duo Lèvres & Mains,https://citymall-para.ma/produit/caudalie-the-des-vignes-duo-levres-mains/
Caudalie Vinoperfect Crème Mains Anti Taches 50ml,https://citymall-para.ma/produit/caudalie-vinoperfect-creme-mains-anti-taches-50ml/
CAUDALIE VINOSCULPT BAUME CORPS LIFT &AMP; FERMETÉ 250 ML,https://citymall-para.ma/produit/caudalie-vinosculpt-baume-corps-lift-fermete-250-ml/
Caudalie Vinosource Hydra Gelee Eau Raisin 50ml pot,https://citymall-para.ma/produit/caudalie-vinosource-hydra-gelee-eau-raisin-50ml-pot/
Caudalie Vinotherapist Crème Beauté Des Pieds 75ml,https://citymall-para.ma/produit/caudalie-vinotherapist-creme-beaute-des-pieds-75ml/
CERAVE BAUME HYDRATANT NOURRISSANT PEAU SÈCHE 454G POMPE,https://citymall-para.ma/produit/cerave-baume-hydratant-nourrissant-peau-seche-a-tres-seche-454g-pompe/
Cerave Crème Moussante Nettoyante Hydratante 236ml,https://citymall-para.ma/produit/cerave-creme-moussante-nettoyante-hydratante-236ml/
CERAVE EAU MICELLAIRE DÉMAQUILLANTE HYDRATANTE 295ML,https://citymall-para.ma/produit/cerave-eau-micellaire-demaquillante-hydratante-295ml/
CeraVe Huile Lavante Moussante Hydratante Peau Très Sèche à Atopique 236ml,https://citymall-para.ma/produit/cerave-huile-lavante-moussante-hydratante-236ml/
CERAVE HUILE LAVANTE MOUSSANTE HYDRATANTE 473ML,https://citymall-para.ma/produit/cerave-huile-lavante-moussante-hydratante-473ml/
CeraVe SA Gel Nettoyant Anti-Rugosités Peau Sèche et Rugueuse 236ml,https://citymall-para.ma/produit/cerave-sa-gel-nettoyant-anti-rugosites-236ml/
CeraVe SA Gel Nettoyant Anti-Rugosités Peau Sèche Et Rugueuse  473ml,https://citymall-para.ma/produit/cerave-sa-gel-nettoyant-anti-rugosites-473ml/
CETAPHIL Bright Healthy Radiance Body Wash 245ml,https://citymall-para.ma/produit/cetaphil-bright-healthy-radiance-body-wash-245ml/
Cetaphil Bright Healthy Radiance Brightness Reveal 100g,https://citymall-para.ma/produit/cetaphil-bright-healthy-radiance-brightness-reveal-100-g/
CETAPHIL Bright Healthy Radiance Crème De Nuit 50G,https://citymall-para.ma/produit/cetaphil-bright-healthy-radiance-creme-de-nuit-50g/
CÉTAPHIL LOTION HYDRATANTE 236ML,https://citymall-para.ma/produit/cetaphil-lotion-hydratante-236-ml-2/
Chicco baby moments bagno shampoo senza lacrime 750 ml,https://citymall-para.ma/produit/chicco-baby-moments-bagno-shampoo-senza-lacrime-750-ml/
Chicco Bagno Schiuma bain mousse 200ml,https://citymall-para.ma/produit/chicco-bagno-schiuma-bain-mousse-200ml/
Chicco clip + Chainette +0m,https://citymall-para.ma/produit/chicco-clip-chainette-0m/
Chicco Poignet/2 BLEU CL/OCEAN,https://citymall-para.ma/produit/chicco-poignet-2-bleu-cl-ocean/
Chicco Poignet/2 ROSE/VIOLET,https://citymall-para.ma/produit/chicco-poignet-2-rose-violet/
Chicco Poignet/2 VERT/JAUNE,https://citymall-para.ma/produit/chicco-poignet-2-vert-jaune/
Chicco Protege Sucette 0m+,https://citymall-para.ma/produit/chicco-protege-sucette-0m/
Chicco Soleil après le soleil lait soins du corps,https://citymall-para.ma/produit/chicco-soleil-apres-le-soleil-lait-soins-du-corps/
Chicco Sterilis micro ondes 0M+,https://citymall-para.ma/produit/chicco-sterilis-micro-ondes-0m/
Chicco Tétine Silicone step up2 4M+ Flux Rapide,https://citymall-para.ma/produit/chicco-tetine-silicone-step-up2-4m-flux-rapide/
Chicco Tétine Silicone step up3 6M+ Flux Rapide,https://citymall-para.ma/produit/chicco-tetine-silicone-step-up3-6m-flux-rapide/
Chicco Tetine Step UP2 2m+ Moyen,https://citymall-para.ma/produit/chicco-tetine-step-up2-2m-variable/
Ciseaux Béaba – Rose,https://citymall-para.ma/produit/ciseaux-beaba-rose/
CODEXIAL Enobright Radiance Day Émulsion Éclat Anti-Taches 30ML,https://citymall-para.ma/produit/codexial-enobright-radiance-day-emulsion-eclat-anti-taches-30ml/
CODEXIAL Enobright Radiance Intense Sérum Intensif Anti-Taches Soin d’Attaque 15ML,https://citymall-para.ma/produit/codexial-enobright-radiance-intense-serum-intensif-anti-taches-soin-dattaque-15ml/
CODEXIAL Enoliss Perfect Skin Body 25 AHA 100ML,https://citymall-para.ma/produit/codexial-enoliss-perfect-skin-body-25-aha-100ml/
CODEXIAL Enoliss Perfect Skin Spot 30ML,https://citymall-para.ma/produit/codexial-enoliss-perfect-skin-spot-30ml/
COMFORT BABY Coton TIGE 60 PIECES,https://citymall-para.ma/produit/dodie-batonnets-bebe/
Complément Grossesse Vitamines +Minéraux 60 Gélules,https://citymall-para.ma/produit/complement-grossesse-vitamines-mineraux-60-gelules/
CoreTests pack 5 Tests d’ovulation précis efficace et rapide,https://citymall-para.ma/produit/coretests-pack-5-tests-dovulation-precis-efficace-et-rapide/
COTON CARRES DE SOIN/100 GILBERT,https://citymall-para.ma/produit/coton-carres-de-soin-100-gilbert/
Covermark Rayblock body plus for kids Spf50+ 100ml,https://citymall-para.ma/produit/covermark-rayblock-body-plus-for-kids-spf50-100ml/
CREMAZOL crème cicatrisante 30g,https://citymall-para.ma/produit/cremazol-creme-cicatrisante-30g/
DERMACARE Cleanea Gel Moussant Surgras 200ML,https://citymall-para.ma/produit/dermacare-cleanea-gel-moussant-surgras-200ml/
DERMINE CRÈME DOUCEUR CONTRE LES ROUGEURS 80G,https://citymall-para.ma/produit/dermine-creme-douceur-contre-les-rougeurs-80g/
Dermo Soins Structuderm Creme Anti Vergerture 75ml,https://citymall-para.ma/produit/dermo-soins-structuderm-creme-anti-vergerture-75ml/
Dior Higher Dior Eau De Toilette 100ml,https://citymall-para.ma/produit/dior-higher-dior-eau-de-toilette-100ml/
Dodie – Tétines Col Large (6M +) 3 Vitesses Débit 3 (X2),https://citymall-para.ma/produit/dodie-tetines-col-large-6m-3-vitesses-debit-3-x2/
Dodie – Tétines Col Large (6M +) Liquide Épais 3 Vitesses Débit 4 (X2),https://citymall-para.ma/produit/dodie-tetines-col-large-6m-liquide-epais-3-vitesses-debit-4-x2/
Dodie 2 Sucettes 0-6m Anat A31 Duo Maman Papa Cheri,https://citymall-para.ma/produit/dodie-2-sucettes-0-6m-anat-a31-duo-maman-papa-cheri/
DODIE Anneau de dentition Lapin vert LAGOON,https://citymall-para.ma/produit/dodie-anneau-de-dentition-lapin-vert-lagoon/
Dodie Anneau réfrigéré 2/1 +6m rose,https://citymall-para.ma/produit/dodie-anneau-refrigere-2-1-6m-rose/
Dodie Bib en verre 240ml rose,https://citymall-para.ma/produit/dodie-bib-en-verre-240ml-rose/
Dodie Bib initiation+ 330ml rose danse 6m+,https://citymall-para.ma/produit/dodie-bib-initiation-330ml-rose-danse-6m/
DODIE Biberon Sensation+ Anti Colique Tetine Plate 270ML,https://citymall-para.ma/produit/dodie-biberon-sensation-270-ml-debit-2-0-6-mois/
Dodie Boite a sucette 274,https://citymall-para.ma/produit/dodie-boite-a-sucette-274/
Dodie Chauffe biberon électrique compact,https://citymall-para.ma/produit/dodie-chauffe-biberon-electrique-compact/
Dodie Coffret Biberon x2 Initiation+ 150ml Mixte,https://citymall-para.ma/produit/dodie-coffret-biberon-x2-initiation-150ml-mixte/
Dodie Comprimés de stérilisation x 32,https://citymall-para.ma/produit/dodie-comprimes-de-sterilisation-x-32/
Dodie Crème de change 75ml,https://citymall-para.ma/produit/dodie-creme-de-change-75ml/
Dodie Sucette Anatomique +18m 37,https://citymall-para.ma/produit/dodie-sucette-anatomique-18m-37/
Dodie Sucette Anatomique 0‐6 silicone duo nuit n°32F,https://citymall-para.ma/produit/dodie-sucette-anatomique-0%e2%80%906-silicone-duo-nuit-n32f/
