titre,url
Biokera Shampoing Cheveux Traites 300ml,https://citymall-para.ma/produit/biokera-shampoing-cheveux-traites-300ml/
BIOKERA SHAMPOOING FRESH YELLOW SHOT 300ML,https://citymall-para.ma/produit/biokera-shampooing-fresh-yellow-shot-300ml/
Biorga Cystiphane Shampoing Anti Pel Modérés 200ml,https://citymall-para.ma/produit/biorga-cystiphane-shampoing-anti-pel-moderes-200ml/
Biorga Cystiphane Shampoing Anti-Pelliculaire Intensif Ds 200 ml,https://citymall-para.ma/produit/biorga-cystiphane-shampoing-anti-pelliculaire-intensif-ds-200-ml-2/
Biorga Sebophane Shampooing 200ml,https://citymall-para.ma/produit/biorga-sebophane-shampooing-200ml/
Caditar Sérum Anti-Chute De Cheveux,https://citymall-para.ma/produit/caditar-serum-anti-chute-de-cheveux/
CADITAR Shampooing Anti Seborrehique 150ML,https://citymall-para.ma/produit/caditar-shampooing-anti-seborrehique-150ml/
Callys Serum Glycolagen Cure 12ml,https://citymall-para.ma/produit/callys-serum-glycolagen-cure-12ml/
Callys Sérum Hydratant Et Repulpant Intensif 12ML,https://citymall-para.ma/produit/callys-serum-hydratant-et-repulpant-intensif-12ml/
Capiderma – Shampoing Anti-Pelliculaire – 200 ml,https://citymall-para.ma/produit/capiderma-shampoing-anti-pelliculaire-200-ml/
CAPIDERMA – SHAMPOING ENERGISANT – 200 ML,https://citymall-para.ma/produit/capiderma-shampoing-energisant-200-ml/
Capiderma – Shampoing Energisant – 200 Ml,https://citymall-para.ma/produit/capiderma-shampoing-energisant-200-ml-2/
Capiderma – Shampoing Fortifiant à La kératine – 200 ml,https://citymall-para.ma/produit/capiderma-shampoing-fortifiant-a-la-keratine-200-ml/
Capiderma Capiphan Ongles & Cheveux 60capsules,https://citymall-para.ma/produit/capiderma-capiphan-ongles-cheveux-60capsules/
CAPIDERMA LOTION SOIN INTENSIF ANTI-CHUTE 150ML,https://citymall-para.ma/produit/capiderma-lotion-soin-intensif-anti-chute-150ml/
Capiderma Masque Traitant Reparateur Cheveux Intens 200ml,https://citymall-para.ma/produit/capiderma-masque-traitant-reparateur-cheveux-intens-200ml/
Capiderma serum reparateur cheveux abimes 50 ml,https://citymall-para.ma/produit/capiderma-serum-reparateur-cheveux-abimes-50-ml/
CAPILLUM Lotion Anti Pelliculaire Spray 100ML,https://citymall-para.ma/produit/capillum-lotion-anti-pelliculaire-spray-100ml/
CAPILLUM Masque à la Kératine 200G,https://citymall-para.ma/produit/capillum-masque-a-la-keratine-200-g/
Capillum Serum Anti-Chute 60ml,https://citymall-para.ma/produit/capillum-serum-anti-chute-60ml/
CAPILLUM Shampoing Sebo Regule 240ML,https://citymall-para.ma/produit/capillum-capilum-shampoing-sebo-regule-240-ml/
CAPILLUM Shampooing à la Kératine 240ML,https://citymall-para.ma/produit/capillum-shampooing-a-la-keratine-240-ml/
CAPILLUM Shampooing Anti Pelliculaire 240ML,https://citymall-para.ma/produit/capillum-shamp-anti-pelliculaire-240ml/
CAPILLUM Shampooing Fortifiant 240ML,https://citymall-para.ma/produit/capillum-shampooing-fortifiant-240ml/
Cattier Moussant Familial Corps et Cheveux 1L,https://citymall-para.ma/produit/cattier-moussant-familial-1-l/
CATTIER Shampoing Douche Argile Blanche 200ML,https://citymall-para.ma/produit/shampoing-douche-argile-blanche-cattier/
Cattier Shampoing Usage Fréquent Lait D’avoine Bio 250ML,https://citymall-para.ma/produit/cattier-shampoing-usage-frequent-lait-davoine-bio-250-ml/
CATTIER Shampooing Cheveux Regressant Vite 250ML,https://citymall-para.ma/produit/cattier-shampooing-cheveux-regressant-vite-250ml/
Caudalie premier cru La Crème Riche 50ml,https://citymall-para.ma/produit/caudalie-premier-cru-la-creme-riche-50ml/
Ceylon naturals huile de coco 200ml,https://citymall-para.ma/produit/ceylon-naturals-huile-de-coco-200ml/
Chenes Color et Soin 4B Chatain Brownie,https://citymall-para.ma/produit/chenes-color-soin-4b-chatain-brownie/
Cliniceutica ceracap masque nutri reparateur 200ml,https://citymall-para.ma/produit/cliniceutica-ceracap-masque-nutri-reparateur-200-ml/
Cliniceutica Ceracap Masque Nutri-Reparateur 200ml,https://citymall-para.ma/produit/cliniceutica-ceracap-masque-nutri-reparateur-200ml/
Color & Soin Chatain naturel 4N,https://citymall-para.ma/produit/color-soin-chatain-naturel-4n/
Color et Soin 5G Chatain clair dore,https://citymall-para.ma/produit/color-soin-5g-chatain-clair-dore/
Color et Soin 5M Chatain clair acajou,https://citymall-para.ma/produit/color-soin-5m-chatain-clair-acajou/
Color et Soin 5N Chatain clair,https://citymall-para.ma/produit/color-soin-5n-chatain-clair/
Color et soin 6G Blond fonce dore,https://citymall-para.ma/produit/color-soin-6g-blond-fonce-dore/
Color et Soin 7G blond dore,https://citymall-para.ma/produit/color-soin-7g-blond-dore/
Color Et Soin Chatain Acajou 4M,https://citymall-para.ma/produit/color-et-soin-chatain-acajou-4m-2/
Color et Soin Chatain fonce 3N,https://citymall-para.ma/produit/color-soin-chatain-fonce-3n/
Cystiphane Biorga Lotion Anti-Chute 125ml,https://citymall-para.ma/produit/cystiphane-biorga-lotion-anti-chute-125ml-2/
Cystiphane Shampooing Anti-chute 200ml,https://citymall-para.ma/produit/cystiphane-shampooing-anti-chute-200ml/
D-CAP AMPOULES TRAITEMENT INTENSIF ANTI-CHUTE 12 X 10 ML,https://citymall-para.ma/produit/d-cap-ampoules-traitement-intensif-anti-chute-12-x-10-ml/
D-CAP ANTI-PELLICULAIRE APRÈS-SHAMPOOING 250ML,https://citymall-para.ma/produit/d-cap-anti-pelliculaire-apres-shampooing-250ml/
D-CAP ANTI-PELLICULAIRE SÉRUM HYDRATANT 50ML,https://citymall-para.ma/produit/d-cap-anti-pelliculaire-serum-hydratant-50ml/
D-CAP ANTI-PELLICULAIRE SHAMPOOING CHEVEUX GRAS 250ML,https://citymall-para.ma/produit/d-cap-anti-pelliculaire-shampooing-cheveux-gras-250ml/
D-CAP ANTI-PELLICULAIRE SHAMPOOING CHEVEUX SECS 250ML,https://citymall-para.ma/produit/d-cap-anti-pelliculaire-shampooing-cheveux-secs-250-ml/
D-CAP APRES SHAMPOOING CHEVEUX BOUCLES 250 ML,https://citymall-para.ma/produit/d-cap-apres-shampooing-cheveux-boucles-250-ml/
D-CAP APRES SHAMPOOING REPARATION TOTALE CHEVEUX ABIMES 250 ML,https://citymall-para.ma/produit/d-cap-apres-shampooing-reparation-totale-cheveux-abimes-250-ml/
D-CAP BOOSTER CHEVEUX BOUCLES 200 ML,https://citymall-para.ma/produit/d-cap-booster-cheveux-boucles-200-ml/
D-CAP LOTION TRAITEMENT INTENSIF ANTI-CHUTE 100 ML,https://citymall-para.ma/produit/d-cup-lotion-traitement-intensif-anti-chute-100-ml/
D-CAP MASQUE CHEVEUX BOUCLES 200 ML,https://citymall-para.ma/produit/d-cap-masque-cheveux-boucles-200-ml/
D-CAP MASQUE REPARATION TOTALE CHEVEUX ABIMES 250 ML,https://citymall-para.ma/produit/d-cap-masque-reparation-totale-cheveux-abimes-250-ml/
D-CAP SERUM REPARATION TOTALE CHEVEUX ABIMES 100 ML,https://citymall-para.ma/produit/d-cap-serum-reparation-totale-cheveux-abimes-100-ml/
D-CAP SHAMPOOING CHEVEUX BOUCLES 250 ML,https://citymall-para.ma/produit/d-cap-shampooing-cheveux-boucles-250-ml/
D-CAP SHAMPOOING REPARATION TOTALE CHEVEUX ABIMES 250 ML,https://citymall-para.ma/produit/d-cap-shampooing-reparation-totale-cheveux-abimes-250-ml/
D-CAP SHAMPOOING TRAITEMENT INTENSIF ANTI-CHUTE 250 ML,https://citymall-para.ma/produit/d-cap-shampooing-traitement-intensif-anti-chute-250-ml/
DCP HAIR LOSS masque capillaire 200 ml,https://citymall-para.ma/produit/dcp-hair-loss-masque-capillaire-200-ml/
DCP Hairloss Lotion Capillaire Femmes 200ml,https://citymall-para.ma/produit/dcp-hairloss-lotion-capillaire-femmes-200ml/
DCP Hairloss Lotion Capillaire Hommes 200ml,https://citymall-para.ma/produit/dcp-hairloss-lotion-capillaire-hommes-200ml/
DCP Hairloss Serum Capillaire 100ml,https://citymall-para.ma/produit/dcp-hairloss-serum-capillaire-100ml/
DCP HAIRLOSS SHAMPOING FEMMES 500ml,https://citymall-para.ma/produit/dcp-hairloss-shampoing-femmes-500ml/
DCP Hairloss Shampooing Hommes 500ml,https://citymall-para.ma/produit/dcp-hairloss-shampooing-hommes-500ml/
DCP Pruritus-Control Lotion 200ml,https://citymall-para.ma/produit/dcp-pruritus-control-lotion-200ml/
DERMO-SOINS Best Capill Usage Fréquent 150ml,https://citymall-para.ma/produit/dermo-soins-best-capill-usage-frequent-150ml/
Ducray Anacaps 30 caps (traitement 1 mois),https://citymall-para.ma/produit/ducray-anacaps-30-caps-traitement-1-mois/
Ducray Anaphase Shampooing Anti-chute 200ml,https://citymall-para.ma/produit/ducray-anaphase-shampooing-anti-chute-200ml/
DUCRAY Creastim Lotion AntiChute/2 30ml,https://citymall-para.ma/produit/ducray-creastim-lotion-a-chute-2-30ml/
DUCRAY EXTRA-DOUX Shampooing Dermo-Protecteur 400ML,https://citymall-para.ma/produit/ducray-shampooing-extra-doux-400ml/
DUCRAY Gel Rubefiant Tonique Capillaire 30ML,https://citymall-para.ma/produit/ducray-gel-rubefiant-tonique-capillaire-30ml/
DUCRAY KELUAL DS Shampooing 100ML,https://citymall-para.ma/produit/ducray-kelual-ds-shp-100ml/
DUCRAY KERTYOL P.S.O Shampoing Traitant 200ML,https://citymall-para.ma/produit/kertyol-p-s-o-shampoing-traitant-shampoing-keratoreducteur-200-ml/
DUCRAY NEOPTIDE Lotion Anti-Chute Femmes 90ML 3 FLACONS,https://citymall-para.ma/produit/ducray-neoptide-anti-chute-femme-3-flacons/
DUCRAY NEOPTIDE LOTION ANTI-CHUTE HOMMES 100ML,https://citymall-para.ma/produit/ducray-neoptide-lotion-anti-chute-homme-100-ml/
DUCRAY SENSINOL Sérum 30ML,https://citymall-para.ma/produit/duc-sensinol-serum-30-ml-2/
DUCRAY SENSINOL Shampooing Traitant Physioprotecteur 200ML,https://citymall-para.ma/produit/ducray-sensinol-shampooing-traitant-physioprotecteur/
DUCRAY SQUANORM Lotion Antipelliculaire au Zinc 200ML,https://citymall-para.ma/produit/ducray-squanorm-zinc-lotion-antipelliculaire-200-ml/
DUCRAY SQUANORM Shampooing Pellicules Grasses 200ML,https://citymall-para.ma/produit/ducray-squanorm-shampooing-pellicules-grasses-200ml/
DUCRAY SQUANORM Shampooing Pellicules Sèches 200ML,https://citymall-para.ma/produit/ducray-squanorm-shampooing-pellicules-seches-200ml/
ECOPHANE Biorga 60 Comprimés,https://citymall-para.ma/produit/biorga-ecophane-60-comprimes/
ECOPHANE Biorga Shampooing Fortifiant 200ML,https://citymall-para.ma/produit/ecophane-shamp-fort-ch-frag-ab-tern-200ml/
ECOPHANE Biorga Shampooing ULTRA Doux 500ML,https://citymall-para.ma/produit/ecophane-shamp-ultra-doux-ch-sens-500ml/
ECRINAL ANP Lotion Anti-Chute Femme 200ML,https://citymall-para.ma/produit/ecrinal-lotion-femme-chev-fortif-200ml/
ECRINAL Sérum Apaisant Capillaire 50ML,https://citymall-para.ma/produit/ecrinal-serum-apaisant-capillaire-50ml/
ECRINAL Shampooing Fortifiant Femme 400ML,https://citymall-para.ma/produit/ecrinal-shamp-fortifiant-femme-400ml/
ECRINAL Shampooing Ultra-Doux 400ML,https://citymall-para.ma/produit/ecrinal-shamp-ultra-doux-400ml/
ELCEA COLORATION EXPERTE 1 NOIR,https://citymall-para.ma/produit/elcea-coloration-experte-1-noir/
ELCÉA COLORATION PERMANENTE NOIR BLEUTE N°1.10,https://citymall-para.ma/produit/elcea-coloration-permanente-noir-bleute-n1-10/
ELCEA COLORATION EXPERTE CHÂTAIN FONCÉ N°3,https://citymall-para.ma/produit/elcea-coloration-experte-chatain-fonce-3/
ELCEA COLORATION PERMANENTE CHATAIN N°4,https://citymall-para.ma/produit/elcea-coloration-permanente-chatain-n4/
ELCEA COLORATION PERMANENTE CAPPUCCINO N°4.35,https://citymall-para.ma/produit/elcea-coloration-permanente-cappuccino-n4-35/
ELCEA COLORATION PERMANENTE ACAJOU N°4.5,https://citymall-para.ma/produit/elcea-coloration-permanente-acajou-n4-5/
ELCEA COLORATION PERMANENTE MOKA N°4.51,https://citymall-para.ma/produit/elcea-coloration-permanente-moka-n4-51/
ELCEA COLORATION PERMANENTE CHATAIN CLAIR N°5,https://citymall-para.ma/produit/elcea-coloration-permanente-chatain-clair-n5/
ELCEA COLORATION PERMANENTE CHATAIN CLAIR DORE N°5.3,https://citymall-para.ma/produit/elcea-coloration-permanente-chatain-clair-dore-n5-3/
ELCEA NOREVA COLORAT 5.53 CHOCOLAT,https://citymall-para.ma/produit/elcea-noreva-colorat-5-53-chocolat/
ELCEA COLORATION PERMANENTE CHATAIN CUIVRE N°5.4,https://citymall-para.ma/produit/elcea-coloration-permanente-chatain-cuivre-n5-4/
ELCEA COLORATION PERMANENTE AUBURN N°5.6,https://citymall-para.ma/produit/elcea-coloration-permanente-auburn-n5-6/
ELCEA COLORATION EXPERTE 6 BLOND FONCE,https://citymall-para.ma/produit/elcea-coloration-experte-6-blond-fonce/
ELCEA COLORATION PERMANENTE CHÂTAIN CLAIR CUIVRÉ 6.34,https://citymall-para.ma/produit/elcea-coloration-permanente-phatain-clair-cuivre-6-34/
ELCEA COLORATION PERMANENTE MARRON CACAO N°6.53,https://citymall-para.ma/produit/elcea-coloration-permanente-marron-cacao-n6-53/
Eptaderm Epta ds shampoing pellicules 150ml,https://citymall-para.ma/produit/eptaderm-epta-ds-shampoing-pellicules-150ml/
Eptaderm Epta Hair Lotion Anti Chute – 100 ml,https://citymall-para.ma/produit/eptaderm-epta-hair-lotion-anti-chute-100-ml/
Eptaderm Epta Hair Lotion Anti-Chute 100 ml,https://citymall-para.ma/produit/eptaderm-epta-hair-lotion-anti-chute-100-ml-2/
Eptaderm Epta Hair Shampooing Energisant – 150 Ml,https://citymall-para.ma/produit/eptaderm-epta-hair-shampooing-energisant-150-ml/
Erayba Bio Smooth BS12 smoothing shampoing 250ml,https://citymall-para.ma/produit/erayba-bio-smooth-bs12-smoothing-shampoing-250ml/
Erayba Biosmooth bs10 smoothing mask 150 ml,https://citymall-para.ma/produit/erayba-biosmooth-bs10-smoothing-mask-150-ml/
ESI Aloedermal Shampooing Douche À L’Aloe Vera 200ml,https://citymall-para.ma/produit/esi-aloedermal-shampooing-douche-a-laloe-vera-200ml/
Evawin Wincap DS Lotion Anti-pelliculaire spray 120ml,https://citymall-para.ma/produit/evawin-wincap-ds-lotion-anti-pelliculaire-spray-120-ml/
EVAWIN Wincap DS Shampoing Anti-pelliculaire 200ml,https://citymall-para.ma/produit/evawin-wincap-ds-shampoing-anti-pelliculaire-200ml/
Evawin Wincap Lotion Anti-chute spray 120ml,https://citymall-para.ma/produit/evawin-wincap-lotion-anti-chute-spray-120ml/
Evawin Wincap Shampoing Anti-chute 200ml,https://citymall-para.ma/produit/evawin-wincap-shampoing-anti-chute-200ml/
Every Strand Keratin with Aloe Vera + Vitamin E Hair Polisher 59 ml,https://citymall-para.ma/produit/every-strand-keratin-with-aloe-vera-vitamin-e-hair-polisher-59-ml/
Exo Keratin Démêlant anti-frizz à la kératine 200 ml,https://citymall-para.ma/produit/exo-keratin-demelant-anti-frizz-a-la-keratine-200-ml/
Farlin Brosse Et Peigne Decore Bf150a,https://citymall-para.ma/produit/farlin-brosse-et-peigne-decore-bf150a/
FARMATINT 4N Chatain,https://citymall-para.ma/produit/farmatint-4n-chatain/
FARMATINT 5N Chatain Clair,https://citymall-para.ma/produit/farmatint-5n-chatain-clair/
FARMATINT 6N Blond foncé,https://citymall-para.ma/produit/farmatint-6n-blond-fonce/
FARMATINT 7D Blond doré,https://citymall-para.ma/produit/farmatint-7d-blond-dore/
FARMATINT Coloration Aloe Vera 10C 150Ml,https://citymall-para.ma/produit/farmatint-coloration-aloe-vera-10c-150ml/
FARMATINT Coloration Aloe Vera 1N 150ml,https://citymall-para.ma/produit/farmatint-coloration-aloe-vera-1n-150ml/
FARMATINT Coloration Aloe Vera 3N 150ml,https://citymall-para.ma/produit/farmatint-coloration-aloe-vera-3n-150ml/
FARMATINT Coloration Aloe Vera 4D 150ml,https://citymall-para.ma/produit/farmatint-coloration-aloe-vera-4d-150ml/
FIDERMA Hairfid Lotion Anti Chute 100ML,https://citymall-para.ma/produit/fiderma-hairfid-lotion-anti-chute-100ml/
FIDERMA Hairfid Shampooing Fortifiant 150ML,https://citymall-para.ma/produit/fiderma-hairfid-shampooing-fortifiant-150ml/
FIDERMA Sebofid Shampooing Anti Pelliculaire 200ml,https://citymall-para.ma/produit/fiderma-sebofid-shampooing-anti-pelliculaire-200ml/
FIXAPIL Lotion antichute 75ml,https://citymall-para.ma/produit/fixapil-lotion-antichute-75ml/
FIXAPIL Shampoing Energisant 200ML,https://citymall-para.ma/produit/fixapil-shampoing-energisant-200ml/
FLORAME  GEL ALOE VERA 150ML COSMOS,https://citymall-para.ma/produit/florame-gel-aloe-vera-bio-visage-corps-cheveux-150ml/
FLORAME GEL ALOE VERA 50ML COSMOS,https://citymall-para.ma/produit/florame-gel-aloe-vera-bio-visage-corps-cheveux-50ml/
FLORAME  SHAMPOING DOUCHE HOMME FOR MEN L EAU AROMETIQUE 200ML COSMOS,https://citymall-para.ma/produit/florame-homme-shampooing-douche-leau-aromatique-200-ml/
FLORAME  SHAMPOING DOUCHE HOMME FOR MEN FRAICHEUR BOISSEE 200ML COSMOS,https://citymall-para.ma/produit/florame-shampoing-douche-fraicheur-boisee-bio-200ml/
FLOXIA Shampoing Cheveux Normaux à Gras 200ML,https://citymall-para.ma/produit/floxia-shampoing-cheveux-normaux-a-gras-200ml/
Floxia Shampooing Anti Pelliculaire 200ml,https://citymall-para.ma/produit/floxia-shampooing-anti-pelliculaire-200ml/
FLOXIA Shampooing Cheveux Normaux à Secs 200 ML,https://citymall-para.ma/produit/floxia-shampooing-cheveux-normaux-a-secs-200-ml/
FORCAPIL CHEVEUX ET ONGLES 60 GELULES,https://citymall-para.ma/produit/forcapil-cheveux-et-ongles-60-gelules/
Forté Pharma Expert Cheveux 28 Comprimés,https://citymall-para.ma/produit/forte-pharma-expert-cheveux-28-comprimes/
Forté Pharma Expert Cheveux Boite 84 Comprimés,https://citymall-para.ma/produit/forte-pharma-expert-cheveux-boite-84-comprimes/
Hairstim Shampooing Anti Chute Sans Sulfate 200ML,https://citymall-para.ma/produit/hairstim-shampooing-anti-chute-sans-sulfate-200ml/
HOLISTICA Holisticap Beauté Cheveux 60 Capsules,https://citymall-para.ma/produit/holistica-holisticap-beaute-cheveux-60-capsules/
HT CEUTIC C30 Sérum 15ML,https://citymall-para.ma/produit/ht-ceutic-c30-serum-15-ml/
Huile Aloe Vera Sante Bio 50ML,https://citymall-para.ma/produit/huile-aloe-vera-sante-bio-50ml/
Huile De Coco -Pot 100ML,https://citymall-para.ma/produit/huile-de-coco-pot-100ml/
Huile De Fenugrec 40ML,https://citymall-para.ma/produit/huile-de-fenugrec-40ml/
HUILE DE Soja 50ML,https://citymall-para.ma/produit/huile-de-soja-50ml/
Huile de Tournesol 50ml,https://citymall-para.ma/produit/huile-de-tournesol-50ml/
Huile Essentielle Eucalyptus,https://citymall-para.ma/produit/huile-essentielle-eucalyptus/
Huile Végétale Sésame 50ML,https://citymall-para.ma/produit/huile-vegetale-sesame-60ml/
ISDIN Fotoprotector Fusion Water Color Spf50 50ml,https://citymall-para.ma/produit/isdin-fotoprotector-fusion-water-color-spf50-50ml/
ISISPHARMA Ilcapil KR Shampooing Anti-Pelliculaire 150ml,https://citymall-para.ma/produit/isispharma-ilcapil-kr-shampooing-anti-pelliculaire-150ml/
Item alpha cèdre shampooing cheveux très gras 200ml,https://citymall-para.ma/produit/item-alpha-cedre-shampooing-cheveux-tres-gras-200ml/
JOHNSON’S Baby Shampoo 300ML,https://citymall-para.ma/produit/johnsons-baby-shampoo-300ml/
Johnsons Baby Shampooing 100ml jaune,https://citymall-para.ma/produit/johnsons-baby-shampooing-100ml-jaune/
Johnsons Baby Shampooing 300ml Jaune,https://citymall-para.ma/produit/johnsons-baby-shampooing-200ml-jaune/
Johnsons Baby Shampooing 750ml Jaune,https://citymall-para.ma/produit/johnsons-baby-shampooing-750ml-jaune/
KANELLIA Sérum Anti-Chute 60ML,https://citymall-para.ma/produit/kanellia-serum-anti-chute-60ml/
Keragene Anti chute 60gelules,https://citymall-para.ma/produit/keragene-anti-chute-60-gelules/
Keragene Lotion Anti Chute 75ml,https://citymall-para.ma/produit/keragene-lotion-anti-chute-75ml/
Keraline Après shampoing 250ml,https://citymall-para.ma/produit/keraline-apres-shampoing-250ml/
Keraline Kit de Lissage Brésilien 4X70,https://citymall-para.ma/produit/keraline-kit-de-lissage-bresilien-4x70/
Kérastase Spécifique anti-chute shampoing 250ml,https://citymall-para.ma/produit/kerastase-specifique-anti-chute-shampoing-250ml/
Keratin system serum cheveux 100 ml,https://citymall-para.ma/produit/keratin-system-serum-cheveux-100-ml/
KERATOHAIR cheveux et ongles 60 gélules,https://citymall-para.ma/produit/keratohair-cheveux-et-ongles-60-gelules/
KLORANE BAUME APRÈS-SHAMPOING BEURRE DE MANGUE 200ML,https://citymall-para.ma/produit/klorane-baume-apres-shampoing-beurre-de-mangue-200ml/
KLORANE BAUME APRÈS-SHAMPOING CAMOMILLE 200ML,https://citymall-para.ma/produit/klorane-baume-apres-shampoing-camomille-200ml/
KLORANE BAUME APRÈS-SHAMPOOING FORTIFIANT ET DÉMÊLANT À LA QUININE (200ML),https://citymall-para.ma/produit/klorane-baume-apres-shampooing-fortifiant-et-demelant-a-la-quinine-200ml/
Klorane Bio Après-Shampooing Réparateur – 200ml,https://citymall-para.ma/produit/klorane-bio-apres-shampooing-reparateur-200ml/
Klorane Bio Shampooing Réparateur – 200ml,https://citymall-para.ma/produit/klorane-bio-shampooing-reparateur-200ml/
Klorane Bio Shampooing Réparateur – 400ml,https://citymall-para.ma/produit/klorane-bio-shampooing-reparateur-400ml/
Klorane Creme de jour au lait de papyrus 125ml,https://citymall-para.ma/produit/klorane-creme-de-jour-au-lait-de-papyrus-125ml/
KLORANE ORTIE Shampooing Sébo-Régulateur 200 Ml,https://citymall-para.ma/produit/klorane-ortie-shampooing-sebo-regulateur-200-ml/
KLORANE ORTIE Shampooing Sébo-Régulateur 400 Ml,https://citymall-para.ma/produit/klorane-ortie-shampooing-sebo-regulateur-400-ml/
Klorane Polysiane huile sublimatrice 50ml,https://citymall-para.ma/produit/klorane-polysiane-huile-sublimatrice-50ml/
Klorane Serum anti chute a la quinine 100ml,https://citymall-para.ma/produit/klorane-serum-anti-chute-a-la-quinine-100ml/
Klorane Shampoing Ortie 200ml,https://citymall-para.ma/produit/klorane-shampoing-ortie-200ml/
KLORANE Shampoing Séboréducteur à l’Ortie BIO 400ML,https://citymall-para.ma/produit/klorane-shampoing-seboreducteur-a-lortie-bio-400ml/
Klorane Shampooing a la quinine 200ml,https://citymall-para.ma/produit/klorane-shampooing-a-la-quinine-200ml-2/
Klorane Shampooing a la quinine 400ml,https://citymall-para.ma/produit/klorane-shampooing-a-la-quinine-400ml/
Klorane Shampooing au Lait de Papyrus 200ML,https://citymall-para.ma/produit/klorane-shampooing-au-lait-de-papyrus-200ml/
Klorane SHP Cedrat 200ml,https://citymall-para.ma/produit/klorane-shp-cedrat-200ml/
L’oréal elseve shampooing & apres shampooing et sérum hyaluron repulp avis pack,https://citymall-para.ma/produit/loreal-elseve-shampooing-apres-shampooing-et-serum-hyaluron-repulp-avis/
LA ROCHE-POSAY KERIUM DOUX EXTRÊME SHAMPOING CUIR CHEVELU 400ML,https://citymall-para.ma/produit/la-roche-posay-kerium-doux-extreme-shampoing-gel/
LANAFORM Poudre Cheveux Good Looking +1Spray Blond,https://citymall-para.ma/produit/lanaform-poudre-cheveux-good-looking-1spray-blond/
LANTI POUX LOTION ANTI-POUX ET LENTES 125ML,https://citymall-para.ma/produit/lanti-poux-lotion-anti-poux-et-lentes-125ml-2/
LANTI POUX SHAMPOOING ANTI-POUX ET LENTES 125ML,https://citymall-para.ma/produit/lanti-poux-shampooing-anti-poux-et-lentes-125ml-2/
Lili Care Brosse a Cheveux Demelante,https://citymall-para.ma/produit/lili-care-brosse-a-cheveux-demelante/
Luxeol Apres Shampooing Fortifiant Cheveux Normaux 200ml,https://citymall-para.ma/produit/luxeol-apres-shampooing-fortifiant-cheveux-normaux-200ml/
M & D Bio12 Baume Colorant 36 Acajou 120ml,https://citymall-para.ma/produit/m-d-bio12-baume-colorant-36-acajou-120ml/
M&D  Bio12 Baume Colorant et Illuminant Cheveux 38 Prune 120ml,https://citymall-para.ma/produit/md-bio12-baume-colorant-et-illuminant-cheveux-38-prune-120ml/
M&D Bio12 Baume Colorant et Illuminant Cheveux 11Chocolat 120ml,https://citymall-para.ma/produit/md-bio12-baume-colorant-et-illuminant-cheveux-11chocolat-120ml/
M&D Bio12 Baume Colorant et Illuminant Cheveux 15 Chatain 120ml,https://citymall-para.ma/produit/md-bio12-baume-colorant-et-illuminant-cheveux-15-chatain-120ml/
M&D Bio12 Masque Réparateur Nourrissant 200ml,https://citymall-para.ma/produit/md-bio12-masque-reparateur-nourrissant-200ml-2/
M&D Bio12 Soin Renforçant Antichute De Cheveux 20 Ampoules,https://citymall-para.ma/produit/md-bio12-soin-renforcant-antichute-de-cheveux-20-ampoules/
MARIE ROSE SHAMPOOING ANTI POUX ET LENTE,https://citymall-para.ma/produit/marie-rose-shampooing-anti-poux-et-lentes-125ml/
Mustela Baume Allaitement Organic 30ml,https://citymall-para.ma/produit/mustela-baume-allaitement-organic-30ml/
MUSTELA GEL 2EN1 BEBE 200ML,https://citymall-para.ma/produit/mustela-gel-2en1-bebe-200ml/
NATURALIA Shampoing Aloe Vera Hydratant 200ML,https://citymall-para.ma/produit/naturalia-shampoing-aloe-vera-hydratant-200ml/
NATURALIA Shampoing Antipelliculaire 300ML,https://citymall-para.ma/produit/naturalia-shampoing-antipelliculaire-300ml/
NATURALIA Shampoing Énergisant Anti-chute 300ML,https://citymall-para.ma/produit/naturalia-shampoing-energisant-anti-chute-300-ml/
NATURALIA Shampoing Usage Fréquent Equilibrant 300ML,https://citymall-para.ma/produit/naturalia-shampoing-usage-frequent-equilibrant-300ml/
NATURALIA Traitement Anti-chute 12 Ampoulesx5 ml + Shampooing 150 ml,https://citymall-para.ma/produit/naturalia-traitement-anti-chute-12-ampoulesx5-ml-shampooing-150-ml/
NATURALIA TRAITEMENT ANTI-CHUTE 24 Ampoules x 5ml + Shampooing Energisant 150ML,https://citymall-para.ma/produit/naturalia-pack-antichute-24-amp-5ml-et-shampoing-150ml/
Nature Soin Argaserum Extra-lissant à l’huile d’argan 50ml,https://citymall-para.ma/produit/nature-soin-argaserum-extra-lissant-a-lhuile-dargan-50ml/
Nature Soin Huile De Cade 50ML,https://citymall-para.ma/produit/nature-soin-huile-de-cade-50ml/
Naturesoin Arga Serum Avocat 50 Ml,https://citymall-para.ma/produit/naturesoin-arga-serum-avocat-50-ml/
Naturesoin Arga Sérum Coco 50ml,https://citymall-para.ma/produit/naturesoin-arga-serum-coco-50ml/
NaturEsoin ArgaSerum À L’Huile D’Aloès – 50 Ml,https://citymall-para.ma/produit/naturesoin-argaserum-a-lhuile-daloes-50-ml/
NaturEsoin ArgaSerum à l’Huile d’Argan Sérum Capillaire 50ML,https://citymall-para.ma/produit/naturesoin-argaserum-a-lhuile-dargan-serum-capillaire-50ml/
Naturesoin Huile à L’extrait D’aloés – 50ML,https://citymall-para.ma/produit/naturesoin-huile-a-lextrait-daloes-50ml/
Naturesoin Huile à L’extrait De Fenugrec – 50ML,https://citymall-para.ma/produit/naturesoin-huile-a-lextrait-de-fenugrec-50ml/
NATURESOIN Huile Capillaire 10 Bain D’Huiles Végétales 125 ML,https://citymall-para.ma/produit/naturesoin-huile-capillaire-10-bain-dhuiles-vegetales-125-ml/
NATURESOIN Huile Capillaire 7 Bain d’Huiles Végétales 125 ML,https://citymall-para.ma/produit/naturesoin-huile-capillaire-7-bain-dhuiles-vegetales-125-ml/
