titre,url
ACM NOVOPHANE CHRONIC LOTION ANTI-CHUTE 100ML,https://citymall-para.ma/produit/acm-novophane-chronic-lotion-anti-chute-100ml/
Biokera Color Argent N° Fc12,https://citymall-para.ma/produit/biokera-color-argent-n-fc12/
Biokera Color Aubergine Intense N°5.96,https://citymall-para.ma/produit/biokera-color-aubergine-intense-n5-96/
Biokera Color Blond cendré platine N°10.1,https://citymall-para.ma/produit/biokera-color-blond-cendre-platine-n10-1/
Biokera Color Blond Extra platine brun perlé N°12.27,https://citymall-para.ma/produit/biokera-color-blond-extra-platine-brun-perle-n12-27/
Biokera Color Blond Foncé rougeâtre N°6.6,https://citymall-para.ma/produit/biokera-color-blond-fonce-rougeatre-n6-6/
Biokera Color Blonde Perlée N°7.12,https://citymall-para.ma/produit/biokera-color-blonde-perlee-n7-12/
Biokera Color Extra Platinum Blonde Copenhague N°12.112,https://citymall-para.ma/produit/biokera-color-extra-platinum-blonde-copenhague-n12-112/
Biokera Color Extra Platinum Blonde Intense Ash Intense N°12.11,https://citymall-para.ma/produit/biokera-color-extra-platinum-blonde-intense-ash-intense-n12-11/
Biokera Color N°5.11 Chatain Clair Cendré Intense,https://citymall-para.ma/produit/biokera-color-n5-11-chatain-clair-cendre-intense/
Biokera Color N°5.70 Chatain Clair Marron Naturel,https://citymall-para.ma/produit/biokera-color-n5-70-chatain-clair-marron-naturel/
Biokera Color N°5.735,https://citymall-para.ma/produit/biokera-color-n5-735/
ACM NOVOPHANE CHRONIC LOTION ANTI-CHUTE 100ML,https://citymall-para.ma/produit/acm-novophane-chronic-lotion-anti-chute-100ml/
Biokera Color Argent N° Fc12,https://citymall-para.ma/produit/biokera-color-argent-n-fc12/
Biokera Color Aubergine Intense N°5.96,https://citymall-para.ma/produit/biokera-color-aubergine-intense-n5-96/
Biokera Color Blond cendré platine N°10.1,https://citymall-para.ma/produit/biokera-color-blond-cendre-platine-n10-1/
Biokera Color Blond Extra platine brun perlé N°12.27,https://citymall-para.ma/produit/biokera-color-blond-extra-platine-brun-perle-n12-27/
Biokera Color Blond Foncé rougeâtre N°6.6,https://citymall-para.ma/produit/biokera-color-blond-fonce-rougeatre-n6-6/
Biokera Color Blonde Perlée N°7.12,https://citymall-para.ma/produit/biokera-color-blonde-perlee-n7-12/
Biokera Color Extra Platinum Blonde Copenhague N°12.112,https://citymall-para.ma/produit/biokera-color-extra-platinum-blonde-copenhague-n12-112/
Biokera Color Extra Platinum Blonde Intense Ash Intense N°12.11,https://citymall-para.ma/produit/biokera-color-extra-platinum-blonde-intense-ash-intense-n12-11/
Biokera Color N°5.11 Chatain Clair Cendré Intense,https://citymall-para.ma/produit/biokera-color-n5-11-chatain-clair-cendre-intense/
Biokera Color N°5.70 Chatain Clair Marron Naturel,https://citymall-para.ma/produit/biokera-color-n5-70-chatain-clair-marron-naturel/
Biokera Color N°5.735,https://citymall-para.ma/produit/biokera-color-n5-735/
Biokera Color Rouge Châtain Clair intense N°5.66,https://citymall-para.ma/produit/biokera-color-rouge-chatain-clair-intense-n5-66/
BIOKERA NATURE COLOR N°1 NOIR,https://citymall-para.ma/produit/biokera-nature-color-n1-noir/
BIOKERA NATURE COLOR N°5.221 BROWNIE,https://citymall-para.ma/produit/biokera-nature-color-n5-221-brownie/
BIOKERA NATURE COLOR N°6.4 DARK COPPERY BLOND,https://citymall-para.ma/produit/biokera-nature-color-n6-4-dark-coppery-blond/
Camomilla Blu Fleur De Camomille Baume Après-Shampooing 200ml,https://citymall-para.ma/produit/camomilla-blu-fleur-de-camomille-baume-apres-shampooing-200ml/
D-CAP COFFRET BIOPLEX POUR RÉPARER LES CHEVEUX,https://citymall-para.ma/produit/d-cap-coffret-bioplex-pour-reparer-les-cheveux/
DIETAROMA PROTEGE MOI DES COUPS DE FROID 30 ML,https://citymall-para.ma/produit/dietaroma-protege-moi-des-coups-de-froid-30-ml/
DUO LP-Pro Anti-Poux et Lentes Lotion 150ml,https://citymall-para.ma/produit/duo-lp-pro-anti-poux-et-lentes-lotion-150ml/
Elseve huile extraordinaire jojoba 100 ML,https://citymall-para.ma/produit/elseve-huile-extraordinaire-jojoba-100-ml/
Elsève Hyaluron Repulp Masque Hydra-Régénérant pour Cheveux Déshydratés,https://citymall-para.ma/produit/elseve-hyaluron-repulp-masque-hydra-regenerant-pour-cheveux-deshydrates/
ISDIN LAMBDAPIL SHAMPOING ANTI CHUTE 200 ML,https://citymall-para.ma/produit/isdin-lambdapil-shampoing-anti-chute-200-ml/
ISDIN PSORISDIN SHAMPOING ANTI DESQUAMATIVE 200 ML,https://citymall-para.ma/produit/isdin-psorisdin-shampoing-anti-desquamative-200-ml/
KERASTASE ELIXIR ULTIME HUILE SUBLIMATRICE MULTI USAGE CHEVEUX TERNES 75 ML,https://citymall-para.ma/produit/kerastase-elixir-ultime-huile-sublimatrice-multi-usage-cheveux-ternes-75-ml/
KERASTASE ELIXIR ULTIME L’HUILE ORIGINALE 100ML,https://citymall-para.ma/produit/kerastase-elixir-ultime-lhuile-originale-100ml/
NATURO PATHICA HUILE DE MOUTARDE 40 ML,https://citymall-para.ma/produit/naturo-pathica-huile-de-moutarde-40-ml/
NOVOPHANE 60 GELULES+SHAMPOING ENERGISANT 100 ML PACK,https://citymall-para.ma/produit/novophane-60-gelulesshampoing-energisant-100-ml-pack/
NOVOPHANE ANTI CHUTE 180 GELULES,https://citymall-para.ma/produit/novophane-anti-chute-180-gelules/
CAMOMILLA BLU SHAMPOOING DOUX A LA FLEUR DE CAMOMILLE 500 ML,https://citymall-para.ma/produit/camomilla-blu-shampooing-doux-a-la-fleur-de-camomille-500-ml/
Caphair Lotion Anti Chute 125 Ml,https://citymall-para.ma/produit/caphair-lotion-anti-chute-125-ml/
Caphair Shampoing Energisant Anti-chte 200ml,https://citymall-para.ma/produit/caphair-shampoing-energisant-anti-chte-200ml/
D-CAP COLORATION PERMANENTE N°1 NOIR,https://citymall-para.ma/produit/d-cap-coloration-permanente-n1-noir/
D-CAP COLORATION PERMANENTE N°3 CHATAIN FONCE,https://citymall-para.ma/produit/d-cap-coloration-permanente-n3-chatain-fonce/
D-CAP COLORATION PERMANENTE N°4 CHATAIN,https://citymall-para.ma/produit/d-cap-coloration-permanente-n4-chatain/
D-CAP COLORATION PERMANENTE N°4.35 CAPPUCCINO,https://citymall-para.ma/produit/d-cap-coloration-permanente-n4-35-cappuccino/
D-CAP COLORATION PERMANENTE N°4.5 ACAJOU,https://citymall-para.ma/produit/d-cap-coloration-permanente-n4-5-acajou/
D-CAP COLORATION PERMANENTE N°5 CHATAIN CLAIR,https://citymall-para.ma/produit/d-cap-coloration-permanente-n5-chatain-clair/
D-CAP COLORATION PERMANENTE N°5.3 CHATAIN CLAIR,https://citymall-para.ma/produit/d-cap-coloration-permanente-n5-3-chatain-clair/
D-CAP COLORATION PERMANENTE N°5.53 MARRON CHOCOLAT,https://citymall-para.ma/produit/d-cap-coloration-permanente-n5-53-marron-chocolat/
D-CAP COLORATION PERMANENTE N°6 BLOND FONCÉ,https://citymall-para.ma/produit/d-cap-coloration-permanente-n6-blond-fonce/
D-CAP COLORATION PERMANENTE N°7 BLOND,https://citymall-para.ma/produit/d-cap-coloration-permanente-n7-blond/
D-CAP COLORATION PERMANENTE N°7.3 BLOND DORE,https://citymall-para.ma/produit/d-cap-coloration-permanente-n7-3-blond-dore/
D-CAP COLORATION PERMANENTE N°8 BLOND CLAIR,https://citymall-para.ma/produit/d-cap-coloration-permanente-n8-blond-clair/
D-CAP CURLY GIRL METHOD SÉRUM 30 ML,https://citymall-para.ma/produit/d-cap-curly-girl-method-serum-30-ml/
D-CAP MASQUE PROTECTEUR COULEUR 200ML,https://citymall-para.ma/produit/d-cap-masque-protecteur-couleur-200ml/
D-cap Protection Spray Solaire Capillaire 300 ml,https://citymall-para.ma/produit/d-cap-protection-spray-solaire-capillaire-300-ml/
D-CAP SHAMPOING PROTECTEUR COULEUR 250ML,https://citymall-para.ma/produit/d-cap-shampoing-protecteur-couleur-250ml/
ERIC FAVRE COLLAGENE PUR 10*15ml 4000mg,https://citymall-para.ma/produit/eric-favre-collagene-pur-1015ml-4000mg/
Every Strand Keratin with Aloe Vera + Vitamin E Hair Polisher 177 ml,https://citymall-para.ma/produit/every-strand-keratin-with-aloe-vera-vitamin-e-hair-polisher-177-ml/
KERASTASE CHRONOLOGISTE BAIN REGENERANT 250ML,https://citymall-para.ma/produit/kerastase-chronologiste-bain-regenerant-250ml/
KERASTASE CHRONOLOGISTE MASQUE PROFOND REGENERANT 200 ML,https://citymall-para.ma/produit/kerastase-chronologiste-masque-profond-regenerant-200-ml/
Kérastase Discipline Bain Fluidéaliste Sans Sulfates 250ml,https://citymall-para.ma/produit/kerastase-discipline-bain-fluidealiste-sans-sulfates-250ml/
KERASTASE RESISTANCE BAIN THERAPISTE 250ML,https://citymall-para.ma/produit/kerastase-resistance-bain-therapiste-250ml/
KERASTASE RESISTANCE MASQUE THERAPISTE 200 ML,https://citymall-para.ma/produit/kerastase-resistance-masque-therapiste-200-ml/
L’OREAL PROFESSIONNEL – PRO LONGER SHAMPOING RENOVATEUR DE LONGUEURS POUR CHEVEUX LONGS 300ML,https://citymall-para.ma/produit/loreal-professionnel-pro-longer-shampoing-renovateur-de-longueurs-pour-cheveux-longs-300ml/
L’OREAL PROFESSIONNEL – PRO LONGER SHAMPOING RENOVATEUR DE LONGUEURS POUR CHEVEUX LONGS 300ML,https://citymall-para.ma/produit/loreal-professionnel-pro-longer-shampoing-renovateur-de-longueurs-pour-cheveux-longs-300ml-2/
L’OREAL SERIE EXPERT PRO LONGER MASQUE RENOVATEUR 250ML,https://citymall-para.ma/produit/loreal-serie-expert-pro-longer-masque-renovateur-250ml/
PLACENTOR LOTION ANTI CHUTE FORTIFIANTE 125 ML,https://citymall-para.ma/produit/placentor-lotion-anti-chute-fortifiante-125-ml/
REPADEX SPRAY LOTION ANTI CHUTE PROCAPIL 100 ML,https://citymall-para.ma/produit/repadex-spray-lotion-anti-chute-procapil-100-ml/
SWEET DREAMS CYGNEB 60 GÉLULE,https://citymall-para.ma/produit/sweet-dreams-cygneb-60-gelule/
Uriage DS Hair  Shampooing Doux Équilibrant 500ml,https://citymall-para.ma/produit/uriage-ds-hair-shampooing-doux-equilibrant-500ml/
Crescina HFSC transdermic 500 woman 20*3.5ml,https://citymall-para.ma/produit/crescina-hfsc-transdermic-500-woman-203-5ml/
ACM  NOVOPHANE ONGLES ET CHEVEUX 60 GÉLULES,https://citymall-para.ma/produit/acm-novophane-ongles-et-cheveux-60-gelules/
ACM Novophane Lotion Anti-Chute 100 ML,https://citymall-para.ma/produit/novophane-lotion-antichute/
ACM Novophane Shampooing Cheveux Secs 200ML,https://citymall-para.ma/produit/acm-novophane-shampooing-cheveux-secs-200ml/
ACM Novophane Shampooing Energisant 200 ML = Novophane Lotion Anti-Chute 100 ML,https://citymall-para.ma/produit/acm-novophane-shampooing-energisant-200-ml-novophane-lotion-anti-chute-100-ml/
Acm Novophane Shampooing Ultra-Nutritif 200ml,https://citymall-para.ma/produit/acm-novophane-shampooing-ultra-nutritif-200ml/
ACTIDiET Phaners 30 Gélules,https://citymall-para.ma/produit/actidiet-phaners-30-gelules/
Apivita Apres Shampoing Nourrissant Reparateur 150ML,https://citymall-para.ma/produit/apivita-apres-shampoing-nourrissant-reparateur-150ml/
Apivita Beessential Oils Baume Nuit 15ml,https://citymall-para.ma/produit/apivita-beessential-oils-baume-nuit-15ml/
Apivita Masque Capillaire Nourrissant réparateur 200ml,https://citymall-para.ma/produit/apivita-masque-capillaire-nourrissant-reparateur-200ml/
Apivita Nature Hair Miracle Huile Fortifiante 50ml,https://citymall-para.ma/produit/apivita-nature-hair-miracle-huile-fortifiante-50ml/
Pharmaceris Après-shampooing Stimulant la Pousse des Cheveux,https://citymall-para.ma/produit/apres-shampooing-stimulant-la-pousse-des-cheveux/
BaByliss Batterie pour tondeuse a cheveux T885E,https://citymall-para.ma/produit/babyliss-batterie-pour-tondeuse-a-cheveux-t885e/
"BaByliss Boucleur Automatique Curl Secret Optimum C1600E, Noir et Gris",https://citymall-para.ma/produit/babyliss-boucleur-automatique-curl-secret-optimum-c1600e-noir-et-gris/
BaByliss Boucleur Curling Tong Noir 25mm C325E,https://citymall-para.ma/produit/babyliss-boucleur-curling-tong-noir-25mm-c325e/
BaByliss Brosse chauffante lissage couleur noire HSB101E,https://citymall-para.ma/produit/babyliss-brosse-chauffante-lissage-couleur-noire-hsb101e/
BaByliss Brosse soufflante 4-en-1 Beliss Big Hair 1000W AS960E,https://citymall-para.ma/produit/babyliss-brosse-soufflante-4-en-1-beliss-big-hair-1000w-as960e/
BaByliss Brosse Soufflante Dry Straighten and Style 4-en-1 1000W AS200E,https://citymall-para.ma/produit/babyliss-brosse-soufflante-dry-straighten-and-style-4-en-1-1000w-as200e/
BaByliss Brosse soufflante Perfect Finish 4-en-1 1000W AS126E,https://citymall-para.ma/produit/babyliss-brosse-soufflante-perfect-finish-4-en-1-1000w-as126e/
BaByliss Brosse soufflante rotative 650W AS950E,https://citymall-para.ma/produit/babyliss-brosse-soufflante-rotative-650w-as950e/
BaByliss Brosse Soufflante Rotative Big Hair Dual pour le volume AS952E,https://citymall-para.ma/produit/babyliss-brosse-soufflante-rotative-big-hair-dual-pour-le-volume-as952e/
"BaByliss Brosse soufflante rotative, 650W AS970E",https://citymall-para.ma/produit/babyliss-brosse-soufflante-rotative-650w-as970e/
BaByliss Brosse Soufflante Shape and Smooth 800W AS82E 38mm,https://citymall-para.ma/produit/babyliss-brosse-soufflante-shape-and-smooth-800w-as82e-38mm/
Babyliss Coupe cheveux E756E,https://citymall-para.ma/produit/babyliss-coupe-cheveux-e756e/
Babyliss Curling Iron 16 mm C271E,https://citymall-para.ma/produit/babyliss-curling-iron-16-mm-c271e/
BaByliss Lisseur Ceramic Noir Straight ST089E,https://citymall-para.ma/produit/babyliss-lisseur-ceramic-noir-straight-st089e/
BaByliss Lisseur et Boucleur 2en1 avec mode de protection de chaleur ST330E,https://citymall-para.ma/produit/babyliss-lisseur-et-boucleur-2en1-avec-mode-de-protection-de-chaleur-st330e/
BaByliss Lisseur Plaques 25 x 90mm ST255E,https://citymall-para.ma/produit/babyliss-lisseur-plaques-25-x-90mm-st255e/
BaByliss Lisseur Rose Salon ST391E,https://citymall-para.ma/produit/babyliss-lisseur-rose-salon-st391e/
BaByliss Lisseur Smooth Control ST298E,https://citymall-para.ma/produit/babyliss-lisseur-smooth-control-st298e/
BaByliss Lisseur Smooth Finish ST250E,https://citymall-para.ma/produit/babyliss-lisseur-smooth-finish-st250e/
BaByliss Lisseur Smooth Glide ST240E,https://citymall-para.ma/produit/babyliss-lisseur-smooth-glide-st240e/
Babyliss Lisseur Steam Lustre Styler ST595E,https://citymall-para.ma/produit/babyliss-lisseur-steam-lustre-styler-st595e/
Babyliss Lisseur Steam Shine Styler ST496E,https://citymall-para.ma/produit/babyliss-lisseur-steam-shine-styler-st496e/
Babyliss Lisseur Straight And Curl Brilliance ST481E,https://citymall-para.ma/produit/babyliss-lisseur-straight-and-curl-brilliance-st481e/
BaByliss Lisseur Super Smooth  ST393E,https://citymall-para.ma/produit/babyliss-lisseur-super-smooth-st393e/
BaByliss Lisseur vapeur Steam Straight avec plaques XL ST492E,https://citymall-para.ma/produit/babyliss-lisseur-vapeur-steam-straight-avec-plaques-xl-st492e/
BaByliss Men Tondeuse Barbe T811E,https://citymall-para.ma/produit/babyliss-men-tondeuse-barbe-t811e/
BaByliss Men Tondeuse Barbe T831E,https://citymall-para.ma/produit/babyliss-men-tondeuse-barbe-t831e/
BaByliss Men Tondeuse Multi-usages 8 en 1 Titanium MT726E,https://citymall-para.ma/produit/babyliss-men-tondeuse-multi-usages-8-en-1-titanium-mt726e/
BaByliss Men Tondeuse Nez-Oreilles Multicouleur E650E,https://citymall-para.ma/produit/babyliss-men-tondeuse-nez-oreilles-multicouleur-e650e/
BaByliss Multi kit tondeuse 10-en-1 lames 34 mm acier carbone MT728E,https://citymall-para.ma/produit/babyliss-multi-kit-tondeuse-10-en-1-lames-34-mm-acier-carbone-mt728e/
BaByliss Multi kit tondeuse 11-en-1 visage & corps MT860E,https://citymall-para.ma/produit/babyliss-multi-kit-tondeuse-11-en-1-visage-corps-mt860e/
BaByliss Multi kit tondeuse 6-en-1 visage & corps batterie NiMh MT725E,https://citymall-para.ma/produit/babyliss-multi-kit-tondeuse-6-en-1-visage-corps-batterie-nimh-mt725e/
BaByliss Multi styler Revêtement céramique 10 accessoires MS22E,https://citymall-para.ma/produit/babyliss-multi-styler-revetement-ceramique-10-accessoires-ms22e/
BaByliss Multicolore Boucleur Curling Tong 19mm C319E,https://citymall-para.ma/produit/babyliss-multicolore-boucleur-curling-tong-19mm-c319e/
BaByliss Multicolore Boucleur Curling Tong 19mm T861E,https://citymall-para.ma/produit/babyliss-multicolore-boucleur-curling-tong-19mm-t861e/
BaByliss Noir Boucleur Curling Tong 32mm C332E,https://citymall-para.ma/produit/babyliss-noir-boucleur-curling-tong-32mm-c332e/
Babyliss Sèche-Cheveux Bronze Shimmer 2200 w D570DE,https://citymall-para.ma/produit/babyliss-seche-cheveux-bronze-shimmer-2200-w-d570de/
Babyliss sèche-Cheveux Power Dry 2100 W D563DE,https://citymall-para.ma/produit/babyliss-seche-cheveux-power-dry-2100-w-d563de/
Babyliss Sèche-Cheveux Powerlight 2000 W D212E,https://citymall-para.ma/produit/babyliss-seche-cheveux-powerlight-2000-w-d212e/
Babyliss Sèche-Cheveux Retracord System 2000 w 6704E,https://citymall-para.ma/produit/babyliss-seche-cheveux-retracord-system-2000-w-6704e/
Babyliss Sèche-Cheveux Smooth Pro 2100 w 6709DE,https://citymall-para.ma/produit/babyliss-seche-cheveux-smooth-pro-2100-w-6709de/
Babyliss Sèche-Cheveux Super Pro 2300 w 6714E,https://citymall-para.ma/produit/babyliss-seche-cheveux-super-pro-2300-w-6714e/
Babyliss Sèche-Cheveux Travel Dry 2000 W Poignée Pliante 5344E,https://citymall-para.ma/produit/babyliss-seche-cheveux-travel-dry-2000-w-5344e/
Babyliss Sèche-Cheveux Turbo Shine 2200 w D572DE,https://citymall-para.ma/produit/babyliss-seche-cheveux-turbo-shine-2200-w/
BaByliss Tond Chev batterie lithium Ion finition bleu marine/or E986E,https://citymall-para.ma/produit/babyliss-tond-chev-batterie-lithium-ion-finition-bleu-marine-or-e986e/
BaByliss Tond Cheveux classique avec fil E695E,https://citymall-para.ma/produit/babyliss-tond-cheveux-classique-avec-fil-e695e/
BaByliss Tond Cheveux molette argentée pochette rangement finition noire E973E,https://citymall-para.ma/produit/babyliss-tond-cheveux-molette-argentee-pochette-rangement-finition-noire-e973e/
BaByliss Tond Cheveux molette métallisée pochette rangementfinition noire E974E,https://citymall-para.ma/produit/babyliss-tond-cheveux-molette-metallisee-pochette-rangementfinition-noire-e974e/
BaByliss Tond Cheveux+Malette Rangement Finition Bleu Argenté E976E,https://citymall-para.ma/produit/babyliss-tond-cheveuxmalette-rangement-finition-bleu-argente-e976e/
BaByliss Tondeuse Cheveux Carbon Tit E978E,https://citymall-para.ma/produit/babyliss-tondeuse-cheveux-carbon-tit-e978e/
BaByliss Tondeuse cheveux Precision Cut Rechargeable E786E,https://citymall-para.ma/produit/babyliss-tondeuse-cheveux-precision-cut-rechargeable-e786e/
BATISTE Dry Shampoo Cherry 200ML,https://citymall-para.ma/produit/batiste-dry-shampoo-cherry-200ml/
BATISTE Shampoing Sec Frais et Citronné Original 200ML,https://citymall-para.ma/produit/shampoing-sec-frais-citronne-original-batiste/
Bébé Confort Goupillon Embout éponge 7958,https://citymall-para.ma/produit/bebe-confort-goupillon-embout-eponge-7958/
BEGOBANO Gel Douche Dermatologique Dermobano 750ML,https://citymall-para.ma/produit/begobano-gel-douche-750ml/
BELIFLOR UNIDOSE N° 01 NOIR 120ML,https://citymall-para.ma/produit/beliflor-unidose-n-01-noir-120ml/
Best Capill Shampoing Anti-Pélliculaire 150ml,https://citymall-para.ma/produit/best-capill-shampoing-anti-pelliculaire-150ml/
BETER BROSSE ELIPSI GM,https://citymall-para.ma/produit/beter-brosse-elipsi-gm/
BETER Brosse pneumatique,https://citymall-para.ma/produit/beter-brosse-pneumatique/
Beter Deslia brosse demeler,https://citymall-para.ma/produit/beter-deslia-brosse-demeler/
Bio-Oïl Huile De Soin Spécialiste Naturelle 125ml,https://citymall-para.ma/produit/bio-oil-huile-de-soin-specialiste-60ml/
BIO12  Masque Purifiant a L’argile 75ml,https://citymall-para.ma/produit/bio12-masque-purifiant-a-largile-75ml/
BIO12 Baume Équilibrant Légèreté Aux Cheveux 200 Ml,https://citymall-para.ma/produit/bio12-baume-equilibrant-legerete-aux-cheveux-200-ml/
BIO12 Lotion Spray Antipelliculaire 150ml,https://citymall-para.ma/produit/bio12-lotion-spray-antipelliculaire-150ml/
BIO12 Sérum Réparateur Cheveux 200 Ml,https://citymall-para.ma/produit/bio12-serum-reparateur-cheveux-200-ml/
BIO12 Shampooing Réparateur Multi-Actif 250 Ml,https://citymall-para.ma/produit/bio12-shampooing-reparateur-multi-actif-250-ml/
BIOCLIN Bio Colorist N1 Noir,https://citymall-para.ma/produit/bioclin-bio-colorist-n1-noir/
Bioclin bio-color protect shamp 400ml,https://citymall-para.ma/produit/bioclin-bio-color-protect-shamp-400ml/
Bioclin Bio-colorist 10.3 blond tres clair dore extra,https://citymall-para.ma/produit/bioclin-bio-colorist-10-3-blond-tres-clair-dore-extra/
Bioclin Bio-colorist 4 chatain,https://citymall-para.ma/produit/bioclin-bio-colorist-4-chatain-2/
BIOCLIN Bio-Force Lotion Spray Fortifiante 150ML,https://citymall-para.ma/produit/bioclin-bio-force-lotion-spray-fortifiante-150ml/
BIOCLIN Bio-Force Shampoing Fortifiant 200ML,https://citymall-para.ma/produit/bioclin-bio-force-shampoing-fortifiant-200ml/
Bioderma ABCDerm Shampooing Doux  200ml,https://citymall-para.ma/produit/bioderma-abcderm-shampooing-doux-200ml/
Bioderma Node DS+ Shampoing Antipelliculaire 125ML,https://citymall-para.ma/produit/bioderma-node-ds-shampooing-125-ml/
Bioderma Nodé DS+ Shampooing 125ML,https://citymall-para.ma/produit/bioderma-node-ds-shampooing-125ml/
Bioderma Nodé G Shampooing Purifiant 400ML,https://citymall-para.ma/produit/bioderma-node-g-shampooing-purifiant-400ml/
Bioderma Nodé k concentré 100ML,https://citymall-para.ma/produit/bioderma-node-k-concentre-100ml/
Bioderma Nodé K Shampooing 150ML,https://citymall-para.ma/produit/bioderma-node-k-shampooing-150ml/
Bioderma Nodé Shampooing fluide 200ML,https://citymall-para.ma/produit/bioderma-node-shampooing-fluide-200ml/
Biokap  Huile Nourrissante Et Réparatrice Cheveux Secs – 125 Ml,https://citymall-para.ma/produit/biokap-huile-nourrissante-et-reparatrice-cheveux-secs-125-ml/
Biokap Ampoules Renforçantes Antichute 12 Aampoules,https://citymall-para.ma/produit/biokap-ampoules-renforcantes-antichute-12-aampoules/
Biokap baume nourrissant et demelant 125ml,https://citymall-para.ma/produit/biokap-baume-nourrissant-et-demelant-125ml/
Biokap Color 7.0 Blond Moyen 140ml,https://citymall-para.ma/produit/biokap-color-7-0-blond-moyen-140ml/
Biokap Creme Baume Capillaire 200ml nb011,https://citymall-para.ma/produit/biokap-creme-baume-capillaire-200ml-nb011/
Biokap Nutricolor Delicato 0.0 Creme Decolorante pour cheveux 140 ML,https://citymall-para.ma/produit/biokap-nutricolor-delicato-0-0-creme-decolorante-pour-cheveux-140-ml/
Biokap Nutricolor Delicato 2.9 Chatin Fonce Chocolat 140ML,https://citymall-para.ma/produit/biokap-nutricolor-delicato-2-9-chatin-fonce-chocolat/
Biokap Nutricolor Delicato 5.5 Chatin Clair Acajou 140ML,https://citymall-para.ma/produit/biokap-nutricolor-delicato-5-5-chatin-clair-acajou/
"Biokap Nutricolor Delicato 7.33 Blond Blé Doré, 140 ml",https://citymall-para.ma/produit/biokap-nutricolor-delicato-rapid-7-33-blond-ble-dore/
Biokap Nutricolor Delicato Rapid 4.05 Chatain Chocolat 135ML,https://citymall-para.ma/produit/biokap-nutricolor-delicato-rapid-4-05-chatain-chocolat/
Biokap Nutricolor Delicato Rapid 5.34 Chatain Miel Clair 135ML,https://citymall-para.ma/produit/biokap-nutricolor-delicato-rapid-5-34-chatain-miel-clair-135ml/
Biokap Nutricolor Delicato Rapid 6.66 Rouge 135ML,https://citymall-para.ma/produit/biokap-nutricolor-delicato-rapid-6-66-rouge-135ml/
Biokap Nutricolor Delicato Rapid 7.33 Blond Blé Doré 140ML,https://citymall-para.ma/produit/biokap-nutricolor-delicato-rapid-7-33-blond-ble-dore-2/
Biokap Nutricolor Delicato Rapid n 4 Chatain Naturel 135 ML,https://citymall-para.ma/produit/biokap-nutricolor-delecato-rapid-n-4-chatain-naturel/
Biokap Nutricolor Teinture Pour Cheveux 6.66 Rouge Rubis 140ml,https://citymall-para.ma/produit/biokap-nutricolor-teinture-pour-cheveux-6-66-rouge-rubis-140ml/
Biokap shampoing douche avec lavande et thym 200ml,https://citymall-para.ma/produit/biokap-shampoing-douche-avec-lavande-et-thym-200ml/
Biokap Shampooing Renforçant Anti-Chute,https://citymall-para.ma/produit/biokap-shampooing-renforcant-anti-chute/
Biokap Spray Retouche Chatain Fonce 75ml,https://citymall-para.ma/produit/biokap-spray-retouche-chatain-fonce-75ml/
Biokap Spray Retouche Noir 75ml,https://citymall-para.ma/produit/biokap-spray-retouche-noir-75ml/
Biokera Color 10 Blond Platine 70ml,https://citymall-para.ma/produit/biokera-color-10-blond-platine-70ml/
Biokera Color 7.722 Ice Browin 70ml,https://citymall-para.ma/produit/biokera-color-7-722-ice-browin-70ml/
Biokera Color 7.73 Blond Marron Dore 70ml,https://citymall-para.ma/produit/biokera-color-7-73-blond-marron-dore-70ml/
Biokera Color 8.1 Blond Clair Cendre 70ml,https://citymall-para.ma/produit/biokera-color-8-1-blond-clair-cendre-70ml/
Biokera Color 8.44 Blond Clair Cuivre Intense 70ml,https://citymall-para.ma/produit/biokera-color-8-44-blond-clair-cuivre-intense-70ml/
Biokera Color 8.6 Blond Clair a Reflets Roux 70ml,https://citymall-para.ma/produit/biokera-color-8-6-blond-clair-a-reflets-roux-70ml/
Biokera Color 9.112 blond Nordique 70ml,https://citymall-para.ma/produit/biokera-color-9-112-blond-nordique-70ml/
Biokera Color Natura N°7.735 Blond Chocolat Bresil,https://citymall-para.ma/produit/biokera-color-natura-n7-735-blond-chocolat-bresil/
BIOKERA Fresh Yellow Shot Shampoing 300ML,https://citymall-para.ma/produit/biokera-fresh-yellow-shot-shampoing-300ml/
BIOKERA MASQUE CHEVEUX TRAITES 200ML,https://citymall-para.ma/produit/biokera-masque-cheveux-traites-200ml/
Biokera Nature Color n°6.1 Blond Fonce Cendre 70ml,https://citymall-para.ma/produit/biokera-nature-color-n6-1-blond-fonce-cendre-70ml/
Biokera Nature Color n°7.31 Blond Beige,https://citymall-para.ma/produit/biokera-nature-color-n7-31/
BIOKERA Nature Shampoing Anti-Cheveux Gras 300ML,https://citymall-para.ma/produit/biokera-nature-shampoing-anti-cheveux-gras-300ml/
BIOKERA Nature Traitement Anti-Pelliculaire Intensif 6 AMP 10ML,https://citymall-para.ma/produit/biokera-nature-traitement-anti-pelliculaire-intensif-6-amp-10ml/
Biokera Scalp Care Shampoing Miel 300 ml,https://citymall-para.ma/produit/biokera-scalp-care-shampoing-miel-300-ml/
Biokera Serum Scalp Care Miel Cheveux Sensible 45ml,https://citymall-para.ma/produit/biokera-serum-scalp-care-miel-cheveux-sensible-45ml/
