titre,url
Delia Cosmetics Cameleo BB Sérum Pour Cheveux Bouclés 55ml,https://citymall-para.ma/produit/delia-cosmetics-cameleo-bb-serum-pour-cheveux-boucles-55ml/
Delia Cosmetics Cameleo BB Shampoing Cheveux Abîmés 250ml,https://citymall-para.ma/produit/delia-cosmetics-cameleo-bb-shampoing-cheveux-abimes-250ml/
Vechy dercos apres shampoo energisant 200ml,https://citymall-para.ma/produit/dercos-apres-shampoo-energisant-200ml/
DERCOS Densi-Solution Baume Epaisseur Regenerant 200ml,https://citymall-para.ma/produit/dercos-densi-solution-baume-epaisseur-regenerant-200ml/
Vichy Dercos densi solutions lotion 100ml,https://citymall-para.ma/produit/vichy-dercos-densi-solutions-lotion-100ml/
Dercos densisol shamp epaisseur 250ML,https://citymall-para.ma/produit/dercos-densisol-shamp-epaisseur-250ml/
VICHY DERCOS Detox Apres-shamp Legerete 200ml,https://citymall-para.ma/produit/dercos-detox-apres-shamp-legerete-200ml/
Vechy Dercos detox shamp sec spray 150ml,https://citymall-para.ma/produit/dercos-detox-shamp-sec-spray-150ml/
Vechy Dercos kera-solutions masque 2 Min reparateur 200ml,https://citymall-para.ma/produit/dercos-kera-solutions-masque-2-min-reparateur-200ml/
Vechy Dercos kera-solutions serum 40ml,https://citymall-para.ma/produit/dercos-kera-solutions-serum-40ml/
Vichy Dercos kera-solutions shamp reconstituant 250ml,https://citymall-para.ma/produit/dercos-kera-solutions-shamp-reconstituant-250ml/
Vichy Dercos Nutri protein masque nourrissant 250ml,https://citymall-para.ma/produit/dercos-nutri-protein-masque-nourrissant-250ml/
Vichy Dercos Nutri protein shamp nourrissant 250ml,https://citymall-para.ma/produit/dercos-nutri-protein-shamp-nourrissant-250ml/
VICHY DERCOS SHAMP ANTI-PELL CHEVEUX GRAS 200ML,https://citymall-para.ma/produit/dercos-shamp-anti-pell-cheveux-gras-200ml/
VICHY DERCOS SHAMP ANTI-PELL CHEVEUX SECS 200ML,https://citymall-para.ma/produit/dercos-shamp-anti-pell-cheveux-secs-200ml/
Dercos shamp ultra apaisant cheveux gras 200ml,https://citymall-para.ma/produit/dercos-shamp-ultra-apaisant-cheveux-gras-200ml/
VICHY DERCOS SHAMPOO ANTI-PELL SENSITIVE 200ML,https://citymall-para.ma/produit/dercos-shampoo-anti-pell-sensitive-200ml/
Vichy Dercos shampoo neogenic 200ml,https://citymall-para.ma/produit/vichy-dercos-shampoo-neogenic-200-ml/
Dercos shamp sebo-correcteur 200ml,https://citymall-para.ma/produit/vichy-dercos-shampoo-sebo-regulateur-200ml/
Dercos shampoo ultra apaisant cheveux secs 200ml,https://citymall-para.ma/produit/dercos-shampoo-ultra-apaisant-cheveux-secs-200ml/
Vechy Dercos Vitamine A.C.E shamp brillance 250ml,https://citymall-para.ma/produit/vechy-dercos-vitamine-a-c-e-shamp-brillance-250ml/
Dermedic Capilarte Serum Traitant Stimulant 150ml,https://citymall-para.ma/produit/dermedic-capilarte-serum-traitant-stimulant-150ml/
Dermedic Capilarte Shampoing Fortifiant Chute 300ml,https://citymall-para.ma/produit/dermedic-capilarte-shamp-fortifiant-chute-300ml/
Dermedic Capilarte Shampoing Traitant Stimulant 300ml,https://citymall-para.ma/produit/dermedic-capilarte-shampoing-traitant-stimulant-300ml/
Dermedic Capilarte Shampooing Anti Pellicules 300ml,https://citymall-para.ma/produit/dermedic-capilarte-shampooing-anti-pellicules-300ml/
Dermedic Capilarte Shampooing Apaisant 300ml,https://citymall-para.ma/produit/dermedic-capilarte-shampooing-apaisant-pour-cheveux-et-peaux-sensibles-300ml/
Dermofuture Apres-shamp au charbon actif 250ml,https://citymall-para.ma/produit/dermofuture-apres-shamp-au-charbon-actif-250ml/
Dermofuture shamp au charbon actif 250ml,https://citymall-para.ma/produit/dermofuture-shamp-au-charbon-actif-250ml/
Ducray anaphase + soin apres-shampooing 200ml,https://citymall-para.ma/produit/ducray-anaphase-soin-apres-shampooing-200ml/
Ducray Elution Shamp Nouv Formule 200Ml,https://citymall-para.ma/produit/ducray-elution-shamp-nouv-formule-200ml/
Ducray Gel Rubefiant 30Ml,https://citymall-para.ma/produit/ducray-gel-rubefiant-30ml/
Ducray Kelual Ds Shamp Trait Squam 100Ml,https://citymall-para.ma/produit/ducray-kelual-ds-shamp-trait-squam-100ml/
Ducray Neoptide femmes lotion Anti-Chute,https://citymall-para.ma/produit/ducray-neoptide-femmes-lotion-anti-chute/
Ducray Sensinol shampoing 200ml,https://citymall-para.ma/produit/ducray-sensinol-shamp-200-ml/
DUCRAY SQUANORM LOTION 200ML,https://citymall-para.ma/produit/ducray-squanorm-lotion-200ml/
DUCRAY SQUANORM SHAMP ANTIPELLICULAIRE GRASSE 200ML,https://citymall-para.ma/produit/ducray-squanorm-shamp-antipelliculaire-grasse-200ml/
DUCRAY SQUANORM SHAMP ANTIPELLICULAIRE SECHE 200ML,https://citymall-para.ma/produit/ducray-squanorm-shamp-antipelliculaire-seche-200ml/
Ecophane shamp ultra doux 500ml,https://citymall-para.ma/produit/ecophane-shamp-ultra-doux-500ml/
Ecophane Shampoo 200Ml,https://citymall-para.ma/produit/ecophane-shampoo-200ml/
ECRINAL AMPOULES 8X5ML,https://citymall-para.ma/produit/ecrinal-ampoules-85ml/
ECRINAL ANP BAUME APRÈS-SHAMPOOING 250ML,https://citymall-para.ma/produit/ecrinal-baume-apres-shamp-250ml/
Ecrinal Masque Capillaire 125ml,https://citymall-para.ma/produit/ecrinal-masque-capillaire-125ml/
ECRINAL SHAMPOING FORTIFIANT FEMME 200ML,https://citymall-para.ma/produit/ecrinal-shampoing-femme-20/
Elseve shp 200 color vive,https://citymall-para.ma/produit/eelseve-shp-200-color-vive/
ELCEA COLORATION PERMANENTE BLOND N°7,https://citymall-para.ma/produit/elcea-coloration-permanente-blond-n7/
ELCEA COLORATION PERMANENTE BLOND DORE N°7.3,https://citymall-para.ma/produit/elcea-coloration-permanente-blond-dore-n7-3/
ELCEA COLORATION PERMANENTE BLOND CLAIR N°8,https://citymall-para.ma/produit/elcea-coloration-permanente-blond-clair-n8/
ELCEA COLORATION PERMANENTE BLOND TRÈS CLAIR N°9,https://citymall-para.ma/produit/elcea-coloration-permanente-blond-tres-clair-n9/
Elseve  Demelant Color Vive Purple 150ml,https://citymall-para.ma/produit/elseve-demelant-color-vive-purple-150ml/
Elseve  shampooing 200 full resist,https://citymall-para.ma/produit/elseve-shampooing-200-full-resist/
Elseve Après Shampooing Color Vive 200ml,https://citymall-para.ma/produit/elseve-apres-shampooing-color-vive-200ml/
Elseve Après Shampooing Dream Long 200ml,https://citymall-para.ma/produit/elseve-apres-shampooing-dream-long-200ml/
Elseve Après Shampooing Full Resist 200ml,https://citymall-para.ma/produit/elseve-apres-shampooing-full-resist-200ml/
Elseve Après Shampooing Total repair 5 200ml,https://citymall-para.ma/produit/elseve-shampooing-total-repair-5-200ml/
Elseve Color-Vive Low Shampoo 400ml,https://citymall-para.ma/produit/elseve-color-vive-low-shampoo-400ml/
Elseve Dream Long Straight Serum 100ml,https://citymall-para.ma/produit/elseve-dream-long-straight-serum-100ml/
Elseve Huile Extra Tres Secs 100ml,https://citymall-para.ma/produit/elseve-huile-extra-tres-secs-100ml/
Elseve Huile Extraordinaire Tous Types de cheveux 100ml,https://citymall-para.ma/produit/elseve-huile-extraordinaire-tous-types-de-cheveux-100ml/
Elseve Huile Extraordinaire Tous Types De Cheveux 50ml,https://citymall-para.ma/produit/elseve-huile-extra-tt-types-100ml/
Elseve low poo huile extraordinaire,https://citymall-para.ma/produit/elseve-low-poo-huile-extraordinaire/
Elseve Huile Extraordinaire Low Shampoo,https://citymall-para.ma/produit/elseve-low-poo-tr5/
Elseve Masque Color Vive 310ml,https://citymall-para.ma/produit/elseve-masque-color-vive-310ml/
Elseve Masque Dream Long 310ml,https://citymall-para.ma/produit/elseve-masque-dream-long-310ml/
Elseve Masque Huile Extra Jojoba 310ml,https://citymall-para.ma/produit/elseve-masque-huile-extra-jojoba-310ml/
Elseve Masque Liss Intense 310ml,https://citymall-para.ma/produit/elseve-masque-liss-intense-310ml/
Elseve Masque Total Repair 5 310ml,https://citymall-para.ma/produit/elseve-masque-total-repair-5-310ml/
Elseve Oil replacement Dream Long Straight 300ml,https://citymall-para.ma/produit/elseve-oil-replacement-dream-long-straight-300ml/
Elseve Oil replacement Full Resist 300ml,https://citymall-para.ma/produit/elseve-oil-replacement-full-resist-300ml/
Elseve Oil replacement Huile Extra 125ml,https://citymall-para.ma/produit/elseve-oil-replacement-huile-extra-125ml/
Elseve Oil replacement Huile Extra Tube 300ml,https://citymall-para.ma/produit/elseve-oil-replacement-huile-extra-tube-300ml/
Elseve Oil Replacement Total Repair 5 Tube 300 ml,https://citymall-para.ma/produit/elseve-oil-replacement-total-repair-5-tube-300-ml/
Elseve shampooing 200 liss intense,https://citymall-para.ma/produit/elseve-shampooing-200-liss-intense/
Elseve shampooing 400 full resist,https://citymall-para.ma/produit/elseve-shampooing-400-full-resist/
Elseve shampooing 600 dream long straight,https://citymall-para.ma/produit/elseve-shampooing-600-dream-long-straight/
Elseve shampooing 600 full resist,https://citymall-para.ma/produit/elseve-shampooing-600-full-resist/
Elseve shp 200 color vive purple,https://citymall-para.ma/produit/elseve-shp-200-color-vive-purple/
Elseve shp 200 dream long,https://citymall-para.ma/produit/elseve-shp-200-dream-long/
Elseve shp 200 dream long straight,https://citymall-para.ma/produit/elseve-shp-200-dream-long-straight/
Elseve shp 200 huile extra normaux a secs,https://citymall-para.ma/produit/elseve-shp-200-huile-extra-normaux-a-secs/
Elseve shp 200 huile extra tres secs,https://citymall-para.ma/produit/elseve-shp-200-huile-extra-tres-secs/
Elseve shp 200 hyaluron,https://citymall-para.ma/produit/elseve-shp-200-hyaluron/
Elseve shp 200 tr5,https://citymall-para.ma/produit/elseve-shp-200-tr5/
Elseve shp 400 color vive,https://citymall-para.ma/produit/elseve-shp-400-color-vive/
Elseve shp 400 dream long,https://citymall-para.ma/produit/elseve-shp-400-dream-long/
Elseve shp 400 dream long straight,https://citymall-para.ma/produit/elseve-shp-400-dream-long-straight/
Elseve shp 400 huile extraordinaire normaux a secs,https://citymall-para.ma/produit/elseve-shp-400-huile-extraordinaire-normaux-a-secs/
Elseve shp 400 hyaluron,https://citymall-para.ma/produit/elseve-shp-400-hyaluron/
Elseve shp 400 liss intense,https://citymall-para.ma/produit/elseve-shp-400-liss-intense/
Elseve shp 400 total repair,https://citymall-para.ma/produit/elseve-shp-400-total-repair/
Elseve shp 600 dream long,https://citymall-para.ma/produit/elseve-shp-600-dream-long/
Elseve shp 600 huile extra normaux,https://citymall-para.ma/produit/elseve-shp-600-huile-extra-normaux/
Elseve shp 600 tr5,https://citymall-para.ma/produit/elseve-shp-600-tr5/
Elseve Soin Magique Dream Long 200ml,https://citymall-para.ma/produit/elseve-soin-magique-dream-long-200ml/
Epta ds shampooing pellicules 150 ml,https://citymall-para.ma/produit/epta-ds-shampooing-pellicules-150-ml/
EPTA DS SPRAY 50ML,https://citymall-para.ma/produit/epta-ds-spray-50ml/
Eptaderm Epta Hair lotion anti chute 100ml,https://citymall-para.ma/produit/eptaderm-epta-hair-lotion-anti-chute-100ml/
EPTADERM HAIR SHAMPOOING ENERGISANT 150ML,https://citymall-para.ma/produit/eptaderm-hair-shampooing-energisant-150ml/
EPTADERM PSO 30 CREME CUIRE CHEVELU CORPS 100ML,https://citymall-para.ma/produit/eptaderm-pso-30-creme-cuire-chevelu-corps-100ml/
Erayba Bio Smooth Treatment 200ml,https://citymall-para.ma/produit/erayba-bio-smooth-treatment-200ml/
Erayba Bio Smooth BS10 Mask 150ml,https://citymall-para.ma/produit/erayba-bio-smooth-bs10-mask-150ml/
Erayba Bio Smoth BS16 Conditionner 250ml,https://citymall-para.ma/produit/erayba-bio-smoth-bs16-conditionner-250ml/
Erayba Biome B10 bio Mask 1000ml,https://citymall-para.ma/produit/erayba-biome-b10-bio-mask-1000ml/
Erayba Biome B10 bio mask 200ml,https://citymall-para.ma/produit/erayba-biome-b10-bio-mask-200ml/
Erayba Biome B11 bio repair shot 100ml,https://citymall-para.ma/produit/erayba-biome-b11-bio-repair-shot-100ml/
Erayba Biome B12 bio shamp 1000ml,https://citymall-para.ma/produit/erayba-biome-b12-bio-shamp-1000ml/
Erayba Biome B12 bio shamp 250ml,https://citymall-para.ma/produit/erayba-biome-b12-bio-shamp-250ml/
Erayba Biome B18 bio 2-phase 200ml,https://citymall-para.ma/produit/erayba-biome-b18-bio-2-phase-200ml/
Erayba Hydraker K10 keratin total mask 150ml,https://citymall-para.ma/produit/erayba-hydraker-k10-keratin-total-mask-150ml/
Erayba Hydraker K11 keratin hair botox 100ml,https://citymall-para.ma/produit/erayba-hydraker-k11-keratin-hair-botox-100ml/
Erayba Nutriactive N10 collastin mask 1000ml,https://citymall-para.ma/produit/erayba-nutriactive-n10-collastin-mask-1000ml/
Erayba Nutriactive N10 collastin mask 250ml,https://citymall-para.ma/produit/erayba-nutriactive-n10-collastin-mask-250ml/
Erayba Nutriactive N11 hyaluronic velvet 100ml,https://citymall-para.ma/produit/erayba-nutriactive-n11-hyaluronic-velvet-100ml/
Erayba Nutriactive N12 Collastin Shampooing 1000ml,https://citymall-para.ma/produit/erayba-nutriactive-n12-collastin-shampooing-1000ml/
Erayba Nutriactive N15 instant serum 100ml,https://citymall-para.ma/produit/erayba-nutriactive-n15-instant-serum-100ml/
Erayba Nutriactive N16 collastin conditionner 1000ml,https://citymall-para.ma/produit/erayba-nutriactive-n16-collastin-conditionner-1000ml/
Erayba Nutriactive N18 collastin 2-phase 200ml,https://citymall-para.ma/produit/erayba-nutriactive-n18-collastin-2-phase-200ml/
Erayba Zen Active Z12r Preventive shamp 250ml,https://citymall-para.ma/produit/erayba-zen-active-z12r-preventive-shamp-250ml/
Erayba Zen Active Zb set balancing treatment,https://citymall-para.ma/produit/erayba-zen-active-zb-set-balancing-treatment/
Erayba Zen Active Zp set purifying treatment,https://citymall-para.ma/produit/erayba-zen-active-zp-set-purifying-treatment/
Erayba Zen Active Zr set revitalising treatment,https://citymall-para.ma/produit/erayba-zen-active-zr-set-revitalising-treatment/
Erayba ZenActive Z10p peeling mask 8*15ml,https://citymall-para.ma/produit/erayba-zenactive-z10p-peeling-mask-815ml/
Erayba ZenActive Z10r revitalising mask 150ml,https://citymall-para.ma/produit/erayba-zenactive-z10r-revitalising-mask-150ml/
Erayba ZenActive Z18p purifying lotion 12*8ml,https://citymall-para.ma/produit/erayba-zenactive-z18p-purifying-lotion-128ml/
Eubos Sensitive Shampooing dermo-protective 50ml,https://citymall-para.ma/produit/eubos-sensitive-shamp-dermo-protective-50ml/
Excellence 1 noir,https://citymall-para.ma/produit/excellence-1-noir/
Excellence 3 Chatain Fonce,https://citymall-para.ma/produit/excellence-3-chatain-fonce/
Excellence 4 Chatain,https://citymall-para.ma/produit/excellence-4-chatain/
"Excellence 4,1 Brun Profond",https://citymall-para.ma/produit/excellence-41-brun-profond/
"Excellence 5,3 Chatain Clair Dore",https://citymall-para.ma/produit/excellence-53-chatain-clair-dore/
"Excellence 6,30 Blond Fonce Dore Intense",https://citymall-para.ma/produit/excellence-630-blond-fonce-dore-intense/
Excellence 6.7 C.Brown,https://citymall-para.ma/produit/excellence-6-7-c-brown/
Excellence 7 Blond,https://citymall-para.ma/produit/excellence-7-blond/
"Excellence 7,1 Blond Cendre",https://citymall-para.ma/produit/excellence-71-blond-cendre/
"Excellence 7,3 Blond Dore",https://citymall-para.ma/produit/excellence-73-blond-dore/
Excellence 7.7 H.Brown,https://citymall-para.ma/produit/excellence-7-7-h-brown/
Excellence 8 Blond Clair,https://citymall-para.ma/produit/excellence-8-blond-clair/
"Excellence 8,1 Blond Clair Cendre",https://citymall-para.ma/produit/excellence-81-blond-clair-cendre/
Excellence 9 Blond Tres Clair,https://citymall-para.ma/produit/excellence-9-blond-tres-clair/
Excellence Ash Supreme 7.12,https://citymall-para.ma/produit/excellence-ash-supreme-7-12/
Excellence Ash Supreme 8.12,https://citymall-para.ma/produit/excellence-ash-supreme-8-12/
Excellence Ash Supreme 9.12,https://citymall-para.ma/produit/excellence-ash-supreme-9-12/
Farmatint coloration aloe vera 5R 150Ml,https://citymall-para.ma/produit/farmatint-coloration-aloe-vera-5r-150ml/
Farmatint coloration aloe vera 7C 150Ml,https://citymall-para.ma/produit/farmatint-coloration-aloe-vera-7c-150ml/
Farmatint coloration aloe vera 7M 150Ml,https://citymall-para.ma/produit/farmatint-coloration-aloe-vera-7m-150ml/
FARMATINT Coloration Aloe Vera 7R 150ML,https://citymall-para.ma/produit/farmatint-coloration-aloe-vera-7r-150ml/
FARMATINT Coloration Aloe Vera 9N 150ML,https://citymall-para.ma/produit/farmatint-coloration-aloe-vera-9n-150ml/
FARMATINT Crème Aloe Vera 200ML,https://citymall-para.ma/produit/farmatint-creme-aloe-vera-200ml/
FILORGA oil-absolute 30ml,https://citymall-para.ma/produit/filorga-oil-absolute-30ml/
Forcapil Cheveux Et Ongles180 Gelules,https://citymall-para.ma/produit/forcapil-180-gelules/
FORCAPIL LOTION ANTI CHUTE 150ML,https://citymall-para.ma/produit/forcapil-lotion-anti-chute-150ml/
FORCAPIL SHAMP ANTI-CHUTE 200ML,https://citymall-para.ma/produit/forcapil-shamp-anti-chute-200ml/
Xen Forti Q10 Lotion anti-chute 100ml,https://citymall-para.ma/produit/xen-forti-q10-lotion-anti-chute-100ml/
Xen Forti Q10 Shampooing Stimulant 200ml,https://citymall-para.ma/produit/xen-forti-q10-shampooing-stimulant-200ml/
Fortiphane Lotion Anti-chute 75ml,https://citymall-para.ma/produit/fortiphane-lotion-anti-chute-75ml/
Fortiphane Shampooing Anti Chute 200Ml,https://citymall-para.ma/produit/fortiphane-shampooing-anti-chute-200ml/
FOTOPROTECTOR FUSION WATER COLOR SPF50 50ML,https://citymall-para.ma/produit/fotoprotector-fusion-water-color-spf50-50ml/
Furterer okara spray active sans rincage 150 ml,https://citymall-para.ma/produit/furterer-okara-spray-active-sans-rincage-150-ml/
"Garnier Olia, 8.0 Blond kit",https://citymall-para.ma/produit/garnier-olia-8-0-blond-kit/
Hairstim Lotion Anti-chute 100ml,https://citymall-para.ma/produit/hairstim-lotion-anti-chute-100ml/
Hairstim Shampooing Anti-chute 200ml,https://citymall-para.ma/produit/hairstim-shampooing-anti-chute-200ml/
HOLISTICAP Cheveux & Ongles 60 capsules,https://citymall-para.ma/produit/holisticap-cheveux-ongles-60-capsules/
IRALTONE SHAMPOING FORTIFIANT 200ML,https://citymall-para.ma/produit/iraltone-shampoing-fortifiant-200ml/
IRALTONE SHAMPOING DS 200ML,https://citymall-para.ma/produit/iraltone-shampoing-ds-200ml/
IRALTONE SHAMPOOING SEBO-REGULATEUR 200ML,https://citymall-para.ma/produit/iraltone-shampooing-sebo-regulateur-200ml/
Item alphactif lotion,https://citymall-para.ma/produit/item-alphactif-lotion/
Item alphactif shampooing,https://citymall-para.ma/produit/item-alphactif-shampooing/
Item alphakeptol shampooing DS anti pelliculaire 200ml,https://citymall-para.ma/produit/item-alphakeptol-shampooing-ds-anti-pelliculaire-200ml/
Item k.o gel creme,https://citymall-para.ma/produit/item-k-o-gel-creme/
Item k.o lentes,https://citymall-para.ma/produit/item-k-o-lentes/
Keragene shampooing Anti-Chute,https://citymall-para.ma/produit/keragene-shampooing-anti-chute/
XEN Keratin Q10 Shampooing Soin Reparateur 200ml,https://citymall-para.ma/produit/keratin-q10-shamp-soin-reparateur-200ml/
keratinliss balsam reparatrice 125ml,https://citymall-para.ma/produit/keratinliss-balsam-reparatrice-125ml/
Keratinliss Masque 200 Ml,https://citymall-para.ma/produit/keratinliss-masque-200-ml/
Keratinliss Shampoing 250 Ml,https://citymall-para.ma/produit/keratinliss-shampoing-250-ml/
KLORANE BAUME APRES SHAMPOOING AU MANGUE 200ML,https://citymall-para.ma/produit/klorane-baume-apres-shampooing-au-mangue-200ml/
KLORANE BAUME APRES-SHAMPOOING CAMOMILLE 200ML,https://citymall-para.ma/produit/klorane-baume-apres-shampooing-camomille-200ml/
Klorane Baume d’olive 200Ml,https://citymall-para.ma/produit/klorane-baume-dolive-200ml/
KLORANE FORCE KÉRATINE CONCENTRÉ ANTICHUTE 125 ML,https://citymall-para.ma/produit/klorane-force-keratine-concentre-antichute-125-ml/
KLORANE FORCE TRI-ACTIVE SERUM ANTI CHUTE -100 ML,https://citymall-para.ma/produit/klorane-force-tri-active-serum-anti-chute-100-ml/
KLORANE MASQUE NUTRITION MANGUE SECS 150ML,https://citymall-para.ma/produit/klorane-masque-nutrition-mangue-secs-150ml/
KLORANE POLYSIANES CRÈME FONDANTE 150ML,https://citymall-para.ma/produit/klorane-polysianes-creme-fondante-150ml/
klorane polysianes shampooing douche delicieux 200ml,https://citymall-para.ma/produit/klorane-polysianes-shampooing-douche-delicieux-200ml/
klorane shampoing au beurre de mangue 400ml,https://citymall-para.ma/produit/klorane-shampoing-au-beurre-de-mangue-400ml/
Klorane Shampoing Au Dattier Du Désert – 400 Ml,https://citymall-para.ma/produit/klorane-shampoing-au-dattier-du-desert-400-ml/
KLORANE SHAMPOING LAIT AVOINE 400ML,https://citymall-para.ma/produit/klorane-shampoing-lait-avoine-400ml/
Klorane Shampooing A La Camomille 200Ml,https://citymall-para.ma/produit/klorane-shampooing-a-la-camomille-200ml/
KL SHAMP A LA CAMOMILLE 400ML,https://citymall-para.ma/produit/klorane-shampooing-a-la-camomille-400ml/
KLORANE SHAMPOOING AU MANGUE 200ML,https://citymall-para.ma/produit/klorane-shampooing-au-mangue-200ml/
Klorane Shampooing Sec Au Lait D’avoine Teinté Spray – 150ml,https://citymall-para.ma/produit/klorane-shampooing-sec-au-lait-davoine-teinte-spray-150ml/
Klorane Shampooing Sec Extra Doux Au Lait D’avoine – 150 Ml,https://citymall-para.ma/produit/klorane-shampooing-sec-extra-doux-au-lait-davoine-150-ml/
Klorane Shampoing À La Quinine Et Aux Vitamines B – 200 Ml,https://citymall-para.ma/produit/klorane-shampoing-a-la-quinine-et-aux-vitamines-b-200-ml/
L’oreal Hyaluron Expert Serum 30ml,https://citymall-para.ma/produit/loreal-hyaluron-expert-serum-30ml/
L’oreal Pure Riche Shampooing 250 ml,https://citymall-para.ma/produit/loreal-pure-riche-shampooing-250-ml/
L’oreal Paris  Pure Liss Après Shampoing 250ml,https://citymall-para.ma/produit/loreal-paris-pure-liss-apres-shampoing-250ml/
L’Oréal Paris Casting Crème Gloss 200 Noir Ebene,https://citymall-para.ma/produit/ccg-200-noir-ebene/
L’Oréal Paris Casting Crème Gloss 300 Chatain Fonce,https://citymall-para.ma/produit/ccg-300-chatain-fonce/
L’oreal Paris Pure Liss Shampoing 250ml,https://citymall-para.ma/produit/loreal-paris-pure-liss-shampoing-250ml/
Laino shampooing douche agrume 200ml,https://citymall-para.ma/produit/laino-shampooing-douche-agrume-200ml/
LIPEROL Shampoing 200ML,https://citymall-para.ma/produit/liperol-shampoing-200ml/
luxeol Apres Shampooing reparateur cheveux secs 200ml,https://citymall-para.ma/produit/luxeol-apres-shampooing-reparateur-cheveux-secs-200ml/
Luxeol Huile Seche 100ml,https://citymall-para.ma/produit/luxeol-huile-seche-100ml/
Luxeol Masque Fortifiant Cheveux Normaux 200ml,https://citymall-para.ma/produit/luxeol-masque-fortifiant-cheveux-normaux-200ml/
Luxeol Masque Reparateur cheveux secs 200ml,https://citymall-para.ma/produit/luxeol-masque-reparateur-cheveux-secs-200ml/
Luxeol Serum pousse 50ml,https://citymall-para.ma/produit/luxeol-serum-pousse-50ml/
Luxeol Shampooing Anti-chute 200ml,https://citymall-para.ma/produit/luxeol-shampooing-anti-chute-200ml/
Luxeol Shampooing Antipelliculaire 200ml,https://citymall-para.ma/produit/luxeol-shampooing-antipelliculaire-200ml/
Luxeol Shamp Fortifiant cheveux Normaux 200ml,https://citymall-para.ma/produit/luxeol-shamp-fortifiant-cheuveux-normaux-200ml/
Luxeol Shampooing cheveux Gras 200ml,https://citymall-para.ma/produit/luxeol-shampooing-cheveux-gras-200ml/
Luxeol Shampooing doux 200ml,https://citymall-para.ma/produit/luxeol-shampooing-doux-200ml/
Luxeol Shampooing Lissant 200ml,https://citymall-para.ma/produit/luxeol-shampooing-lissant-200ml/
Luxeol Shampooing Reparateur cheveux secs 200ml,https://citymall-para.ma/produit/luxeol-shampooing-reparateur-cheveux-secs-200ml/
M&D bio12 shampooing reparateur multi actif 250ml,https://citymall-para.ma/produit/md-bio12-shampooing-reparateur-multi-actif-250ml/
MD Bio12 Masque Purifiant a l’Argile 75ML,https://citymall-para.ma/produit/md-bio12-masque-purifiant-a-largile-75ml/
M&D Bio12 Masque Reparateur Nourrissant 200ml,https://citymall-para.ma/produit/md-bio12-masque-reparateur-nourrissant-200ml/
Maelys Lotion Anti-Chute Ortie Prêle – 75 Ml,https://citymall-para.ma/produit/maelys-lotion-anti-chute-ortie-prele-75-ml/
Magic Retouch Fr 1 Noir,https://citymall-para.ma/produit/magic-retouch-fr-1-noir/
Magic Retouch Fr 2 Brun,https://citymall-para.ma/produit/magic-retouch-fr-2-brun/
Magic Retouch Fr 3 Chatain,https://citymall-para.ma/produit/magic-retouch-fr-3-chatain/
Magic Retouch Fr 4 Beige,https://citymall-para.ma/produit/magic-retouch-fr-4-beige/
Marrak Recovery Hair Crème 89ML,https://citymall-para.ma/produit/marrak-hair-recovery-creme-89ml/
Marrak Hair Recovery Spray 59ml,https://citymall-para.ma/produit/marrak-haire-recovery-spray-59ml/
Marrak Shampooing Nourishing 236ml,https://citymall-para.ma/produit/marrak-shampoo-nourishing-236ml/
Mixa bb Demelant karite 250ml,https://citymall-para.ma/produit/mixa-bb-demelant-karite-250ml/
Monoi 51% soin capillaire,https://citymall-para.ma/produit/monoi-51-soin-capillaire/
Monoi 99% tiare cheveux+corps,https://citymall-para.ma/produit/monoi-99-tiare-cheveuxcorps/
Eelhoe Moroccan Essence Nettoyant Desinfectant 70ml,https://citymall-para.ma/produit/moroccan-essence-nett-desinfectant-70ml/
Eelhoe Moroccan Essence Solution disinfectant 100ml,https://citymall-para.ma/produit/moroccan-essence-solution-disinfectant-100ml/
Mussvital Shampoing Nutri-Réparateur Cheveux Secs 400ML,https://citymall-para.ma/produit/mussvital-shamp-nutri-reparateur-chvx-secs-400ml/
Mussvital Shampooing Seboregulateur Cheveux Gras 400ML,https://citymall-para.ma/produit/mussvital-shamp-seboregulateur-chvx-gras-400ml/
Mussvital Shampoing Stimulant Cheveux Anti-Chute 400ML,https://citymall-para.ma/produit/mussvital-shampoing-stimulant-cheveux-anti-chute-400ml/
Mustela Gel Lavant Doux 500ML,https://citymall-para.ma/produit/mustela-gel-lavant-doux-500ml/
MUSTELA SHAMPOING BEBE 200ML,https://citymall-para.ma/produit/mustela-shampoing-bebe-200ml/
My Taklidi Huile Concentre Anti-chute 60ml,https://citymall-para.ma/produit/my-taklidi-huile-concentre-anti-chute-60ml/
My Taklidi Huile d’Ail 60ml,https://citymall-para.ma/produit/my-taklidi-huile-dail-60ml/
