titre,url
ERIC FAVRE CHRONOERECT 4 GELULES POUR TONUS SEXUEL,https://citymall-para.ma/produit/eric-favre-chronoerect-4-gelules-pour-tonus-sexuel/
MANIX SKYN NATURALLY ENDLESS Lubrifiant à Base d’Eau 80ml,https://citymall-para.ma/produit/manix-skyn-naturally-endless-lubrifiant-a-base-deau-80ml/
Novaderm Crème Emolliente 400ml,https://citymall-para.ma/produit/novaderm-creme-emolliente-400ml/
BABE ALOE VERA GEL HYDRATANT 300 ML,https://citymall-para.ma/produit/babe-aloe-vera-gel-hydratant-300-ml/
BaByliss Tond Chev batterie lithium Ion finition bleu marine/or E986E,https://citymall-para.ma/produit/babyliss-tond-chev-batterie-lithium-ion-finition-bleu-marine-or-e986e/
BETER Pince à Épiler Dorée Pointe Crabe,https://citymall-para.ma/produit/beter-pince-a-epiler-doree-pointe-crabe/
BETER Pince À Épiler Soft Touch Pointe Oblique,https://citymall-para.ma/produit/beter-pince-a-epiler-pointe-oblique/
Bioderma atoderm intensive eye 100ml,https://citymall-para.ma/produit/bioderma-atoderm-intensive-eye-100ml/
Braun Rasoir électrique rechargeable Series 3 310S – Bleu,https://citymall-para.ma/produit/braun-rasoir-electrique-rechargeable-series-3-310s-bleu/
Camomilla Blu Energy Man Nettoyant Intime Ph 5.5 300ml,https://citymall-para.ma/produit/camomilla-blu-energy-man-nettoyant-intime-ph-5-5-300ml/
Carex Gel Lubrifiant Jelly 60g,https://citymall-para.ma/produit/carex-gel-lubrifiant-jelly-60g/
Caudalie premier cru La Crème Riche 50ml,https://citymall-para.ma/produit/caudalie-premier-cru-la-creme-riche-50ml/
ERIC FAVRE CHRONOERECT 4 GELULES POUR TONUS SEXUEL,https://citymall-para.ma/produit/eric-favre-chronoerect-4-gelules-pour-tonus-sexuel/
MANIX SKYN NATURALLY ENDLESS Lubrifiant à Base d’Eau 80ml,https://citymall-para.ma/produit/manix-skyn-naturally-endless-lubrifiant-a-base-deau-80ml/
Novaderm Crème Emolliente 400ml,https://citymall-para.ma/produit/novaderm-creme-emolliente-400ml/
BABE ALOE VERA GEL HYDRATANT 300 ML,https://citymall-para.ma/produit/babe-aloe-vera-gel-hydratant-300-ml/
BaByliss Tond Chev batterie lithium Ion finition bleu marine/or E986E,https://citymall-para.ma/produit/babyliss-tond-chev-batterie-lithium-ion-finition-bleu-marine-or-e986e/
BETER Pince à Épiler Dorée Pointe Crabe,https://citymall-para.ma/produit/beter-pince-a-epiler-doree-pointe-crabe/
BETER Pince À Épiler Soft Touch Pointe Oblique,https://citymall-para.ma/produit/beter-pince-a-epiler-pointe-oblique/
Bioderma atoderm intensive eye 100ml,https://citymall-para.ma/produit/bioderma-atoderm-intensive-eye-100ml/
Braun Rasoir électrique rechargeable Series 3 310S – Bleu,https://citymall-para.ma/produit/braun-rasoir-electrique-rechargeable-series-3-310s-bleu/
Camomilla Blu Energy Man Nettoyant Intime Ph 5.5 300ml,https://citymall-para.ma/produit/camomilla-blu-energy-man-nettoyant-intime-ph-5-5-300ml/
Carex Gel Lubrifiant Jelly 60g,https://citymall-para.ma/produit/carex-gel-lubrifiant-jelly-60g/
Caudalie premier cru La Crème Riche 50ml,https://citymall-para.ma/produit/caudalie-premier-cru-la-creme-riche-50ml/
Ceylon naturals huile de coco 200ml,https://citymall-para.ma/produit/ceylon-naturals-huile-de-coco-200ml/
DCP Hairloss Shampooing Hommes 500ml,https://citymall-para.ma/produit/dcp-hairloss-shampooing-hommes-500ml/
DUCRAY ICTYANE Hydra Crème Légère 40ML,https://citymall-para.ma/produit/ducray-ictyane-hydra-creme-legere-40ml/
DUCRAY NEOPTIDE LOTION ANTI-CHUTE HOMMES 100ML,https://citymall-para.ma/produit/ducray-neoptide-lotion-anti-chute-homme-100-ml/
EMPLÂTRE RED PEPPER AU CAPSICUM,https://citymall-para.ma/produit/emplatre-red-pepper-au-capsicum/
Farlin Poire Vaginal Douche Bf-636,https://citymall-para.ma/produit/farlin-poire-vaginal-douche-bf-636/
FLORAME  BAUME A BARBE DISCIPLINANT 50G COSMOS,https://citymall-para.ma/produit/florame-baume-a-barbe-disciplinant-50g/
FLORAME  BAUME APRES RASAGE HOMME FOR MEN 75ML COSMOS,https://citymall-para.ma/produit/florame-baume-apres-rasage-homme-for-men-75ml/
FLORAME  DEODORANT SPRAY HOMME FOR MEN 100ML COSMOS,https://citymall-para.ma/produit/florame-deodorant-spray-homme-for-men-bio-100-ml/
FLORAME  DEODORANT (BILLE) HOMME FOR MEN 50ML COSMOS,https://citymall-para.ma/produit/florame-homme-deodorant-bille-bio-50ml/
FLORAME GEL NETTOYANT VISAGE HOMME FOR MEN 75ML COSMOS,https://citymall-para.ma/produit/florame-homme-gel-nettoyant-visage-bio-75-ml/
FLORAME  HUILE DE RASAGE HOMME FOR MEN 30ML COSMOS,https://citymall-para.ma/produit/florame-hhomme-huile-de-rasage-bio-30-ml/
FLORAME  MOUSSE DE RASAGE HOMME FOR MEN 150ML COSMOS,https://citymall-para.ma/produit/florame-homme-mousse-de-rasage-bio-150ml/
FLORAME  SAVON DU BAROUDEUR 5 EN 1 HOMME FOR MEN 100G COSMOS,https://citymall-para.ma/produit/florame-homme-savon-du-baroudeur-5-en-1-bio-100-g/
FLORAME  SHAMPOING DOUCHE HOMME FOR MEN L EAU AROMETIQUE 200ML COSMOS,https://citymall-para.ma/produit/florame-homme-shampooing-douche-leau-aromatique-200-ml/
FLORAME  SOIN HYDRATANT BONNE MINE HOMME FOR MEN 50ML COSMOS,https://citymall-para.ma/produit/florame-homme-soin-hydratant-bonne-mine-bio-50-ml/
FLORAME  HUILE A BARBE ADOUCISSANTE 50ML COSMOS,https://citymall-para.ma/produit/florame-huile-a-barbe-adoucissante-bio-50-ml/
FLORAME  SAVON LIQUIDE A L ANCIENNE CITRON-TEA TREE 500ML COSMEBIO,https://citymall-para.ma/produit/florame-savon-liquide-a-lancienne-citron-tea-tree-bio-500ml/
FLORAME  SAVON LIQUIDE A L ANCIENNE LAVANDE 500ML COSMEBIO,https://citymall-para.ma/produit/florame-savon-liquide-a-lancienne-lavande-bio-500ml/
FLORAME  SHAMPOING DOUCHE HOMME FOR MEN FRAICHEUR BOISSEE 200ML COSMOS,https://citymall-para.ma/produit/florame-shampoing-douche-fraicheur-boisee-bio-200ml/
Health & science Line Spray Antiseptique 120ML,https://citymall-para.ma/produit/hs-line-spray-antiseptique-120ml/
HERDEGEN EMBOUT BEQUILLE 920315,https://citymall-para.ma/produit/herdegen-embout-bequille-920315/
HT CEUTIC Crème Booster 50ML,https://citymall-para.ma/produit/ht-ceutic-creme-booster-50-ml/
ISDIN AGE REVERSE DAY CREME VISAGE 51.5G,https://citymall-para.ma/produit/isdinceutics-a-g-e-reverse-day/
Isdinceutics A.G.E. Reverse,https://citymall-para.ma/produit/isdinceutics-a-g-e-reverse/
Isispharma Glyco-A Body Peeling Corps 10% 200ml,https://citymall-para.ma/produit/isispharma-glyco-a-body-peeling-corps-10-200ml/
MANIX Gel de Massage Gourmand Fraise 200ml,https://citymall-para.ma/produit/manix-gel-de-massage-gourmand-fraise-200ml/
Manix Gel De Massage Stimulant 200 ml,https://citymall-para.ma/produit/manix-gel-de-massage-stimulant-200-ml/
Manix Gel Lubrifiant Effect 80 ml,https://citymall-para.ma/produit/manix-gel-lubrifiant-effect-80-ml/
MANIX GEL LUBRIFIANT NATURAL 100 ML,https://citymall-para.ma/produit/manix-gel-lubrifiant-natural-100-ml/
Manix Infini Le Plus Fin Boite De 12,https://citymall-para.ma/produit/manix-infini-le-plus-fin-boite-de-12/
MANIX GEL INTIMITY TUBE DE 50 ML,https://citymall-para.ma/produit/manix-intimity-fluide-lubrifiant-intime-50ml/
Manix King Size 14 Pièces,https://citymall-para.ma/produit/manix-king-size-14-pieces/
Manix King Size Max 3 Piéces,https://citymall-para.ma/produit/manix-king-size-max-3-pieces-2/
Manix King Size Max Maximum Comfort 14 Preservatifs,https://citymall-para.ma/produit/manix-king-size-max-maximum-comfort-14-preservatifs/
Manix Pure Gel Lubrifiant 200 ml,https://citymall-para.ma/produit/manix-pure-gel-lubrifiant-200-ml/
Manix Skyn Cocktail Club 9 pièces,https://citymall-para.ma/produit/manix-skyn-cocktail-club-9-pieces/
Manix Skyn Excitation 10 Preservatifs,https://citymall-para.ma/produit/manix-skyn-excitation-10-preservatifs/
Manix Skyn Feel Everything 5 Sensation,https://citymall-para.ma/produit/manix-skyn-5-sences-preservatifs-5-unites/
Manix Skyn Gel All Night Long gel lubrifiant 80ml,https://citymall-para.ma/produit/manix-skyn-gel-all-night-long-gel-lubrifiant-80ml/
MANIX SKYN Gel Lubrifiant Aqua Feel 80ml,https://citymall-para.ma/produit/manix-skyn-gel-lubrifiant-aqua-feel-80ml/
Manix Skyn Intense Feel 10,https://citymall-para.ma/produit/manix-skyn-intense-feel-10-2/
MANIX SKYN KING SIZE 10 PIÈCES,https://citymall-para.ma/produit/manix-skyn-king-size-10-pieces/
Manix Skyn King Size Max 20 Preservatifs Grande taille,https://citymall-para.ma/produit/manix-skyn-king-size-20-preservatifs-sans-latex/
Manix Skyn Natural Harmony 80ml,https://citymall-para.ma/produit/manix-skyn-natural-harmony-80ml/
Manix Skyn Original – 3 Piéces,https://citymall-para.ma/produit/manix-skyn-original-3-pieces/
Manix Skyn Sélection Préservatifs 3 Original + 3 Intense Feel + 3 Extra Lubrifié 9 unités,https://citymall-para.ma/produit/manix-skyn-selection-preservatifs-3-original-3-intense-feel-3-extra-lubrifie-9-unites/
MANIX SUPER EASY-FIT 6 UNITÉS,https://citymall-para.ma/produit/manix-super-easy-fit-6-unites/
MANIX SUPRÊME SANS LATEX 10 PRÉSERVATIFS,https://citymall-para.ma/produit/manix-supreme-sans-latex-10-preservatifs/
Manix Ultra Protect Maximum Protection Pack de 12,https://citymall-para.ma/produit/manix-ultra-protect-boite-12-preservatifs/
NATURALIA Conteur Yeux Anti-Rides Anti-Fatigue 15ML,https://citymall-para.ma/produit/naturalia-conteur-yeux-anti-rides-anti-fatigue-15ml/
NaturEsoin Huile de Lavande – 50 ml,https://citymall-para.ma/produit/naturesoin-huile-de-lavande-50-ml/
Nuxe Men deodorant 24h protection 50 ml,https://citymall-para.ma/produit/nuxe-men-deodorant-24h-protection-50-ml/
RITUEL D’ORIENT Frotte Dos,https://citymall-para.ma/produit/rituel-dorient-frotte-dos/
Rogé Cavaillès Savon Surgras Extra Doux Lait Et Miel 250g,https://citymall-para.ma/produit/roge-cavailles-savon-surgras-extra-doux-lait-et-miel-250g/
Spirig Excipial pruri lotion 200 ml,https://citymall-para.ma/produit/spirig-excipial-pruri-lotion-200-ml/
Subliderm Crème Mains Antiseptique  Et Hydratante 50ml,https://citymall-para.ma/produit/subliderm-creme-mains-antiseptique-et-hydratante-50ml/
Uriage Xémose Crème Relipidante Anti-Irritations 200 ml,https://citymall-para.ma/produit/uriage-xemose-creme-relipidante-anti-irritations-200ml/
Vichy Dercos Aminexil Men Cure Intensive Première Chute De Cheveux 36ml,https://citymall-para.ma/produit/vichy-dercos-aminexil-men-cure-intensive-premiere-chute-de-cheveux-36ml/
VICHY HOMME HYDRA MAG C+ 50ML,https://citymall-para.ma/produit/vichy-homme-hydra-mag-c-50ml/
VICHY HOMME MOUSSE A RASER PS 200ML,https://citymall-para.ma/produit/vichy-homme-mousse-a-raser-ps-200ml/
Vichy Homme Sensi baume 75ml+hydra mag C 100ml Trousse,https://citymall-para.ma/produit/vichy-homme-sensi-baume-75mlhydra-mag-c-100ml-trousse/
VICHY HOMME SENSI BAUME APRES RASAGE APAISANT 75ML,https://citymall-para.ma/produit/vichy-homme-sensi-baume-apres-rasage-apaisant-75ml/
VICHY LIFTACTIV NUIT SUPREME SOIN CORRECTEUR 50 ML,https://citymall-para.ma/produit/vichy-liftactiv-nuit-supreme-soin-correcteur-50-ml/
VITA NATURE Sérum Anti âge à la Bave d’Escargot 30ml,https://citymall-para.ma/produit/vita-nature-serum-anti-age-a-la-bave-descargot-30ml-2/
VITA NATURE Sérum Vitamine C 30ml,https://citymall-para.ma/produit/vita-nature-serum-vitamine-c-30ml/
Actigel Surgras Doux Peaux Seches Acti Ceutic 200ml,https://citymall-para.ma/produit/actigel-surgras-doux-ps-acti-ceutic-200ml/
Addax Bactospray 60ml,https://citymall-para.ma/produit/addax-bactospray-60ml/
Aginax soin lavant sans savon 125ml,https://citymall-para.ma/produit/aginax-soin-lavant-sans-savon-125ml/
Androlistica Homme 50+ 40 capsules,https://citymall-para.ma/produit/androlistica-homme-50-40-capsules/
Apivita Rescue Huile Capillaire Nourish & repair 100ml,https://citymall-para.ma/produit/apivita-rescue-huile-capillaire-nourish-repair-100ml/
Apivita Shampoo Tonic Homme 250ml,https://citymall-para.ma/produit/apivita-shampoo-tonic-homme-250ml/
Aposeche Creme Re-hydratante Visage,https://citymall-para.ma/produit/aposeche-creme-rehydratante-visage/
Beurer Appareil Anti Point Noir,https://citymall-para.ma/produit/appareil-anti-point-noir/
Biomask.s Huile soin de barbe 50ml,https://citymall-para.ma/produit/biomask-s-huile-soin-de-barbe-50ml/
Biomask.s Man Gel Nettoyant 200ml,https://citymall-para.ma/produit/biomask-s-man-gel-nettoyant-200ml/
Biomask.s Shamp Nutrition Intense 200ml,https://citymall-para.ma/produit/biomask-s-shamp-nutrition-intense-200ml/
Bionnex perfederm deomineral pour homme 75ml,https://citymall-para.ma/produit/bionnex-perfederm-deomineral-pour-homme-75ml/
Carex classic 3,https://citymall-para.ma/produit/carex-classic-3/
CUMLAUDE GINESENS EFFET THERMIQUE 30ML,https://citymall-para.ma/produit/cumlaude-ginesens-effet-thermique-30ml/
CUMLAUDE LAB MUCUS GEL 30ML,https://citymall-para.ma/produit/cumlaude-mucus-30ml/
Dercos aminexil clinical homme 21 amp,https://citymall-para.ma/produit/dercos-aminexil-clinical-homme-21-amp/
Dermecran Libal creme barriere 50Ml,https://citymall-para.ma/produit/dermecran-libal-creme-barriere-50ml/
Dermophil creme hydratante,https://citymall-para.ma/produit/dermophil-creme-hydratante/
Df Creme Hydratant 50ml,https://citymall-para.ma/produit/df-creme-hydratant-50ml/
Dodie Thermometre 2en1 Bain Et Chambre,https://citymall-para.ma/produit/dodie-thermometre-2en1-bain-et-chambre/
Dominance bio activa creme anti-age 50ml,https://citymall-para.ma/produit/dominance-bio-activa-creme-anti-age-50ml/
Ducray Keracnyl Gel Moussant 200Ml,https://citymall-para.ma/produit/ducray-keracnyl-gel-moussant-200ml/
DUCRAY NEOPTIDE LOTION ANTI CHUTE HOMME 100ML,https://citymall-para.ma/produit/ducray-neoptide-lotion-anti-chute-homme-100ml/
Durex Extra Safe 12,https://citymall-para.ma/produit/durex-extra-safe-12/
Durex Extra Safe 3,https://citymall-para.ma/produit/durex-extra-safe-3/
Durex Fetherlite Ultra 3,https://citymall-para.ma/produit/durex-fetherlite-ultra-3/
Durex Performax Intense 3,https://citymall-para.ma/produit/durex-performax-intense-3/
ECRINAL Lotion Homme 200ML,https://citymall-para.ma/produit/ecrinal-lotion-homme-200ml/
Ecrinal Shampooing Homme 200Ml,https://citymall-para.ma/produit/ecrinal-shampooing-homme-200ml/
FILORGA oil-absolute 30ml,https://citymall-para.ma/produit/filorga-oil-absolute-30ml/
Garnier Gel Nettoyant Exfoliant Acnofight Anti – Boutons Aux Herbes – 100 mL,https://citymall-para.ma/produit/acno-fight-anti-boutons-gel-nettoyant-exfoliant-aux-herbes/
Garnier Men – Gel Nettoyant Acnofight Anti-Imperfections Au Wasabi – 100 ml,https://citymall-para.ma/produit/garnier-men-gel-nettoyant-acnofight-anti-imperfections-au-wasabi-100-ml/
Gilbert liniment soin nettoyant 250ml,https://citymall-para.ma/produit/gilbert-liniment-soin-nettoyant-250ml/
GPH Magnesium Marin 60CPS 548MG,https://citymall-para.ma/produit/gph-magnesium-marin-60cps-548mg/
Green Botanic Parfum Homme Forest Green 100ml,https://citymall-para.ma/produit/green-botanic-parfum-homme-forest-green-100ml/
Green Botanic Parfum Homme Stone 100ml,https://citymall-para.ma/produit/green-botanic-parfum-homme-stone-100ml/
Hartmann Confiance Men Absorption 14 Unités,https://citymall-para.ma/produit/hartmann-confiance-men3-14un-242113/
Hartmann Confiance Mobile 8G Taille L/Nuit,https://citymall-para.ma/produit/hartmann-confiance-mobile-8g-taille-l-nuit-ref-915723/
Hartmann Molipants Soft Slips L 3pcs,https://citymall-para.ma/produit/hartmann-molipants-soft-slips-l-3pcs-947807/
Hartmann Molipants Soft Slips M 3pcs,https://citymall-para.ma/produit/hartmann-molipants-soft-slips-m-3pcs-947806/
Helixience Soin Anti-tache Anti-Age,https://citymall-para.ma/produit/helixience-soin-anti-tache-anti-age/
L’orèal Mex Barber Club 3 En 1 Nettoyant,https://citymall-para.ma/produit/loreal-mex-barber-club-3-en-1-nettoyant/
L’orèal Mex Barber Club Creme Coiffante,https://citymall-para.ma/produit/loreal-mex-barber-club-creme-coiffante/
LUBRIMAX GEL LUBRIFIANT 60ML,https://citymall-para.ma/produit/lubrimax-gel-lubrifiant-60ml/
Lubrix Gel Lubrifiant 50Ml,https://citymall-para.ma/produit/lubrix-gel-lubrifiant-50ml/
Manix Contact Aloe Boite 14,https://citymall-para.ma/produit/manix-contact-aloe-boite-14/
Manix Contact Plus 10pcs,https://citymall-para.ma/produit/manix-contact-plus-12pcs/
Manix Contact Plus 6,https://citymall-para.ma/produit/manix-contact-plus-6/
Manix contact plus boite 24,https://citymall-para.ma/produit/manix-contact-plus-boite-24/
Manix Contact Plus Boite 3,https://citymall-para.ma/produit/manix-contact-plus-boite-3/
Manix Excitation Max Biote 12,https://citymall-para.ma/produit/manix-excitation-max-biote-14/
Manix Gel Aqua Aloe 80ml,https://citymall-para.ma/produit/manix-gel-aqua-aloe-80ml/
Manix Gel pure 80Ml,https://citymall-para.ma/produit/manix-gel-pure-80ml/
MANIX SKYN ELITE 10 PRÉSERVATIFS,https://citymall-para.ma/produit/manix-skyn-elite-10-preservatifs/
Manix Skyn Selection 9,https://citymall-para.ma/produit/manix-skyn-selection-9/
Manix Skyn Size Grand Taille 10,https://citymall-para.ma/produit/manix-skyn-size-grand-taille-10/
MANIX SUPERE 12 PRÉSERVATIFS,https://citymall-para.ma/produit/manix-super-28-preservatifs/
MANIX SUPER 4 PRÉSERVATIFS,https://citymall-para.ma/produit/manix-super-4-preservatifs/
Manix tentation 3Piéces,https://citymall-para.ma/produit/manix-tentation-3pieces/
Manix Tentations 14 Préservatifs,https://citymall-para.ma/produit/manix-tentations-14-preservatifs/
Manix Ultra Protect 12,https://citymall-para.ma/produit/manix-ultra-protect-14/
Manix Xtra Pleasure 3,https://citymall-para.ma/produit/manix-xtra-pleasure-3/
Manix Xtra Pleasure Double Extase 10,https://citymall-para.ma/produit/manix-xtra-pleasure-double-extase-12/
Manix Zero Excitant Pour Elle Et Lui /12,https://citymall-para.ma/produit/manix-zero-excitant-pour-elle-et-lui-12/
Men Ato Carbon Protect Ice Fresh 150ml,https://citymall-para.ma/produit/men-ato-carbon-protect-ice-fresh-150ml/
Men Ato Invincible 96 150ml,https://citymall-para.ma/produit/men-ato-invincible-96-150ml/
Men Ato Thermic Resist En Bleu 150ml,https://citymall-para.ma/produit/men-ato-thermic-resist-en-bleu-150ml/
Men Barber Club Huile Barbe,https://citymall-para.ma/produit/men-barber-club-huile-barbe/
Men Barber Club Soin Barbe,https://citymall-para.ma/produit/men-barber-club-soin-barbe/
Men Dche 300 Total Clean,https://citymall-para.ma/produit/men-dche-300-total-clean/
Men Dche300 Cool Power,https://citymall-para.ma/produit/men-dche300-cool-power/
Men Dche300 Hydra Sensitive,https://citymall-para.ma/produit/men-dche300-hydra-sensitive/
Men Dche300 Hydra.Energetic,https://citymall-para.ma/produit/men-dche300-hydra-energetic/
L’OREAL Men Dche300 Invincible Sport,https://citymall-para.ma/produit/men-dche300-invincible-sport/
Men Dche300 Stop Stress,https://citymall-para.ma/produit/men-dche300-stop-stress/
VICHY Men Mousse De Rasage Anti Irritation 200ml,https://citymall-para.ma/produit/men-mousse-de-rasage-anti-irritation-200ml/
Men Roll On Carbon Protect Ice Fresh,https://citymall-para.ma/produit/men-roll-on-carbon-protect-ice-fresh/
Men Roll On Cool Non Stop,https://citymall-para.ma/produit/men-roll-on-cool-non-stop/
Men Roll On Fresh Extreme,https://citymall-para.ma/produit/men-roll-on-fresh-extreme/
men roll on invincible 96h,https://citymall-para.ma/produit/men-roll-on-invincible-96h/
L’OREAL Men Roll On Invincible Sport,https://citymall-para.ma/produit/men-roll-on-invincible-sport/
Men Roll On Sos Shirt Green,https://citymall-para.ma/produit/men-roll-on-sos-shirt-green/
Men Roll On Stop Stress,https://citymall-para.ma/produit/men-roll-on-stop-stress/
Men Roll On Thermic Resist Bleu,https://citymall-para.ma/produit/men-roll-on-thermic-resist-bleu/
Mex Ato Extreme 150ml,https://citymall-para.ma/produit/mex-ato-extreme-150ml/
Mex Ato Sos Shirt Green 150ml,https://citymall-para.ma/produit/mex-ato-sos-shirt-green-150ml/
Mex Hydra Energetic Soin 50ml,https://citymall-para.ma/produit/mex-hydra-energetic-soin-50ml/
Nuxe Men Gel De Rasage 150ml,https://citymall-para.ma/produit/nuxe-men-gel-de-rasage-150ml/
Nuxe Men Gel Hydratant 50ml,https://citymall-para.ma/produit/nuxe-men-gel-hydratant-50ml/
Nuxe Merveillance Sérum 30ml,https://citymall-para.ma/produit/nuxe-merveillance-serum-30ml/
Nuxe Nuxuriance Gold Baume regard lumière 15 ml,https://citymall-para.ma/produit/nuxe-nuxuriance-gold-baume-regard-lumiere-15-ml/
Oil Control Anti-Brillance Gel Nettoyant Rafraîchissant Citron et Argile,https://citymall-para.ma/produit/oil-control-anti-brillance-gel-nettoyant-rafraichissant-citron-et-argile/
Ornature creme Eclaircissante Anti-age 50ml,https://citymall-para.ma/produit/ornature-creme-eclaircissante-anti-age-50ml/
Photowhite C20 serum vitamine c 30ml,https://citymall-para.ma/produit/photowhite-c20-serum-vitamine-c-30ml/
Power Fairness Eclaircissant Mousse A Raser et Gel Nettoyant Menthe & Argile blanche,https://citymall-para.ma/produit/power-fairness-eclaircissant-mousse-a-raser-et-gel-nettoyant-menthe-argile-blanche/
Pro vital Duo pack Vita C creme eclat & Serum+Dent Multi prevent,https://citymall-para.ma/produit/pro-vital-duo-pack-vita-c-creme-eclat-serumdent-multi-prevent/
Puressentiel Circulation Bain 100 Ml,https://citymall-para.ma/produit/puress-circulation-bain-100-ml/
Puriaderm creme hydratante riche 40ml,https://citymall-para.ma/produit/puriaderm-creme-hydratante-riche-40ml/
LA ROCHE POSAY TOLERIANE SENSITIVE 40ML,https://citymall-para.ma/produit/la-roche-posay-toleriane-sensitive-40ml/
Somat Homme Abdominaux Top Definition 200 Ml,https://citymall-para.ma/produit/somat-homme-abdominaux-top-definition-200-ml/
Uriage Xemose baume Oléo Apaisant Anti Grattage 500ml,https://citymall-para.ma/produit/uriage-xemose-baume-oleo-apaisant-anti-grattage-500ml/
Uriage Xemose Cerat Relipidant Anti-Irritations 200 ml,https://citymall-para.ma/produit/uriage-xemose-cerat-relipidant-anti-irritations-200-ml/
URIAGE XEMOSE SYNDET 200 ML,https://citymall-para.ma/produit/uriage-xemose-syndet-200-ml/
Uriage Xemose Syndet 500 ml,https://citymall-para.ma/produit/uriage-xemose-syndet-500-ml/
VICHY HOMME SENSI BAUME APRÈS-RASAGE APAISANT TUBE 75ML,https://citymall-para.ma/produit/vichy-homme-sensi-baume-apres-rasage-apaisant-tube-75ml/
Winner Capilev Barbe & Cheveux 60 Gélules,https://citymall-para.ma/produit/winner-capilev-barbe-cheveux-60-gelules/
