titre,url
A-Cérumen Spray Formule colorée Hygiène des oreilles 40ml,https://citymall-para.ma/produit/a-cerumen-spray-auriculaire-40-ml/
carefine aiguilles pour stylos d’insuline 32g*4 100 pcs,https://citymall-para.ma/produit/carefine-aiguilles-pour-stylos-dinsuline-32g4-100-pcs/
DIETAROMA 1 2 3 VITALITE 30 ML,https://citymall-para.ma/produit/dietaroma-1-2-3-vitalite-30-ml/
LANAFORM HAND WARMER Bouillotte rechargeable,https://citymall-para.ma/produit/lanaform-hand-warmer-bouillotte-rechargeable/
Surgygel Solution Hydroalcoolique Spray 100ml,https://citymall-para.ma/produit/surgygel-solution-hydroalcoolique-spray-100ml/
Bassin de lit,https://citymall-para.ma/produit/bassin-de-lit/
Contour Plus Bandelettes 50 pcs,https://citymall-para.ma/produit/contour-plus-bandelettes-50-pcs/
Déambulateur Articulé Pliable inox,https://citymall-para.ma/produit/deambulateur-articule-pliable-inox/
ERIC FAVRE LACTOBACILLUS GASSERI 30 caps,https://citymall-para.ma/produit/eric-favre-lactobacillus-gasseri-30-caps/
TG MEDICAL GANT LATEX 7.5,https://citymall-para.ma/produit/tg-medical-gant-latex-7-5/
3M Opticlude Junior- 20 Pansements,https://citymall-para.ma/produit/3m-opticlude-junior-20-pansements/
Accu-Check Safe-T-Pro Uno Lancettes X200,https://citymall-para.ma/produit/accu-check-safe-t-pro-uno-lancettes-x200/
A-Cérumen Spray Formule colorée Hygiène des oreilles 40ml,https://citymall-para.ma/produit/a-cerumen-spray-auriculaire-40-ml/
carefine aiguilles pour stylos d’insuline 32g*4 100 pcs,https://citymall-para.ma/produit/carefine-aiguilles-pour-stylos-dinsuline-32g4-100-pcs/
DIETAROMA 1 2 3 VITALITE 30 ML,https://citymall-para.ma/produit/dietaroma-1-2-3-vitalite-30-ml/
LANAFORM HAND WARMER Bouillotte rechargeable,https://citymall-para.ma/produit/lanaform-hand-warmer-bouillotte-rechargeable/
Surgygel Solution Hydroalcoolique Spray 100ml,https://citymall-para.ma/produit/surgygel-solution-hydroalcoolique-spray-100ml/
Bassin de lit,https://citymall-para.ma/produit/bassin-de-lit/
Contour Plus Bandelettes 50 pcs,https://citymall-para.ma/produit/contour-plus-bandelettes-50-pcs/
Déambulateur Articulé Pliable inox,https://citymall-para.ma/produit/deambulateur-articule-pliable-inox/
ERIC FAVRE LACTOBACILLUS GASSERI 30 caps,https://citymall-para.ma/produit/eric-favre-lactobacillus-gasseri-30-caps/
TG MEDICAL GANT LATEX 7.5,https://citymall-para.ma/produit/tg-medical-gant-latex-7-5/
3M Opticlude Junior- 20 Pansements,https://citymall-para.ma/produit/3m-opticlude-junior-20-pansements/
Accu-Check Safe-T-Pro Uno Lancettes X200,https://citymall-para.ma/produit/accu-check-safe-t-pro-uno-lancettes-x200/
ACCU-CHEK BANDELETTES X25,https://citymall-para.ma/produit/accu-chek-bandelettes-x25/
ACCU-CHEK INSTANT BANDELETTES RÉACTIVES 50,https://citymall-para.ma/produit/accu-chek-instant-bandelettes-reactives-50/
ACCU-CHEK Performa Bandelettes 50,https://citymall-para.ma/produit/accu-chek-performa-bandelettes-50/
ACCU-CHEK SOFTCLIX LANCETTE 200 UNITÉS,https://citymall-para.ma/produit/accu-chek-softclix-lancette-200-unites/
ACTIDiET Phaners 30 Gélules,https://citymall-para.ma/produit/actidiet-phaners-30-gelules/
ADDERMIS Gants Biactiv 40,https://citymall-para.ma/produit/addermis-gants-biactiv-40/
Additiva Multivitamines 20 Comprimes goût Mandarine,https://citymall-para.ma/produit/additiva-multivitamines-20-comprimes-gout-mandarine/
Additiva Multivitamines 20 comprimes goût Mangue,https://citymall-para.ma/produit/additiva-multivitamines-20-comprimes-gout-mangue/
Additiva Multivitamines 20 Comprimes goût Orange,https://citymall-para.ma/produit/additiva-multivitamines-20-comprimes-gout-orange/
Additiva Multivitamines 20 Comprimes goût Pêche,https://citymall-para.ma/produit/additiva-multivitamines-20-comprimes-gout-peche/
Algoflex Gel 100ml,https://citymall-para.ma/produit/algoflex-gel-100ml/
AMAN Lancets 50U 28G 1.5MM,https://citymall-para.ma/produit/aman-lancets-50u-28g-1-5mm/
Apex – Oxymètre de doigt,https://citymall-para.ma/produit/apex-oxymetre-de-doigt/
Appetilux Sirop Stimuler L’appétit 150ml,https://citymall-para.ma/produit/appetilux-sirop-stimuler-lappetit-150ml/
ARNIDOL Gel de Massage 100ml,https://citymall-para.ma/produit/arnidol-gel-de-massage-100ml/
Assanis 80ml Coco-Vanille,https://citymall-para.ma/produit/assanis-80ml-coco-vanille/
Aurafix Hallux Valgus Ao-09,https://citymall-para.ma/produit/aurafix-hallux-valgus-ao-09/
Bandage Alcoolisé au Menthol 10cm*2.6m,https://citymall-para.ma/produit/bandage-alcoolise-au-menthol-10cm2-6m/
Bandelette Urinaire INSIGHT XPERT  5P 100 unités,https://citymall-para.ma/produit/bandelette-urinaire-insight-xpert-5p-100-unites/
Bandelette Urinaire INSIGHT XPERT 11p 100 unités,https://citymall-para.ma/produit/bandelette-urinaire-insight-xpert-11p-100-unites/
Bdm Ibra Fine Aig 4mm 32 g /50,https://citymall-para.ma/produit/aig-bdm-ibra-fine-4mm-32-g-50/
Bdm Ibra Fine Aig 6mm 31g /50,https://citymall-para.ma/produit/aig-bdm-ibra-fine-6mm-31g-50/
Béquilles D’aisselles à Hauteur Variable 1 Ps,https://citymall-para.ma/produit/bequilles-daisselles-a-hauteur-variable-1-ps/
Berger Ceinture Abdominal Noir Avec Ateille Standard BG-402,https://citymall-para.ma/produit/berger-ceinture-abdominal-noir-avec-ateille-standard-bg-402/
Berger Collier Cervical Nelsone Taille 2 BG-102-2,https://citymall-para.ma/produit/berger-collier-cervical-nelsone-taille-2-bg-102-2/
Beurer Appareil De Massage Anti-Cellulite Palper Rouler CM50,https://citymall-para.ma/produit/beurer-appareil-de-massage-anti-cellulite-palper-rouler-cm50/
BEURER TENSIOMÈTRE À POIGNET BC-28,https://citymall-para.ma/produit/beurer-tensiometre-a-poignet-bc-28/
BIFLEX Gel Relaxant et Chauffant 100g,https://citymall-para.ma/produit/biflex-gel-relaxant-et-chauffant-100g/
BIODERMA PIGMENTBIO DAILY CARE SPF 50 40ML ACHETE + PIGMENTBIO H20 EAU MICELLAIRE 250 ML OFFERT,https://citymall-para.ma/produit/bioderma-pigmentbio-daily-care-spf-50-40ml-achete-pigmentbio-h20-eau-micellaire-250-ml-offert/
Biofar Kids Multivitamines Boite 20CP,https://citymall-para.ma/produit/biofar-kids-multivitamines-boite-20cp/
BIOFOOD Sirop D’agave Bio 250ML,https://citymall-para.ma/produit/biofood-sirop-dagave-bio-250ml/
BIONIME 25 BANDELETTES DE TEST DE GLYCÉMIE GS260,https://citymall-para.ma/produit/bionime-25-bandelettes-de-test-de-glycemie-gs260/
BIONIME Rightest Wiz Kit GS570,https://citymall-para.ma/produit/bionime-rightest-wiz-kit-gs570/
Biostop Anti-Poux Lotion 100ml,https://citymall-para.ma/produit/biostop-anti-poux-lotion-100ml/
BIOSTOP Bracelet Anti-moustiques,https://citymall-para.ma/produit/biostop-bracelet-anti-moustiques/
Biostop Spray Anti-Moustiques 100ml,https://citymall-para.ma/produit/biostop-spray-anti-moustiques-100ml/
BIPLAST Bande adhésive de contention pour strapping,https://citymall-para.ma/produit/biplast-bande-adhesive-de-contention-pour-strapping/
Bock à lavement complet,https://citymall-para.ma/produit/bock-a-lavement-complet/
Body Fine Elastic Poignet,https://citymall-para.ma/produit/body-fine-elastic-poignet-m-2/
Brosse à dents Gum Junior 6+,https://citymall-para.ma/produit/brosse-a-dents-gum-junior-6/
CAMOMILLA BLU INTIMO ROSA GEL NETTOYANT INTIME PH 8.5 300ML,https://citymall-para.ma/produit/camomilla-blu-intimo-rosa-nettoyant-intime-apaisant-ph-8-5/
Capiderma Capiphan Ongles & Cheveux 60capsules,https://citymall-para.ma/produit/capiderma-capiphan-ongles-cheveux-60capsules/
Caresens Dual Lecture De Glycemie,https://citymall-para.ma/produit/caresens-dual-lecture-de-glycemie/
Carex Preservatif Classique x3,https://citymall-para.ma/produit/carex-preservatif-classique-x3/
Ciseaux à pansements 14 cm,https://citymall-para.ma/produit/ciseaux-a-pansements-14-cm/
CLEVER-CHEK Blanc 100 Lancette,https://citymall-para.ma/produit/clever-chek-blanc-100-lancette/
Codexial enviroscab aerosol antiparasitaire 200ml,https://citymall-para.ma/produit/codexial-enviroscab-aerosol-antiparasitaire-200ml/
Contour Plus Appareil,https://citymall-para.ma/produit/contour-plus-appareil/
Contour Plus Kit,https://citymall-para.ma/produit/contour-plus-kit/
Coralys Solution Application  15ml,https://citymall-para.ma/produit/coralys-solution-application-15ml/
Correcteur Hallux Valgus Nuit -10,https://citymall-para.ma/produit/correcteur-hallux-valgus-nuit-10/
Cosmopor E Hartmann Pansements Adhésifs Stériles,https://citymall-para.ma/produit/cosmopor-e-hartmann-pansements-adhesifs-steriles/
CURAPROX Cps 06 Prime Plus Turquoise,https://citymall-para.ma/produit/curaprox-cps-06-prime-plus-turquoise/
Damhert Feuilles d’ortie tisane 20 sachets,https://citymall-para.ma/produit/damhert-feuilles-dortie-tisane-20-sachets/
Damhert Sans sucres tagatesse edulcorant 500g,https://citymall-para.ma/produit/damhert-sans-sucres-tagatesse-edulcorant-500g/
Damhert Sans sucres tagatesse sticks,https://citymall-para.ma/produit/damhert-sans-sucres-tagatesse-sticks/
Damhert Tisane Bonne Nuit 20 Sachets,https://citymall-para.ma/produit/damhert-tisane-bonne-nuit-20-sachets/
Damhert Tisane Fenouil 20 sachets,https://citymall-para.ma/produit/damhert-tisane-fenouil-20-sachets/
Damhert Tisane Stimule transit 20 sachets Favorise,https://citymall-para.ma/produit/damhert-tisane-stimule-transit-20-sachets-favorise/
Derma Soin Spray Alcool 70° – 50 ml,https://citymall-para.ma/produit/derma-soin-spray-alcool-70-50-ml/
Dermaskin soin des verrues cors et durillons,https://citymall-para.ma/produit/dermaskin-soin-des-verrues-cors-et-durillons/
Devas Gilet Dorso-Lombaire Taille Standard,https://citymall-para.ma/produit/devas-gilet-dorso-lombaire-taille-standard/
DEVAS ORTHOPEDIE CHEVILLÈRE STANDARD,https://citymall-para.ma/produit/devas-orthopedie-chevillere-standard/
Diab Control Bandelettes 50 Unités,https://citymall-para.ma/produit/diab-control-bandelettes-50-unites/
Diabcontrol Bandelettes 25 Unités pour appareil glycémie,https://citymall-para.ma/produit/diabcontrol-bandelettes-25-unites-pour-appareil-glycemie/
Diabcontrol Lecteur De Glycemie 10 Bandelettes+10 Lancettes,https://citymall-para.ma/produit/diabcontrol-lecteur-de-glycemie-10-bandelettes10-lancettes/
Dietaroma Capligne konjac et chrome 40 gelules,https://citymall-para.ma/produit/dietaroma-capligne-konjac-et-chrome-40-gelules/
DIETAROMA Digestion 20 Ampoules 10ML,https://citymall-para.ma/produit/dietaroma-digestion-20-ampoules/
DIETAROMA Drain Ideal Bio  3ooML B20 Ampoules,https://citymall-para.ma/produit/dietaroma-drain-ideal-20ampls/
DIETAROMA PROSTATE 60 CAPSULES,https://citymall-para.ma/produit/dietaroma-prostate-60cps/
Dietaroma Tisane Transit 20 Sachets,https://citymall-para.ma/produit/dietaroma-tisane-transit-20-sachets/
DIFFUSEUR Huile Essentielle Framboise Jasmine,https://citymall-para.ma/produit/diffuseur-h-essent-framboise-jasmine/
DIFFUSEUR Huile Essentielle Noir Jasmine,https://citymall-para.ma/produit/diffuseur-h-essent-noir-jasmine/
Ducray Diaseptyl spray peaux abimes 125ml,https://citymall-para.ma/produit/ducray-diaseptyl-spray-peaux-abimes-125ml/
EAU OXYGÉNÉE Stabilisée 10 Volumes 125ML,https://citymall-para.ma/produit/eau-oxygenee-stabilisee-10-volumes-125-ml/
Eco Silver Varises Stocking Thight 9230 – Open/Close Toe,https://citymall-para.ma/produit/eco-silver-varises-stocking-thight-9230-open-close-toe/
ELANCYL Gel Concentre Minceur 200ML,https://citymall-para.ma/produit/elancyl-gel-concentre-minceur-200ml/
ELANCYL My Coach Soin Anti Cellulite 200ML,https://citymall-para.ma/produit/elancyl-my-coach-soin-anti-cellulite-200ml/
ELANCYL Slim Design Cellulite Nuit 200ML,https://citymall-para.ma/produit/elancyl-slim-design-cellulite-nuit-200ml/
ELANCYL Slim Design Huile Minceur Cellulite 150ML,https://citymall-para.ma/produit/elancyl-slim-design-huile-minceur-cellulite-150ml/
Extraform Sirop Appétit Et Vitalité 200 Ml,https://citymall-para.ma/produit/extraform-sirop-appetit-et-vitalite-200-ml/
Farlin bout de sein silicon bf-631,https://citymall-para.ma/produit/farlin-bout-de-sein-silicon-bf-631/
Fixa C Vitamine C 30 Gelules,https://citymall-para.ma/produit/fixa-c-vitamine-c-30-gelules/
FLAVY Huile De Citronnelle 60ml,https://citymall-para.ma/produit/flavy-huile-de-citronnelle-60ml/
FORTE PHARMA Aela Rose Biota 28 Comprimés,https://citymall-para.ma/produit/aela-rose-biota-28-comprimes-forte-pharma/
Forte Pharma Turbo Draine Minceur Gout Peche 500ML,https://citymall-para.ma/produit/forte-pharma-turbo-draine-minceur-gout-peche-500-ml/
Frotte Dos Tonic Rituels D’orient,https://citymall-para.ma/produit/frotte-dos-tonic-rituels-dorient/
GAINE Polytex Taille 1,https://citymall-para.ma/produit/gaine-polytex-taille-1/
GAINE Polytex Taille 2,https://citymall-para.ma/produit/gaine-polytex-taille-2/
GAINE Polytex Taille 3,https://citymall-para.ma/produit/gaine-polytex-taille-3/
GAINE Polytex Taille 4,https://citymall-para.ma/produit/gaine-polytex-taille-4/
GAINE Polytex Taille 5,https://citymall-para.ma/produit/gaine-polytex-taille-5/
Gant Chirurg 7 Pristeen,https://citymall-para.ma/produit/gant-chirurg-7-pristeen/
Gants Touchflex Nitrile bleu Large,https://citymall-para.ma/produit/gants-touchflex-nitrile-bleu/
Gants Touchflex Nitrile bleu Médium,https://citymall-para.ma/produit/gants-touchflex-nitrile-bleu-medium/
Gayelord Hauser Levure De biere + Selenium 400 comprimés,https://citymall-para.ma/produit/gayelord-hauser-levure-de-biere-selenium-400-comprimes/
Gel Antibactérien Sans Rinçage Pomme Poire 20ml,https://citymall-para.ma/produit/gel-antibacterien-sans-rincage-pomme-poire-20ml/
Gel Antibactérien Sans Rinçage Pomme Poire 80ml,https://citymall-para.ma/produit/gel-antibacterien-sans-rincage-pomme-poire-80ml/
Gel Ecographie 5L,https://citymall-para.ma/produit/gel-ecographie-5l/
Gph Curcuma 250 mg 200 Gelules,https://citymall-para.ma/produit/gph-curcuma-250-mg-200-gelules/
Gph Diffusion Desmodium Bio 100 Gélules,https://citymall-para.ma/produit/gph-diffusion-desmodium-bio-200-gelules/
Gph Diffusion Huile Essentielle Cannelle 10ML,https://citymall-para.ma/produit/gph-diffusion-huile-essentielle-cannelle-10ml/
Gph Diffusion Huile Essentielle Citronnelle 10ml,https://citymall-para.ma/produit/gph-diffusion-huile-essentielle-citronnelle-10ml/
Gph Diffusion Huile Essentielle D’eucalyptus Radiata 10ml,https://citymall-para.ma/produit/gph-diffusion-huile-essentielle-deucalyptus-radiata-10ml/
Gph Diffusion Huile Essentielle Eucalyptus Globulus 10ml,https://citymall-para.ma/produit/gph-diffusion-huile-essentielle-eucalyptus-globulus-10ml/
Gph Diffusion Huile Essentielle Menthe Poivree 10ml,https://citymall-para.ma/produit/gph-diffusion-huile-essentielle-menthe-poivree-10ml/
Gph Diffusion Nopal 100 Gélules,https://citymall-para.ma/produit/gph-diffusion-nopal-100-gelules/
Gph Huile Essent Citron Bio 10ml,https://citymall-para.ma/produit/gph-huile-essent-citron-bio-10ml/
Gum Activital Brosse à Dents Medium 583,https://citymall-para.ma/produit/gum-activital-brosse-a-dents-medium-583/
GUM Activital Brosse à Dents Souple 581,https://citymall-para.ma/produit/gum-activital-brosse-a-dents-souple-581/
GUM Aftaclear Bain de Bouche 120ML,https://citymall-para.ma/produit/gum-aftaclear-bain-de-bouche-120ml/
GUM Baby Brosse à Dents Bébé 0-2ans 213,https://citymall-para.ma/produit/gum-baby-brosse-a-dents-bebe-0-2ans-213/
GUM Bad Micro Tip R475,https://citymall-para.ma/produit/gum-bad-micro-tip-r475/
Gum Bi-Direction Brossette Interdentaire 1.2mm Fine 6 Pièces,https://citymall-para.ma/produit/gum-bi-direction-brossette-interdentaire-1-2mm-fine-6-pieces/
GUM Bi-Direction Brossettes 6×0.9 bleu 2314,https://citymall-para.ma/produit/gum-bi-direction-brossettes-6x0-9-bleu-2314/
"Gum Bi-Direction Interdental Brush 0,7 mm 6 pieces",https://citymall-para.ma/produit/gum-bi-direction-interdental-brush-07-mm-6-pieces/
GUM BAD CLASSIC 411,https://citymall-para.ma/produit/gum-brosse-a-dent-classique-souple-411/
GUM Brosse à Dents Activital Ultra Compacte Souple 585,https://citymall-para.ma/produit/gum-brosse-a-dents-activital-ultra-compacte-souple-585/
GUM Brosse à dents Kids 2-6 ans,https://citymall-para.ma/produit/gum-brosse-a-dents-kids-2-6-ans/
GUM Brosse à Dents Timer Light Souple – 7/9 ans,https://citymall-para.ma/produit/gum-brosse-a-dents-timer-light-souple-7-9-ans/
Gum Brossettes Interdentaire 4 unités 1.6mm 1614,https://citymall-para.ma/produit/gum-brossettes-interdentaire-4-unites-1-6mm-1614/
Gum Brossettes Interdentaires Bi-Direction 0.6 mm x6,https://citymall-para.ma/produit/gum-brossettes-interdentaires-bi-direction-0-6-mm-x6/
Gum Brossettes Interdentaires Bi-Direction 1.4 mm x6,https://citymall-para.ma/produit/gum-brossettes-interdentaires-bi-direction-1-4-mm-x6/
Gum End-Tuft Brosse à Dents 308,https://citymall-para.ma/produit/gum-end-tuft-brosse-a-dents-308/
GUM Manche click kit porte brossettes R625,https://citymall-para.ma/produit/gum-manche-click-kit-porte-brossettes-r625/
GUM Original White Brosse à Dents Medium 563,https://citymall-para.ma/produit/gum-original-white-brosse-a-dents-medium-563/
GUM Proxabrush 1.6 R624,https://citymall-para.ma/produit/gum-proxabrush-1-6-r624/
GUM Proxabrush Classic R605,https://citymall-para.ma/produit/gum-proxabrush-classic-r605/
GUM Trav-Ler 10 Brossettes Interdentaires,https://citymall-para.ma/produit/gum-trav-ler-10-brossettes-interdentaires/
GUM Trav-Ler 4 Brossettes 0.6mm 1312,https://citymall-para.ma/produit/gum-trav-ler-4-brossettes-0-6mm-1312/
GUM Trav-Ler Brossettes Interdentaires 1314 x4,https://citymall-para.ma/produit/gum-trav-ler-brossettes-interdentaires-1314-x4/
"GUM Trav-Ler Brossettes Interdentaires 1412 0,9mm x4",https://citymall-para.ma/produit/gum-trav-ler-brossettes-interdentaires-1412-09mm-x4/
GUM Trav-Ler Brossettes Interdentaires 1414 1.1mm x4,https://citymall-para.ma/produit/gum-trav-ler-brossettes-interdentaires-1414-1-1mm-x4/
"GUM Trav-Ler Brossettes Interdentaires 1512 1,2mm x4",https://citymall-para.ma/produit/gum-trav-ler-brossettes-interdentaires-1512-12mm-x4/
GUM Trav-Ler Brossettes Interdentaires 1514 x4,https://citymall-para.ma/produit/gum-trav-ler-brossettes-interdentaires-1514-x4/
"GUM Trav-Ler Brossettes Interdentaires 1612 1,4mm x4",https://citymall-para.ma/produit/gum-trav-ler-brossettes-interdentaires-1612-14mm-x4/
GUM Trav-Ler Brossettes Interdentaires 1618 2mm x4,https://citymall-para.ma/produit/gum-trav-ler-brossettes-interdentaires-1618-2mm-x4/
H Control Crème Apaise Et Reduit 30G,https://citymall-para.ma/produit/h-control-creme-apaise-et-reduit-30g/
HARPAMAX 15 Sticks,https://citymall-para.ma/produit/harpamax-stick-15/
HARPAMAX 30 Sticks,https://citymall-para.ma/produit/harpamax-sticks-30/
HARPAMAX Gel 30G,https://citymall-para.ma/produit/harpamax-gel-30g/
HARPAMAX Gel 60G,https://citymall-para.ma/produit/harpamax-gel-60g/
Hartmann Confiance Lady Absorption 4 Protection Anatomique x14,https://citymall-para.ma/produit/hartmann-confiance-lady-absorption-4-protection-anatomique-x14/
HARTMANN Dermaplast Classic 6*10CM/10PCS,https://citymall-para.ma/produit/hartmann-dermaplast-classic-610cm-10pcs/
Hartmann DermaPlast Water Résistant 2 Tailles 20 Pièces,https://citymall-para.ma/produit/hartmann-dermaplast-water-resistant-2-tailles-20-pieces/
HARTMANN Hydrocoll Pansement Hydroactifs 7.5 x 7.5 cm 10 Unités,https://citymall-para.ma/produit/hartmann-hydrocoll-pansement-hydroactifs-7-5-x-7-5-cm-10-unites/
Hartmann Hydrofilm 10*12.5cm 10 Unité,https://citymall-para.ma/produit/hartmann-hydrofilm-1012-5cm-10-unite/
HARTMANN HYDROFILM Pansement Transparent Adhésive 6cmx7cm,https://citymall-para.ma/produit/hartmann-hydrofilm-pansement-transparent-adhesive-6cmx7cm/
Hartmann Veroval compact tensiometre de bras 925422,https://citymall-para.ma/produit/hartmann-veroval-compact-tensiometre-de-bras-925422/
Hartmann veroval tensiomètre de bras 925302,https://citymall-para.ma/produit/hartmann-veroval-tensiometre-de-bras-925302-2/
HELIOCARE Oral Capsules Ultra D 30 Gélules,https://citymall-para.ma/produit/heliocare-oral-capsules-ultra-d-30-gelules/
HONIX Gelee Royal 2000 MG 10x10ML,https://citymall-para.ma/produit/honix-gelee-royal-2000-mg-10x10-ml/
Hydrogel Alcoholic Menthol Bandage 7.5cm*2m,https://citymall-para.ma/produit/hydrogel-alcoholic-menthol-bandage/
HYDROGEL PATCH Thérapie Bi-Thermale Patch Médical 10cm*20cm,https://citymall-para.ma/produit/hydrogel-patch-therapie-bi-thermale-patch-medical-10cm20cm/
HYDROGEL PATCH Thérapie Bi-Thermale Patch Médical 15cm*25cm bte de 5 unite,https://citymall-para.ma/produit/hydrogel-patch-therapie-bi-thermale-patch-medical-15cm25cm/
IALUSET Stérile Imprégnée à Base D’acide Hyaluronique Boite de 10,https://citymall-para.ma/produit/bte-10-sterile-impregnee-a-base-dacide-hyaluronique/
Indoka Vitamine C Ascorbia 90 Comprimes,https://citymall-para.ma/produit/indoka-vitamine-c-ascorbia-90-comprimes/
Intranule Catheter Intraveineux Intranule Bleu 22G,https://citymall-para.ma/produit/intranule-catheter-intraveineux-intranule-bleu-22g/
Intranule Catheter Intraveineux Intranule Jaune 24G,https://citymall-para.ma/produit/intranule-catheter-intraveineux-intranule-jaune-24g/
Irovit – 30 Capsules,https://citymall-para.ma/produit/irovit-30-capsules/
Johnson Coton Tiges 100 unités,https://citymall-para.ma/produit/johnson-coton-tiges-100-unites/
Juvatonus Ginseng Taurine Effervescent 15cps,https://citymall-para.ma/produit/juvatonus-ginseng-taurine-effervescent-15cps/
Juvatonus Ginseng Taurine Effervescent 30cps,https://citymall-para.ma/produit/juvatonus-ginseng-taurine-effervescent-30cps/
JuvaTonus Ginseng Tonus- 10 Ampoule,https://citymall-para.ma/produit/juvatonus-ginseng-tonus-10-ampoule/
Juvavit 15 Comprimes Effervescents,https://citymall-para.ma/produit/juvavit-15-comprimes-effervescents/
JUVAVIT Effervescents 30 Comprimés,https://citymall-para.ma/produit/juvavit-30-comprimes-effervescents/
Kaline k-intim gel intime 250ml,https://citymall-para.ma/produit/kaline-k-intim-gel-intime-250ml/
Kaline Moustispray Action Prolongee 50 ml,https://citymall-para.ma/produit/kaline-moustispray-action-prolongee-50-ml/
Keragene Comprimés 60 Gelule,https://citymall-para.ma/produit/keragene-comprimes-60-gelule/
Konfort Tensiomètre Automatique Poignet Ref bp-55g,https://citymall-para.ma/produit/konfort-tensiometre-automatique-poignet-ref-bp-55g/
Lanaform Anti-Rides Visage+,https://citymall-para.ma/produit/lanaform-anti-rides-visage/
Lanaform Panty Mass&Slim S,https://citymall-para.ma/produit/lanaform-panty-massslim-s/
Lecteur de glycémie Bionime GM260,https://citymall-para.ma/produit/lecteur-de-glycemie-bionime-gm260/
Les 3 Chênes Cystinat Confort Urinaire 28 Comprimés,https://citymall-para.ma/produit/3-chenes-cystinat-28-cp/
Lili care bonnet de bain,https://citymall-para.ma/produit/lili-care-bonnet-de-bain/
LUBRIX Gel Lubrifiant Aloe Vera 50ML,https://citymall-para.ma/produit/lubrix-gel-lubrifiant-aloe-vera-50ml/
Maelys Fer Vitamine B9 30 Gelules,https://citymall-para.ma/produit/maelys-fer-vitamine-b9-30-gelules/
Magnésium 300mg 20 Comprimes effervescente,https://citymall-para.ma/produit/magnesium-300mg-20-comprimes-effervescente/
MAMAJOO Réchauffeur LCD numérique 3en1,https://citymall-para.ma/produit/mamajoo-rechauffeur-lcd-numerique-3en1/
MAMAJOO Sterilisateur 5en1 Vapeur Numerique,https://citymall-para.ma/produit/mamajoo-sterilisateur-5en1-vapeur-numerique/
MANIX King Size Max 14 Préservatifs,https://citymall-para.ma/produit/manix-king-size-max-14-preservatifs/
MANIX SUPER PRÉSERVATIF EN BOÎTE DE 12,https://citymall-para.ma/produit/manix-super-preservatif-en-boite-de-12/
MAXI G 20 Comprimes Effervescents,https://citymall-para.ma/produit/maxi-g-20-comprimes-effervescents/
LANAFORM  Chancelière chauffe-pieds Foot Warmer,https://citymall-para.ma/produit/medisana-fws-chauffe-pieds/
Megaplast Special Pansement Naseaux 10unites,https://citymall-para.ma/produit/megaplast-special-pansement-naseaux-10unites/
MGD Body Draine 500 ml,https://citymall-para.ma/produit/mgd-body-draine-500-ml/
MGD Nature Ace Selenium 60 Gélules,https://citymall-para.ma/produit/mgd-nature-ace-selenium-60-gelules/
MGD Nature Acerola Citron 30 Gélules,https://citymall-para.ma/produit/mgd-nature-acerola-citron-30-gelules/
Miradent Dento Box bleu 2751,https://citymall-para.ma/produit/miradent-dento-box-bleu-2751/
Multivit Energie Gelée Royale & Vitamin C Sirop 150ml,https://citymall-para.ma/produit/multivit-energie-gelee-royale-vitamin-c-sirop-150ml/
Multivit Protect Gelée Royale & Propolis Sirop 150ml,https://citymall-para.ma/produit/multivit-protect-gelee-royale-propolis-sirop-150ml/
NATURE SOIN Huile d’Arachide 50 ML,https://citymall-para.ma/produit/nature-soin-huile-darachide-50-ml/
Naturesoin Huile à L’extrait D’aloés – 50ML,https://citymall-para.ma/produit/naturesoin-huile-a-lextrait-daloes-50ml/
NaturEsoin Huile à l’Extrait De Fenugrec,https://citymall-para.ma/produit/naturesoin-huile-a-lextrait-de-fenugrec/
Naturesoin Huile à L’extrait De Fenugrec – 50ML,https://citymall-para.ma/produit/naturesoin-huile-a-lextrait-de-fenugrec-50ml/
NATURESOIN Huile d’Ail 50ML,https://citymall-para.ma/produit/naturesoin-huile-dail-50ml/
NATURESOIN Huile d’Aloe Verra 50ML,https://citymall-para.ma/produit/naturesoin-huile-daloe-verra-50ml/
NATURESOIN Huile D’Amande Douce Vierge 50ML,https://citymall-para.ma/produit/naturesoin-huile-damande-douce-vierge-50ml/
NATURESOIN Huile d’Amandes Amères Vierge 50ML,https://citymall-para.ma/produit/naturesoin-huile-damandes-ameres-vierge-50ml-2/
NATURESOIN Huile d’Argan Torréfiée 50ML,https://citymall-para.ma/produit/naturesoin-huile-dargan-torrefiee-50ml/
NATURESOIN Huile d’Eucalyptus 50ML,https://citymall-para.ma/produit/naturesoin-huile-deucalyptus-50ml-2/
NaturEsoin Huile d’orange 50 ml,https://citymall-para.ma/produit/naturesoin-huile-dorange-50-ml/
NaturEsoin Huile D’Olive – 50 Ml,https://citymall-para.ma/produit/naturesoin-huile-dolive-50-ml/
NATURESOIN Huile de Basilic 50ML,https://citymall-para.ma/produit/naturesoin-huile-de-basilic-50ml/
NATURESOIN Huile de Bourrache 50ML,https://citymall-para.ma/produit/naturesoin-huile-de-bourrache-50ml/
